comment,biden_stance,trump_stance
also im type one diabetic i work for sutter hospital in ca and im paying 95 for insulin each i dont know where this low cost is coming from and im paying over 100 for my dexcom supply where do i get the 35 discount price just asking,NONE,NONE
when he says hes made these jobs are they counting ai because homeless is very high and everywhere has automated robots so are they counting robots as people im just wandering,NONE,NONE
for the honest for truth for biden 2024,FAVOR,NONE
i have attention deficit disorder deafitis i cant sit through this difficult listening sorry im on ssi,NONE,NONE
my president the traitors party who dont believe in government our laws and our constitution will be shown the door in november,FAVOR,FAVOR
i vote for president biden for 2024 to 2028,FAVOR,NONE
fghirraim news live fhaaogg mashallah rgf,NONE,NONE
your note dektator and kinack le one contry,NONE,NONE
thay are your arab man for women produktion amirika viagra,NONE,NONE
what economy is he speaking of inflation is crazy,AGAINST,NONE
and kinack teror and qatar knife thay are waite mahdiarmé have note mahdiarmé jawel,NONE,NONE
what wire for hexa peaple som see oute som telekom sand skepp qran to wc this is note ralion for me,NONE,NONE
good evening mr president baiden 4 more years first god yes it will be you but you have to stop the bullshit of teump with arizona he is no one to say that the ladies are there with the question of whether they abort or not thats it your decision mr president that trump has to pay for the police officers who died in the capitol,FAVOR,AGAINST
thats a different guy sitting behind biden what happened to the other guy,AGAINST,NONE
this was a great speech gave me chills,FAVOR,NONE
connecting ivf and roe vs wade is incompetentintentional overturning rvw was to prevent murders while ivf is to create life the intentional buffoonery of the crossovers here is so obvious that it is disheartening,FAVOR,AGAINST
adderalljoe is cranking up the volume in this messy word salad speech poor america,AGAINST,NONE
cool yes thanks you soy math you démocrates of américain,FAVOR,NONE
yes thanks you fort,NONE,NONE
thanks you verry math you président barack obama of chicago bulls américain,NONE,NONE
thanks you soy math,NONE,FAVOR
and président kamala harris of california usa,FAVOR,NONE
laugh now there will be tears in november,FAVOR,AGAINST
john kennedy is president usarodoffe mckennedy crazy we only luck about you,NONE,NONE
thanks you for understand me and sorry about i say bad about opa john,NONE,NONE
newt gingrich biden is violating the law every day httpsyoutubenujbrebi1o8sitpj1gres2mzu1vh,NONE,NONE
i only lern lern lern and want understand and help business home,NONE,NONE
i know onlyi am from germany and care usa same not to be about winni know what i do about usa germany,NONE,NONE
respectedsirmodijiindiatakecairfinanee5rsiamnahimillagaiamnoprofitepleseiamrespectedbidensirfullsapportethankyousomach,FAVOR,NONE
cricket joe biden dont even know how to run a nation,AGAINST,NONE
biden speaks and the wisdom enshrined in the entire speech is what matters there are visible indications of victory for the democrats,FAVOR,AGAINST
if he really did think that putin wanted world dominance there would be boots on the ground instead of being satisfied with sacrificing a whole generation of ukrainians while the military ind complex grew rich and when gorbachev did tear down the wall and disband the warsaw pact it was on the promise that nato would not move an inch further east all this while bidens family grow rich on dodgy dealings with ukraine and china utterly shameful and yet again the innocent suffer while psychopaths play geopolitics,AGAINST,NONE
this is why trump wanted to build the wall,NONE,FAVOR
whos this guy and whatd you do with brandon,NONE,AGAINST
omg this is a bunch of warmongering idiots how did it come to this,NONE,NONE
623 biden says we must be honest the threat to democracy must be defended after that stunning revelation biden sounds off on insurrection propaganda as if someone anyone has been charged with insurrection and speaker johnson can barely keep a straight face,FAVOR,AGAINST
i love joe biden and his speech he tells the truth straight out dont lie like donald j trump great speech go joe go,FAVOR,AGAINST
626 this dude literally said and i quote the threat to democracy must be defended i cant believe this is real americans will all have to stand up against the biden administration one day and the sooner the better,AGAINST,FAVOR
thanks you soy math,NONE,FAVOR
i cant remember ever watching from start to finish one of these in the history of my 45 years of voting age and i wouldnt tear myself away from this one great speech biden showed the reason he has been in politics all these years and brought that experience to the table i wasnt aware of all the good that has been accomplished have only heard the negative thank you for laying it all out,FAVOR,NONE
can someone help me find the mark where the camera pans on aoc and she leans over to her left to make a comment to someone because if you read her lips and the vibe she gives it literally looks like she saying she literally stands for everything he says talking about kamala harris,FAVOR,FAVOR
jo biden lied about jan 6 th,AGAINST,FAVOR
speaking a truism at the very start,NONE,NONE
shoulda saved his breath,NONE,AGAINST
biden sons love their cocaine and kickbacks,AGAINST,NONE
lol satan and his minions are desperately running out of time,NONE,FAVOR
samiyanidiwowisitazaniya,NONE,NONE
tazaniyanidewowisiusa,NONE,NONE
wtf prime minister of swedistan,NONE,NONE
the dems want open borders because according to biden we need appreciate more immigrants do i have that right then why do they also advocate for depopulation httpsyoutubels1ou24slksirij4gbrqfgvkyzck,NONE,NONE
3600 fine but they will evade,NONE,NONE
human for human,FAVOR,NONE
i like american president obama and old man joe biden viva b iden,FAVOR,NONE
i know you might not like palisti iansbut the president joe biden needs to make no gun lawsinside the president white house gate ram any outside automobilemy dad told me if i dont come home on time my dad locked me outi locked myself in the car,FAVOR,NONE
i did ha ve a mi ini snickers but i prefer gummi bears,NONE,NONE
you are really funny mister president,FAVOR,NONE
there are some evil destroyed,NONE,NONE
praying helps tooi saw todays weathersome of the evil because of praying for america is flying awaythanks be to godand praise the lordthe son of god jesus,NONE,NONE
may name is nsimire zibanda thank you president joe ben,FAVOR,NONE
old dog killed innocent kids shame on this old dog,FAVOR,FAVOR
every fentanyl dead from now until the border bill is fixed is on the head of drinkbleachdonald,FAVOR,AGAINST
i am going to send him a resume,NONE,NONE
a great speech from a great president,FAVOR,NONE
this is pornographic,NONE,NONE
turncoat biden,AGAINST,NONE
leader spech on hold,NONE,NONE
i happy to here presidentbildenpeechand victory i antoinepierre god s bless,FAVOR,NONE
to me is more the state of disunion,NONE,FAVOR
america is a big country they can not a n idiot lead the country like the idiot predecessor want white house again no place for him period,FAVOR,AGAINST
he can still read when hes on meth,NONE,NONE
sounds like adolf hitler,NONE,AGAINST
a president should teach the democrats and republicans to love one another before they brat about loving the nation together harris ng ym amen painful failings in a democratic american system of government harris ng ym amen why the chinese democrazy is a great success why the russian democrazy is not going to fail why the american and european democrazy is losing its attractiveness throughout the world harris ng ym new world order and the decline of the american empire,FAVOR,NONE
education for children 1 dun teach them to accept a male as a mother 2do not encourage them to practice free casual sex and when they accidentally got pregnant dun just throw the foetus into a dust bin 5 teach children this a foetus is not a just a piece of meat,NONE,NONE
when america got knock down it is very difficult for it stand back up why because america is knocked down by americans it is internal strive and greed america is not knocked down by china and russia,FAVOR,NONE
309 first statement already false joe claims trump directly told putin whilst bowing down to do whatever the hell they want trump had said this quote at a rally in conway south carolina not to putin the full context to this was that the nato countries were not paying for their security and that only when trump threatened those countries with the idea of no assistance did money starting coming in from those countries,FAVOR,AGAINST
do biden voters not like money biden and obama take money from lobbying countries like china selling americans out for his own benefit as a result we all have higher prices and a harder time competing in the global market americans are the hardest working people and our money should reflect that but because of these greedy politicians our dollar is not what it should be the evidence is there tell me how all politicians make around 200k a year but somehow end up growing their net worth by millions while in office dont be a fool vote trump 2024 trump gave his paycheck to our national debt while president he never took a dollar from lobbyists lets have a peaceful prosperous next 4 years god bless this nation,AGAINST,FAVOR
he is not my president,NONE,AGAINST
salamat po sir president joe biden and to your wifemaam vice president harrissir blinken and all your governments inside of this videointernational law hadd islamic law talk thanks pothis not recorded but in digital or internet quranic salehbecause for me this possesi pray people heard and my governments here in the philippinesgod bless us po,FAVOR,NONE
i want to hear more about the potato chips in the bag,NONE,NONE
the united states of america is a republic and not a democracy get it right president,AGAINST,FAVOR
the amount of clapping just shows who was aloud to be in there for his speech and whos not smh,AGAINST,FAVOR
présidence 2024 usa america sir amamra said king of thé world thanks you sée than,FAVOR,NONE
seniors that,NONE,NONE
please help biden stop letting him run to show off one of these times he will fall and break a hip maybe get him a walker stop giving him hard words on his cue cards but do give him cards he has to follow and not go off script highlight the words he needs to read out loud and tell him not to read directions on that card like repeat the line which should not be highlighted dont let him talk to grieving people so he tries to relate to their pain with some inflated story or write him a response thats not a lie and sounds more like he really cares take away his watch so he doesnt check it when the fallen soldiers are parading by him someone helped him get on and off the stage not a bunny rabbit either and where is his wife she should be there to help him and correct him help put on his coat and make sure there are no shadows to trip over she can touch his shoulder to get him to stay on task and keep him away from the children he is creeping them out for that matter keep him away from all young girls when they cringe and move away from him it doesnt look good maybe put blinders on him so he cant see young women that he wants to go after to sniff their hair tell hunter to stop loaning him snuff that makes his eyes wide without blinking it makes him look weird get him a stair lift to get on and off the plane safety is better than looks dont let him sit through long meetings so he falls asleep that looks bad for us stop putting him in front of people who will want to ask questions so he laughs at them while his crew escorts them out of the room dont let him walk so much his stiff walking looks like he is old dont let him go on talk shows anymore it is just too weird does anyone know of anything else that can help this bumbling old senile man,NONE,NONE
whoever embalmed him did a pretty good job,NONE,NONE
commie news network i was able to block them on x i reported the kid smeller as impersonating therealdonaldtrump,NONE,FAVOR
ive grown to support biden and im not a democrat,FAVOR,NONE
biden saying trump had the largest deficit by any president but biden blew it away in just his first 2 years the reason trump is the highest right now is because biden isnt done yet,FAVOR,AGAINST
cometh the moment cometh the man,NONE,FAVOR
they look so joyful and excited perhaps one weakness of democratic is talking and promising too much while the results often turned out to be wrong and embarrassing to the contrary dictators talk less and therefore make less mistakes and are always right like holy god are we really equal lielielie,AGAINST,FAVOR
building economy from the middle out the bottom up not the top down lets build everyone up yes rich people youre included too lol,FAVOR,NONE
you cant love your country only when you win,FAVOR,AGAINST
great positive communication,FAVOR,NONE
c what kind of tv station cant find the time to include subtitles in multiple languages,NONE,NONE
if biden dies in the middle of his 2nd termamericans who voted for him wont be wasted his legacy will be remembered and all of his 2nd term platforms must be continued by his successor,FAVOR,NONE
this was a better state of union address httpswwwyoutubecomwatchvig446isvxli,NONE,NONE
presidents play video games is the only time ill listen to these fucks,NONE,NONE
if you sort by newest you get the maga feed of people who cant spell and dont even have any arguments so they just insult the guy,NONE,AGAINST
a very forthright speech by joe bidenlet us hope that this level of sanity cuts across party lines for the benefit of america and the rest of the world,FAVOR,NONE
mr president your daily peace on earth briefing resolution peace standard whereas peace is an essential foundation for the wellbeing and progress of all nations whereas guided by the principles of unwavering resolve mutual respect and resolute diplomacy resolved 1 member states firmly declare an absolute prohibition on offensive military actions in all forms they shall abstain from engaging in any acts of aggression coercion or provocation that may escalate tensions or threaten international peace and security 2 member states assert a categorical rejection of all territorial disputes and commit to the peaceful resolution of any existing disputes through diplomatic means and in accordance with international law they shall uphold the sovereignty territorial integrity and peaceful coexistence of all nations without exception this resolution stands as an unwavering standard for global peace embodying the steadfast determination of member states to uphold peace security and stability for the collective benefit of humanity,FAVOR,NONE
vice president practice yoga up and down,NONE,NONE
présidency2024ofamerica 2024 king if thé world sir amamra said i belive my contrat america thanks you sée than,FAVOR,NONE
presidency2024of america usa king if thé world sir amamra said thanks you sée than,NONE,NONE
roi said président 2024 in america usa said amamra thanks you sée than,NONE,NONE
amamra said presidency2024 if usa king if thé world sir amamra said thanks you sée than,NONE,NONE
how can people stand this man trump is atleast funny at times id vote for trump if i was american,NONE,FAVOR
ayekoo joe good and noble work done you have exhibited your muscles to prove how worthy you are,FAVOR,NONE
thisi think is the first time a head of state has with humility and utmost pride presented the state of the union resounding in every corner of the country hes won the race already and as if by magical design hes won the race already never mind the unimaginable approval numbers hes won the race already and thats god bestowed god bless the homeland,FAVOR,NONE
so todays cpi is up 04 percent the story quickly changes and no one is covering this point lol the news media are a joke,NONE,NONE
so uncouth nothing decent about him,FAVOR,AGAINST
major healthcare company defaults and files chapter 11 bankruptcyin addition to staffing challenges operators have also faced a number of economic issues that have driven some of these companies to file for bankruptcy or in some cases shut down facilities rising inflation which affects products supplies and employee wages and higher interest rates over the past couple years have severely impacted operators budgets on top of those economic issues operators are battling inadequate medicare medicaid and insurance reimbursements that can lead to capital shortfalls fjb,NONE,NONE
how can maria shriver look exactly as she did 20 years ago does she have some artwork in the attic,NONE,NONE
jesus is coming,NONE,NONE
jan 6 was the worst thing to happen to america let them know joe,FAVOR,AGAINST
vote for me 1 i will reduce the profitability of your 401k 2 i will increase the cost of your goods and service 3 i will probably cost some of you your jobs how will i make my wonderful dream your reality 1 i will reduce the profits of the companys in which your 401k is invested 2 i will reduce the profits of the companys that make your milk toilet paper and your other goods 3 i will reduce the profits of the companys that employ you how can i possibly do all those things why its very simple rise their taxes would you vote for me honestly i wouldnt either i am not a big picture person i ask a simple question how will this affect my family and me i ask the question when looking for a place to live looking for work wondering should i buy or rent just to list a few bottom line when dealing with attorneys and career politicians theyre just doing their jobs im not promoting hatred always read the fine print question everything dont blindly follow anyone we live in a world where no one gets something for nothing there is always a cost and someone has to pay it i just want to make sure if im the one who will be paying i know upfront and take the steps needed to avoid it if its not right for me and my family wouldnt you,NONE,NONE
i would love to hear this speech without the cheering and booing at 28 this is the first presidential address i have ever watched so i will just assume its normal but what the fuck is that isnt this supposed to be seriois,AGAINST,NONE
very funny biden my name is july i never never pay taxes again if you keeping the boder open this is the bigining of war and hope more american like me doing the samething one ride one ranger in i m boricua 100 and i m american 100 i suport texas 100,AGAINST,NONE
show me in the original constitution where it mentions the words democrat or democracy also i find it funny that no one ever researches the origin of these words they just accept them,NONE,FAVOR
when you look at the audience a main problem is clearage not that older people are not capable but how can the old and many times the old ways move a country forward it is time to stop being so afraid of the younger generation and possibly some fresh views and thoughts on how to move us as untied country forward,FAVOR,NONE
joe ur old u will loose big time this time,AGAINST,NONE
biden is a great president and i love the fbi,FAVOR,NONE
jesus answered them go and tell that fox i am driving out demons and performing cures today and tomorrow and on the third day i shall finish my work,NONE,NONE
this is the democrats way this is the republican way httpsyoutubeedijhxuwgksii8sxf0bkm54bvtb just tell me this is a lie,AGAINST,FAVOR
foolishs analog 2 digital converter ok,NONE,NONE
over 60 million lives have been taken by the act of abortion notice how president refuses to say the word,AGAINST,FAVOR
watching harris clap like aseal is a joke jacked up barking joe is a total failure,AGAINST,NONE
angry old man who supported saying bad things about black americans old joe is a very phony,AGAINST,NONE
home i dont have a home anymore,NONE,NONE
average age in the room is over 70 and average net worth well over 2 million each something aint right here,NONE,FAVOR
a smalltime delaware hood made big,FAVOR,NONE
looks like they r payed to stand up i lose count how many times they stand up over n over again,NONE,NONE
im sorry im out here everydaymore and more homeless everyday jobs going left right only because of tiawans situation they bring chip making to ohio in the near futurenow i know he trying the same tactics as trump was just in a soft grandpa voice,NONE,FAVOR
yeah now they all come here to ohio to have reproductive services done we are flooded with out of state women some of those who come from them other states are embarrassed if someone ftom their state finds outthey vote one way an act another smhladies in those other49 states stand up n quit putting all on us ladies who got out rallied and voted for our right that we dont need big brother to take away rights so many have died for,FAVOR,NONE
remember when the vp was never in the same place as acting president,NONE,NONE
never seen a circus like this before and briben as a leader of it makes it even better what a bunch of clowns,AGAINST,NONE
5651 phantoms without foodwatermedeciine,NONE,NONE
5410 where and when did joe biden teach the second amendment for 12 years more biden credibility bsing,AGAINST,NONE
why is he yelling the whole time,NONE,NONE
how can people believe this cr4p have you all drunk their koolaide wtfaith,AGAINST,AGAINST
bidens hair is stuck on with double sided tape you can see a crescent shaped strip of it to keep the front of the comboverextensions down and looking like his hair is growing out from there instead of ending there hahahahai just noticed this makes sense since theres old foootage of him almost bald it woule look better bald lol,AGAINST,NONE
disgraceful people actually applaud the threats to supreme court judges by a sitting president talk about a threat to democracy wtf,FAVOR,AGAINST
liar liar ask a vet about our soldiers in ukraine right now,AGAINST,NONE
this confirms biden is full of manure and johnson is a dem plant,AGAINST,NONE
bro rfk jrs sotu got almost twice as many views as this one and almost ten times the amount of likes you love to see it,FAVOR,NONE
well we know now whos cocain was found in the white house,NONE,NONE
my president doesnt look too good he just screamed and yelled,AGAINST,FAVOR
you waged wars to sell heroin fur democratische idealen copycats httpsyoutubeqm7q1oaaykqsiv35_js9yz6hnvuhr,NONE,NONE
i wonder what substance they gave him to complete this speech,AGAINST,NONE
lets talk about all these migrants coming into united states illegal,AGAINST,FAVOR
awful angry vulgar man petty crook most likely took aricept to remain coherent,FAVOR,AGAINST
with amerka not problem,NONE,FAVOR
baidan ase ailavio amerkano woman they my friend,FAVOR,NONE
other places only problem,NONE,NONE
baidan only amerka fake in ofher places nooo,AGAINST,NONE
ase know for pakistan,NONE,NONE
ase know,NONE,NONE
my friend from nato nada laif from colubiq they say pero laif dragoi,NONE,NONE
it is sad young lost interest to american poletic and old guys running the country,NONE,NONE
yes baidan dragoi have mush problem from colubiq,AGAINST,NONE
baidan ase always fake not laif,AGAINST,NONE
why lie mush pipo amerkano woman for laif,NONE,NONE
baidan pipo always lie for me ase hate laif,NONE,NONE
ase nothind why only me hate pipo,NONE,NONE
baidan for what ase say next programs colubiq problem for amerka,FAVOR,NONE
pipo only torment amerkano woman for laif,NONE,NONE
baidan for 3 years not sigle laif pipo for me,FAVOR,NONE
baidan why no next programs colubqno they hate,NONE,NONE
baidan pipo nada rusiq for what no laif for amerkano woman,AGAINST,NONE
bidenomics since jan 2021 consumer price index overall up 18 groceries up 21 energy up 29 eggs up 37 gasoline up 33 babyfood up 29 source bureau of labor statistics biden and his socialist puppet masters especially obama should be thrown in prison for all the damage theyve done and continue to do to america,AGAINST,NONE
i remember when biden said putin was bluffing when the us spied all the equipment along ukraines border when did putin ever bluffcrimea georgia biden needs a history lesson and watch putins speech when he won his first election,AGAINST,NONE
on the border security bill he trump feels it would be a political win for me and political lose for him its not about him its not about me id be a winner joe biden,FAVOR,AGAINST
that guy joe biden is trash,AGAINST,NONE
what a prick,NONE,AGAINST
i stand with biden,FAVOR,NONE
what an absolutely shameful performance of ludicrous lies is anyone else terrified it is not just americansbut all western civilised countries should be absolutely outraged ashamed and terrified for the prospect of their futures and the futures of their children and their childrens children if americans buy these outrageous bull droppingsagain if they actually did at all in 2020 all western civilised countries are doomed,FAVOR,AGAINST
trump 2024 for 3rd time looking forward to the debate,NONE,FAVOR
i hope that us will send troops in ukraine so that victory as at hand,FAVOR,NONE
where are the fact checkers because 90 of what he claims is not true at all again where are the fact checkers,NONE,AGAINST
he is an idiot,NONE,AGAINST
psalms 145 he who sits in the heavens shall laugh the lord shall hold them in derision then he shall speak to them in his wrath and distress them in his deep displeasure,NONE,NONE
thats sad,NONE,NONE
cnn any new information on steven nccooy you remember him he was the gold star father who really lost his son in afghanistan he was arrested after her peacefully protested during lying dogfaced pony soldier joes speech,AGAINST,NONE
