comment,biden_stance,trump_stance
hes on that spice today,NONE,NONE
watch who stayed seated when prodemocracy statements and antiputin statements were made if that is not a common thread running through both parties then we no longer have a two party system pathetic,FAVOR,FAVOR
reading what he is told to lie about,NONE,FAVOR
what a load of lies and hypocrisy out of this fox mouth,FAVOR,AGAINST
are they deleting the comments ridiculing him i dont see any which is extremely out of character for videos like these thats especially considering some of the things he claims,NONE,AGAINST
have they fixed flint michigan,NONE,NONE
ukraine isnt anything we should gada at all,AGAINST,FAVOR
this is the biggest domestic enemy and terrorist in this country impeach triator biden and the cabinet of triator biden now,AGAINST,NONE
i love how biden forgot to mention how he is supporting genocide in gaza and screwing over arabs lmao,AGAINST,NONE
i watched this speech live and watched it five times afterfor some reason biden still got it he nailed it,FAVOR,NONE
wow if your smart you can tell how proud they are of him remembering what to say the facial expression says it all,NONE,AGAINST
so an old man with dimentia who experienced an hour long rant off of speech notes that was given him about his political opponent whom he is afraid to debate just to prove that hes not dead yet to people who are brain dead blow your load everybody uncle walter is angry,AGAINST,FAVOR
words mean nothing,NONE,NONE
so happy that the president is so sane and so astute and sharp this speech proved his detractors wrong now its time to charge him with the classified documents he took while he was a senator the same thing that his doj is charging trump of,FAVOR,AGAINST
do more people have health insurance because the government essentially forces you to be covered or is it because of another reason,FAVOR,NONE
inflation is low but prices are high these corporations need to be put in line,NONE,NONE
yeshua hamashiach our sovereign adoni let your will be done and not man remember yhwh never change his holy scriptures this twostates solution for israel with never exist either you follow yhwh will and if you chose not you soon will experiencing the wrath of yah endtimes is here you people need yeshua as your lord and saviornow the enemy continues to blind the earth dwellers destruction is around the corners you will see very soon,NONE,NONE
this dude is a joke,NONE,FAVOR
we are being ruled by halloween decorations fav sotus joke,NONE,NONE
what i dont get is how are they so sure putin is gonna go on a european conquering spree when he is having so much trouble in ukraine that narrative makes no sense to me im also originally from russia,FAVOR,NONE
what is this screaming and cheering over an hour is this the state of the union or is this simply a campaign rally,AGAINST,FAVOR
trump 2024 no wars,NONE,FAVOR
hes being applauded for achievements that had to be done regardless basic human rights jobs medicine housing fixing roads,AGAINST,NONE
hes not speaking to us the tax paying middle class people hes speaking to swamp trying to get approval sorry the american people eyes are wideopen nothing you said was for us the people it was all about you and your devilcrats swamp,AGAINST,FAVOR
hes 81 not even a young 81 he should have retired 10 years ago but is instead the leader of the usa im not saying trump is any better im saying its embarrassing for the usa that this is their leader,AGAINST,AGAINST
wondering how many barbiturates uppers lds shrooms speed joints meth it took to juice up biden to get through and make it to the end of the state of the ukraine speech,NONE,NONE
spin doctor is looking bad,NONE,FAVOR
biden as a hispanic independent the biden record is clear biden isnt running america open border inflation and divisiveness he and corporate media will insure trump will win hispanics for trump 24,AGAINST,FAVOR
great speech mr president thank you for giving us hope in the american dream,FAVOR,NONE
if i was smart,NONE,NONE
thank you for the record high inflation more taxes being taken from my check the open border sending insane sums of money to ukraine leaving american soldiers to die in afghanistan trump 2024,AGAINST,FAVOR
they actually think that because they applaud it makes him legitimate,NONE,AGAINST
if i was smart i would go home now wow just wow we all know he aint the fella,FAVOR,AGAINST
who the hell applaudes to giving more tax payer money to fund ukraines unwinnable war same company same drug same place joe biden,AGAINST,NONE
the beauti springtime like than of 1989 only at himvote usa,NONE,NONE
this is the worst state of the union address speech by a president in all of american history there is no hope in biden or the congress all are snakes in human skins and liars there is only one person to put your hope into and that is jesus christ there is no hope in man biden repent of your sins,AGAINST,NONE
jobs the 8m illegals whose countries are at 1940s wages,NONE,FAVOR
with him wake up george h bush age of usa and ronald reagen age god bless usa,NONE,NONE
4 more years,NONE,FAVOR
not that you let millions of illegals in freely recheck your crime stats,NONE,FAVOR
yea just ignore the fact that you abandoned 13 marines in afghanistan,AGAINST,FAVOR
i voted for biden in 2020 have never been proud of it until now this is what a us president looks like also ceasefire now,FAVOR,NONE
say goodbye to the chosen one the last time he is truly president of america who sees and promises to seize opportunities to benefit all americans unlike trump is just plain trash and seeks wealth to eradicate his debts and institute retribution against all who dont lick his a seeks immunity against all his crimes say goodbye to trump one more time the last time,FAVOR,AGAINST
4 more years,NONE,FAVOR
to my american friends let me just say that you have president who has razor sharp mind ask putin,FAVOR,AGAINST
why are they all so excited about him being able to get through the speech they are shocked that he made it without going completely off the rails as usual,FAVOR,AGAINST
hello my kind and compassionate liberals i am an illegal immigrant or what you call an asylum seeker can you be so tolerant and kind to let me stay in your home this will be your chance to show the world how liberal and woke you are who wants this honor im taking applications,FAVOR,AGAINST
did he say to someone i didnt botch it did i when he came off stage someone said no more talking about cognitive decline well no just because he can get hopped up on some good drugs and somewhat perform for 1 hour does not make a leader even at that he still mumbled quite a bit and could barely stay on track,AGAINST,NONE
campaign speech at best like listening to someone gargling glass,AGAINST,NONE
mike johnson is a 15 year old man what a pos the sheer lack of respect in that roomand we the people pay these ahles,NONE,AGAINST
remind the incomers that this is a english speaking country they should all be required to learn it,NONE,FAVOR
i know this is a redundant comment but i just want to express my own sense of utter revulsion for speaker johnson how does the worlds most powerful government accord such a pathetic little man such a prominent placing,NONE,NONE
4 more years ridin with biden vote to keep our democracy alive,FAVOR,AGAINST
why is he screaming the whole time,NONE,NONE
500 billion so you can just give it away to ukraine,AGAINST,FAVOR
im a european us politics observer president biden is sharp as i see in this address good for you guys why isnt he always like that hes like a different person,FAVOR,NONE
teachers do need a raise they need to make a minimum of 80k per year,NONE,NONE
democrat treason on full display,AGAINST,FAVOR
i like how they tried to edit out all mike johnsons head nodding by cutting to another camera view or angle full of shit this speech,FAVOR,NONE
what a speech from president biden 4 more years,FAVOR,NONE
we will not walk away this kind of propaganda is going to have dire consequences for us all the nuclear kind fk biden fk trump theyve had their time and that time has passed and neither one deserves to lead america rfk all the way,AGAINST,AGAINST
the world is watching this insanity too,NONE,AGAINST
what about the nazi internet laws that you and obama got passed kamillian harris claps,AGAINST,NONE
i dont want to hear bidennomics i just wanted to say if biden blamed israel then its time for what evidence bidennomics has if not jail biden for assault on chief israel,AGAINST,NONE
you guys dont want another 2 trillion dollar tax cut for the wealthy i thought that was your plan thats good to hear love it,FAVOR,FAVOR
was that sanders the only one with a mask,FAVOR,NONE
he the little johnson cant applaud the first female vice president,FAVOR,AGAINST
why is the gop so mean always angry thats crazy,FAVOR,AGAINST
pretty presidential for an elderly man who allegedly has dementia,AGAINST,NONE
he hit itjobs that dont require a college degree these workers who are truly making the biggest difference in the economy yet they are not paid enough to even afford purchasing their first home where did i hear making sure folks are being paid a minimum 50hr as barbara lee mention in one of her talks ps i rideshare and barely making 21hr,FAVOR,NONE
i have three kids live in northeast best schools in the country and they did not read comprehensive until third grade they were reading site words in kindergarten,NONE,NONE
great speech by the worst president in us history bar none open bordershigh inflationgot people killed in afghanistanand blame everything on trump what an angry despicable old man,AGAINST,FAVOR
kamala harris and mike johnson their reactions were just epic it feels like watching a hollywood comedy movie,FAVOR,NONE
you can teach a child in 6 months with a phonics program homeschooling my daughter for her kindergarten year this world has not really done the best in every situation such as teaching,NONE,NONE
wheres all the senility and dementia biden seems in command and on top of his game to me givem hell joe,FAVOR,NONE
they didnt fail you all cheated the election in the wee hours,FAVOR,FAVOR
let us have faith that right makes might lincoln,NONE,NONE
all he did was spit lies lmao,NONE,FAVOR
at the 500 minute mark my message to president putin is simple we will not walk away we will not bow down i will not bow down why was this segment not shown on any of the msm programs about the state of the union address easily the most powerful statement in the whole address,FAVOR,NONE
to keep the people united they should have had a recount of the votes,NONE,AGAINST
four more years,NONE,FAVOR
theyre gonna roast johnson for this afterwards he said he vehemently disagreed so much with the president tell your head that every time you nod in agreement great speech by biden 2024,FAVOR,AGAINST
no one should be jailed for drugs and marijuana lock up every black person for 15 yrs no matter how much crack they have fk this guy,NONE,NONE
johnson doesnt have a clue about what hes doinganother diaper donny clown,NONE,AGAINST
disgusting seeing this people standing to clap about baby murder god needs to act now and make justice to this innocent babies biden you are in a big trouble with god you are fired man fired man,AGAINST,NONE
mr speaker i see it in your eyes on your face and in your heart be the republican to turn the tides install in your party those values you know youre lacking and in so doing one day in the future you will be giving this speech and will have earned that opportunity,NONE,FAVOR
you did not do it u took peoples rights and some jobs vaccine is bs,AGAINST,FAVOR
im pushing 70 and capable in my field yet retired to focus on family community and enjoying retirement bidens commitment to usas growth prosperity health care and worldwide peace is inspiring thank you president biden,FAVOR,NONE
communist filth,NONE,FAVOR
iair liar pants on fire you are a shameful example of humanity,FAVOR,AGAINST
what about covid and cancer,NONE,NONE
in the end nothing remains but strong words all leaders of declining empires faced this moment but strong words didnt help them and they will not help joe biden joe biden must really be desperate seeing how all his plans in the last two years miserably failed presidents roosevelt and lincoln will turn in their graves hearing the speech of joe biden and seeing what he has done to the united states victoria nuland just left the sinking ship when will joe biden or will he bring nuklear armageddon to the rest of the world,AGAINST,NONE
reading from a teleprompter lol,NONE,AGAINST
warren buffet donated 2 million to bidens campaign in return joe biden cancelled the keystone pipeline in doing so it protected buffets foreign oil investments but it also doubled the price of gas overnight why vote for someone who is willing to literally sell out americans,AGAINST,FAVOR
fantastic speech president biden you said almost exactly how i feel,FAVOR,NONE
i feel so inspired uplifted blah his speech mentality is a combination of weak pathetic lies insults insincerity putin probably watched his speech without much attention while lounging in a spa sipping a drink as he pondered the unfathomable stupidity of the presidential administration which might have provided him a slight suttle smile,AGAINST,FAVOR
trump the dont not america history,NONE,AGAINST
since when is the most pressing issue in the us not enough abortions cmon normies please wake up and get this loser off your tvs,FAVOR,AGAINST
biden god is not with you you are supporting the killing of baby innocents you are fired you will not be the next president bye bye bye bye,AGAINST,NONE
what a compelling state of the union speech did someone mention that the president has dementia he hit every nail on the head tonight 4 more years,AGAINST,FAVOR
what about budapesht memorandum,NONE,NONE
even obama said this guy was wrong on nearly every political choice hes made tell me joe what are you going to do to put more money in pockets of middle class and dont lie trump got insulin to 35 a month why are you taking credit,AGAINST,FAVOR
what a disgrace speech joe didnt lay his vision for america it was a political and election speech all he did was blaming others for his failures for example where was he and the vp when illegal immigrants crossed our border in the millions he never visited once until just recently he doesnt care about our country and the security of our people i am an immigrant my family came from a refugee camp we waited over 4 12 years before coming to america i dont hate immigrants because i am one of them but i want legal immigration personally i care about the prosperity and security of our american people at the end of the day its all about families and our future generations i may not like the way trump speaks and portrays himself sometimes but at least he shows that he cares about the future of americans also at the end of the day no ones going to feed my family or pay my bills i know were not better off than 3 years ago i am a small business owner and under joes current plan my business suffers much lets get back to the basic fundamental values of our country we cant afford another 4 years of joe biden and his incompetent vp the world is laughing at us because of joes policies,NONE,NONE
god bless every republican who stood up at least one time for what our current president represents thank you for caring,NONE,FAVOR
how can you tell joe is saying a lie when ever his lips move thats how old lien joe back at it,AGAINST,FAVOR
how can you tell joe is saying a lie when ever his lips move thats how old lien joe back at it,AGAINST,FAVOR
you cant even lie this was a very well done speech by the president vote dont forget to register,FAVOR,NONE
he makes one speech with all you trolls on here giving him praise you should feel ashamed of yourselves for all the high inflation and poor policies that he has set in place that is driving america into the ground im middle class working and i feel it in my pocket everyday i go buy things it doesnt matter how rich or poor you are anyways there wont be an america with another four years with this coward and dictator lies lies lies and everyone gives him a standing ovataion wow this is ridiculous,FAVOR,AGAINST
watching on from australia as someone who has been lucky to live in usa as a foriegn visitor i am crossing my fingers for the american people that president joe biden is re elected what a leader,FAVOR,NONE
i love the balls on speaker johnson his face isnt hiding anything,NONE,NONE
dear modern republicans you are in the seats of congress why are you being led by somebody booted out and a wannabe you every damned one of you need to be on your feet and behind your current leader just as you would wish democrats would support your own if he were in that my friends is why you were elected selected to be there remember you get what you put into it i have faith in both parties to do the right things will you all,NONE,FAVOR
awesome phenomenally awesome,NONE,NONE
why is cnn disabling the caption in this video,NONE,NONE
intelligence is so obvious when pointing out the less of the more important issues like the handling of world affairs and how the swedish government has signed on to nato stupid people are just not listening,NONE,FAVOR
i loved this sotu,FAVOR,NONE
one of the best speeches any president ever delivered majorly taylor should be ashamed she is in a safe constituency so she can shame herself and been stupid and ignorant and still get elected as simple as she is nobody else can beat her,NONE,NONE
i cant stand listening to this idiot anymore,AGAINST,FAVOR
this address was absolute hot garbage those are the fakest smiles and laughs ive ever seen,AGAINST,FAVOR
seriously didnt you sleep better in the last few years knowing that a competent person was in charge of our world wide affairs and wasnt constantly praising our adversaries,FAVOR,AGAINST
what a great president we have a man of integrity decency high moral values and a man who loves this country and wants to get things done for the benefit of all americans and a man who wants to defend the constitution and democracy nothing to compare with the cult leader representing the maga party,FAVOR,AGAINST
imagine if trump was in office essentially imported millions of future democrat voters on all our tax dollars like bidens administration has done if the roles were reversed would you all be outraged how about how they are gaming the system for new house seats by massively increasing the population in the big sanctuary cities such as nyc chicago la it doesnt even matter they cant vote yet its the increased population not citizens in all of these cities that will equal more house seats likely more electoral points in the near future take your bias away for just a minute look at that open minded as possible justify how thats not corrupt its the hopeful set up for about as close to a future one party rule as you can get that doesnt even count the mass amount they have flooded into texas there needs to be balance i am an independent gen z voter btw i just choose to look past the personality at times of trump see that his policies made most of our lives more affordable our country safer i know politics has become so polarizing divided so many people but we all do have a lot more in common than we think for the record i am all for immigration thats one of the greatest things about our country is our diversity but theres many many reasons why it needs to be done legally instead of opening up the border entirely for 3 years btw biden on day 1 used his executive orders to completely abolish trumps border policies then is now blaming him his maga friends for not fixing it biden has literally been to the border once in 3 years they know what theyre doing just look at the fentanyl flooding in the crime the children missing look what happened in georgia recently its not right,NONE,NONE
amazing how many people think this guy is a good president boggles the mind hes a fucking train wreck,FAVOR,AGAINST
what a farce,NONE,AGAINST
this is comedy gold,NONE,NONE
worst president in usa history,FAVOR,AGAINST
freedom of speech why cant this latina girl call you guys out with bullshit destroyed my country,NONE,FAVOR
clearly the democrats love communist,AGAINST,FAVOR
very competent speech good substance well done pres biden,FAVOR,NONE
the moment they take our guns is the moment they take our freedom,NONE,FAVOR
at age 52 this is the first time i watched sotu address in its entirety historic,FAVOR,NONE
mike johnson caught with russian donation konstantin nikoloaev and just broke national news mike johnson looked like he has an pants full,NONE,NONE
the obnoxious point dexter nerd speaker of the house was evidently the most disrespectful speaker ever in history to think he only got up one time during the whole speech to applaud the president hopefully he will be the next speaker to get impeach,FAVOR,NONE
amen to upfront and honest billing business wide,NONE,NONE
if you vote for the dictator numb nuts bankruptcy king youre so very ignorant,FAVOR,AGAINST
i liked when the president called out the maga cults with real truth facts,FAVOR,AGAINST
it is embarrassing for the speaker of the house act like that on the news it is not respectful to the president,NONE,FAVOR
hard to watch with little mikey and his face,NONE,NONE
johnson clearly has no problem with jan 6look at that smirk,NONE,FAVOR
bobby casey,NONE,NONE
hey mikey if im not pregnant and my egg dies am i a murderer extremist bullshit,NONE,NONE
watching mike squirm proves he is ashamed of himself for bowing to a psychotic dictator,NONE,FAVOR
jesus christ mike are you just not used to the limelight by your snarky facial expressions little jerk,NONE,NONE
big talks only from most incompetent us president ever you gave lot of false hopes to oppressed people of bangladesh who are being killed and stripped off all voting rights since last 15 years by lady hitler sheikh hasina but in the end you vowed down to hasina and now talking big against russian and putin you lost in all front,AGAINST,NONE
so many lies in front of the world he has no shame man its crazy,FAVOR,AGAINST
wow what a great man,FAVOR,NONE
mike johnsons facial expressions are nauseating,NONE,NONE
i love how he nailed the conservitards with his askin them if they wanted to give the wealthy another 2 trillion tax break they lied their asses off when they said no and everyone includin our presdent knew it,FAVOR,AGAINST
we love you joe and pray gods protection as your northern neighbours we watched in horror the president before you and marveled over the blind stupidity of people who would vote for him mr biden is a man of integrity experience wisdom and great character go joe go,FAVOR,AGAINST
010 boy was biden right he should have gone home right away,FAVOR,NONE
cant love your country only when you win thats a good one,FAVOR,NONE
the speaker of the house looks deeply troubled and ashamed he is in cahoots with the devil and he knows it,NONE,NONE
four more years,NONE,FAVOR
mike looks like he wants to crawl under a desk and hide from shame,FAVOR,FAVOR
excellent speech the pathetic media me johnson was terrifies to clap for the fear of loosing his gavel,FAVOR,NONE
please help the starving in usa new york state areas ohio iowa please make feeding groups four new york two in ohio three in iowa breakfast and lunch programs help the world side with britain to save children in endeavours and iowa please help,FAVOR,NONE
i am so sick of democrats lying about republicans want to cut social security people do your research its democrats that are destroying social security,AGAINST,FAVOR
mike johnson is so horrid who wouldnt support what bidens saying just shakes his head and purses his lips so his handlers know hes staying loyal to them,FAVOR,NONE
biden is exactly what an american president should be and has been before donald trump hearing him speak the truth in his sotu speech with conviction character and class shows a man who uses his intelligence and respect for others to lead us against the evils of the world i was moved to tears as i listened i am so thankful we now have a president who still believes in our country biden fights for american democracy and common decency,FAVOR,NONE
everyone is going on about mike johnson nodding because he agrees with biden you really cant tell hes nodding sarcastically,FAVOR,NONE
he is duped,NONE,FAVOR
quit sending billions to ukraine you sell out,AGAINST,FAVOR
youare so lie,NONE,AGAINST
im so proud of biden a president for american people,FAVOR,NONE
i cant stand listening to this man,NONE,AGAINST
once again this abrasive polarizing pathetic speech was given by a prez that provides leadershit that is lower than whale sht and that isnt fake news however biden kamala and their incompetent comrades have proven that my theory on global stupidity is alive and well and they are living proof of that biden and his minions are prime examples of how incompetent leaders rise to the top in our government aided by ignorant voters just like the incompetent leadershit that they support,AGAINST,NONE
taxes how about your son paying his taxes,AGAINST,NONE
how has inflation dropped 6 im still paying the same for gas etc,AGAINST,NONE
he just passed student debt on to taxpayers none of it came out of his pocket,AGAINST,NONE
how can this many sane individuals think that president biden is capable and competent to do his job maybe they arent so sane there was a time i used to say the same thing about president trump now i say hey dems you give me biden i give you trump,FAVOR,FAVOR
tell them yes so what you dont like what trump said your alliance is weak to russia you right history is watching how america fuck up the world,FAVOR,AGAINST
btw the federal deficit is up to 34 trillion dollars we need better leaders across the board editspelling,NONE,AGAINST
