comment,biden_stance,trump_stance
imam mahdi nasser mohammed alyamani 24 shabaan 1445 ah 05 march 2024 ad 0647 am according to the official time of mecca mother of towns __________ announcing the date of the earth s ingress to nibiru s climate a decisive statement that is not to be taken for amusement in the name of allaah the most gracious the most merciful prayers of forgiveness and peace be upon all the messengers sent by sacred books to remind people of understanding from the first of them to the seal of them mohammed the messenger of allaah may allaah s prayers of forgiveness and peace be also upon their followers in their call to worship allaah alone no partners with him i make no distinction between any of his messengers i am an upright muslim not a polytheist o muslims and all people of the world and their leaders i am sorry to give you tidings of a painful torment amid the earth s commencement of experiencing the climate of planet saqar in this year of yours 1445 ah leading to the annihilation of the four season winter spring summer and fall allaah will replace them all with the heat of the summer of saqar which i have been warning you of its torrid hotness sparks see qur an chapter 77 verse32 and fire since 2005 ad corresponding to muharram 1426 ah i have countlessly sworn to you by allaah the great that i am not aimlessly writing to you and i announced to you the end of the four seasons after the current winter had been invaded by the summer of saqar this means there will be no moderate spring after the current winter because the summer of saqar will engulf the four seasons spare yourself the disappointment of a moderate spring or a mild summer and get ready for a consistent increase in temperature i am utterly aware of what i am saying i have warned mankind by a command from allaah the one the overpowering that he will raise the temperature to 151 degrees celsius so what spring are you anticipating good luck with the spring of saqar along with the spring of the sun and the summer of saqar along with the summer of the sun even if allaah sends upon you 755c half the temperature of 151c those who never use their minds will wait for the temperature of saqar s july to reach 151c because some people are as foolish as cows and do not reason these people are far more astray than cattle as per the description of allaah in the clear verses of his book the great qur an أم تحسب أن أكثرهم يسمعون أو يعقلون إن هم إلا كالأنعام بل هم أضل سبيلا ٤٤ صدق الله العظيم qur an surah alfurqan verse 44 or they will believe that human devils will cool the atmosphere of the earth how far the arrogant ones have fooled the world i swear by allaah they cannot save themselves from the heat of saqar so how will they save the earth from the heat of a blazing planet that is 100 times the size of the sun 10010 and 1000 times the size of the earth in terms of the earth s diameter meaning its size is 1000 times the size of the earth as for its density it exceeds that of the neutron star before the big bang that is why when the big bang happened planet saqar did not explode so where would you escape and on the day it passes the hair of young men will go gray out of terror do not you believe allaah in his words فكيف تتقون إن كفرتم يوما يجعل الولدان شيبا ١٧ السماء منفطر به كان وعده مفعولا ١٨ إن هذه تذكرة فمن شاء اتخذ إلى ربه سبيلا ١٩ صدق الله العظيم سورة المزمل quran almuzzamil verses 1719 do you think that only the earth is suffering from the heat of saqar nay i swear by the lord of the heavens and the earth that the sun the moon and all the planets of the solar system are now suffering from the heat of saqar take a closer look at all the planets of the solar system and you will find that it is suffering from an increase in temperature like the earth in line with the word of allaah the exalted أولم ينظروا في ملكوت السماوات والأرض وما خلق الله من شيء وأن عسى أن يكون قد اقترب أجلهم فبأي حديث بعده يؤمنون ١٨٥ صدق الله العظيم سورة الأعراف quran surah ala araf verse 185 planet saqar has messed up the planets order as well as the order of everything believe allaah and his messenger mohammed and his caliph imam mahdi nasser mohammed alyamani if not blame none but yourselves peace be upon the messengers and all praise is due to allaah lord of the worlds the blood brother to mankind from adam and eve the caliph o f allaah the one the overpowering imam mahdi nasser mohammed alyamani,NONE,NONE
i notised there were words he couldnt swallow no more splitting familyes,FAVOR,AGAINST
excited to hear and see more,FAVOR,NONE
phenomenal and powerful sotu address great job president biden god bless you,FAVOR,NONE
yea he broke record of most lies he has destroyed our country,FAVOR,AGAINST
i love joe when he smiles its real when trump smiles he is sneering cuz hes thinking look at these dummies they believe me they give me all there money cuz i say so wake up folks,FAVOR,AGAINST
does trump want to be the king of america does trumps supporters want him to be the king of america i met a trumps supporter who was listening in a trumps rally in radio on a car dealer courteous ride i asked him does trumps supporters want trump to be the king of america he said sort of it trump is poisoning america he doesnt accept the outcome of elections unless he wins,FAVOR,AGAINST
excellent all the way thank you president of the worldfather to the world we love president biden 4 more years to go lets go,FAVOR,NONE
mike johnson the supreme court judges have scowled squirmed the whole time,NONE,FAVOR
did jill make out with kamalas husband this year i missed the first part of the speech fell asleep while they were trying to calm the american people enough to let him enter the building safely,AGAINST,NONE
what a disgrace anger is a sign of dementia meds can help for a while,AGAINST,FAVOR
im from germany and i can say im blessed to live in a democratic state without it i wouldnt have survived in some cases i got unemployment and social assistance and good health insurance please vote blue for your future and that of your children,FAVOR,NONE
fearful powerful uplifting,NONE,FAVOR
keep tankin this country with your lies and bs,FAVOR,AGAINST
what economy does he live in,NONE,AGAINST
his whole speech was complete bs,AGAINST,FAVOR
this man is so angry and i pray he gets what he deserves from the almighty i cant hold back anymore i dont forgive bold face lies im pissed off,NONE,AGAINST
are we better today than 3 years ago,FAVOR,FAVOR
that wasnt a state of the union speech that was a campaign speech,NONE,FAVOR
vote for a republican thats the only way to save it,AGAINST,FAVOR
ww3 it is communismislamism vs capitalismdemocracychristianjews n atheistsi refuse to live under communism or muslim rule,AGAINST,FAVOR
traitor of the united states biden boy,AGAINST,NONE
amazing speech and an amazing man real future is build on things that add to society not destroy not once in his speech he made it his priority to take revenge on the people that did wrong to him sure there were a few uppercuts torwards the former president and now criminal but you can count them on 1 hand trumps speeches are measured in joebideninsultminute please vote for biden,FAVOR,AGAINST
this is a president with humour and respect for the people that elected him the god loving right side have a big problem with other people then themself,FAVOR,NONE
liar an thief,NONE,AGAINST
excellent work mr presidentwe are moving forward thank you,FAVOR,NONE
biden gets most of his votes from people who think they are going to get something for free nothing is ever free its always at the expense of the taxpayers,AGAINST,FAVOR
thank you thank you thank you,FAVOR,NONE
follow president bidenhe is very strong and optimistic,FAVOR,NONE
all puppets sheeple,NONE,NONE
this guy talks a good game but he dont walk the walk to any democrat who reads this you cant tell me that you dont feel the pinch that this president has caused this nation things have gone downhill since he has become our president and you cant deny that so many of you voted against donald trump because you didnt like his personality but look at how good this country was when he was the president everything was cheaper and you know it you have to put your emotions aside and think smart,FAVOR,AGAINST
four more years,NONE,FAVOR
creepy and out of touch,AGAINST,NONE
they clap as if this is biden speaking from his own mind they clap after everything he says as if hes the greatest prez weve ever had i dont get it do they not realize a team of writers sat down and came up with this speech that they put in everything that would sound good followed by a boost of applaud signs this is all bullshit its not organic the speech has been written up to avoid all the terrible things that are happening under his presidency,AGAINST,NONE
zionist and jesuit freemasons run the world learn gematria,NONE,NONE
says he need a border bill nowyet the dems have blocked every border protection bill his whole term theyre liars all of them they started this open border mess and its already killed the country though the effects wont be seen until a few years when biden is dead and buried,AGAINST,FAVOR
this party has run americas economy in the ground,FAVOR,AGAINST
fantastic speech from biden 4 more years,FAVOR,NONE
i can not believe that americans are still applauding this it is exactly like the emperors new clothes the world is watching and laughing,NONE,AGAINST
putin said he has no interest beyond ukraine joe missed the interview,AGAINST,NONE
a very thoughtful and well considered old man he carefully chooses his words unlike the other guy who suffer verbal diarrhea,FAVOR,NONE
very proud of my vieux president,FAVOR,NONE
biden threatens supreme court justices to their faces in state of the union address,AGAINST,FAVOR
like donald dumps son in law hes one of the worst harassing tenants with noises and price gouging hes a horrible human being if you can call him that still cant wait until hes under investigation for the corrupt saudi loan and thats for 2 billion dollars and republicans trying to go after hunter for doing something these corrupt politicians families do all day make money and the money they mention isnt anywhere near 2 billion dollars coming for ya jared kushner and ivanka,FAVOR,AGAINST
nancy pelosi taught laughing kamala how to claplets go brandon,FAVOR,NONE
this man has made america unaffordable and a shit hole but his voters are clapping sad asf,FAVOR,AGAINST
except biden is a liar and have helped china invited america good luck,AGAINST,FAVOR
old joe suffers brain glitch at sotu im gonna get in trouble for saying that but anyone can get in air force one with me to fly to toronto berlin moscow,AGAINST,NONE
why is speaker johnson nodding his head everytime does it mean he agrees in everything president biden is saying he must have been regretting why he came he seem out of place in this forum,FAVOR,NONE
4 more years,NONE,FAVOR
i think it is interesting to read the fact checks most interesting is the number of jobs created when most of the jobs are those that were prepandemic and just refilled after the pandemicyet to normalize the jobs created as a percent of the population no way compares to a record set by other presidents as biden states also wages are not up as biden states when in fact wages are down as compared to inflation and price increases that will not go away on most things americans purchase advanced degrees are required to make over 100000 contrary to what biden stated when not having a college degree at a chip company only yields a job in the 40k80k range biden had 312 years to do the things he restated in his speech and his 2019 campaigns and hasnt accomplished 90 of themlower healthcare costs high paying jobs in the green industry secure the border lower crime be the countrys great uniter etc,AGAINST,NONE
the democrats are obsessed with putin putin is not the problem the president is the problem the establishment that backs him democrats you guys are giving mix signals do you guys want to keep having wars or fix our country,AGAINST,FAVOR
looks like the new moses stands for nothing,AGAINST,FAVOR
both parties are straight trash and biden is liar he hasnt done nothing who tf wants work as a security guard they whole life people have dreams and goals stop spending money to other countries and its just not ukraine but other countries we need to help america first why is immigrants being taken care of but not the american people smh,AGAINST,FAVOR
americans looked for biden the unifier to lay out his plans to fix the border the economy and our international affairs instead we got a hyperpartisan angry grandpa speech where he blamed everything in the last 3 years on trump thank god we wont hear this ass clown again until september when he yells again at the dnc convention fjb,AGAINST,FAVOR
dont think that any money biden gives you will be free you will have to pay it back through your future income tax checks dont be fooled they will basically make the middle class pay for it now and then make you pay it back in the future with your income tax checks,AGAINST,NONE
now i know why im reelecting this guy,FAVOR,FAVOR
this is what dementia looks like people,AGAINST,NONE
we know you will not enforce immigration laws brandon thats why youre going to lose to someone that will and be strong at enforcing american laws and putting americans first,NONE,FAVOR
to quote labeljr88 like the last 4 yrs didnt even happen can any one human be impressed by this guy in the comments,NONE,AGAINST
there has never been a clearer choice democracy vs autocracy decency vs criminality education vs ignorance strength vs weakness responsibility vs chaos inclusion vs division empathy vs bigotry and the list goes on now show your true colors in november whatever they are wear your red hats so i can stay away from people like you for all the others lets build the future of our country together,FAVOR,AGAINST
of course mr biden you and your son been fighting for his business in ukraine while i and family will fight for our survival in america americans are no fool,AGAINST,NONE
biden is considered the worst president ever way too many deliberate bad choices for united states now 1 adderal induced speech isnt going to change anything too little too late,AGAINST,NONE
tear up the speech mike like an adult,FAVOR,NONE
robert byrd exalted cyclops of the kkk was my mentor joe biden,AGAINST,NONE
cnn is definitely scrubbing this comment section,NONE,NONE
your predecessor can only dream of giving the kind of speech that president biden just delivered who left the back door open for mtg of course she had to be the most obnoxious and unladylike person there empty barrels do make the most noise in her case great speech president biden,FAVOR,NONE
i have much better public speaking skills chairman kim,NONE,FAVOR
how about not voting be your own boss they rigged it anyway,NONE,NONE
you cant walk away from america,FAVOR,NONE
everything trump has sacrificed all the scrutiny all the indictments id say he loves this country very much that teleprompter will not save you sleepy joe,AGAINST,FAVOR
when they chanted 4 more years it felt like when palpatine have his speech to the senate the ignorance thunderous applaus,NONE,AGAINST
corn pop or gtfo i was promised no malarkey lying liars,FAVOR,AGAINST
it was good to see mike johnson squirming in the miasma of stygian trumpian stew a grinning idiotically lindsay graham and the madcap marjorie taylor green spewing her usual inanities adding some incongruous theater to bidens powerfully biting and moving speech,FAVOR,AGAINST
awful simply the worst president in history,FAVOR,AGAINST
what a lying piece of,NONE,NONE
lol when trump winthis year i hope on day one he shuts the entire economy down for 5 seconds than opens it back up and then he will be able to clai that he in a matter of seconds created over 158 millions jobs just like biden claims,FAVOR,FAVOR
10 minutes in biden has hit it our of the park the maga gop and that treasonous grifter trump are having a heart attack,FAVOR,AGAINST
joe biden didnt your mama teach you not to lie so dont lie to us we the wolfs know the truth,AGAINST,NONE
support a better america not a cult run by a rapist insurrectionist and fraud wake up maga you are supporting a loser that is only running to avoid prison and not to make america great again,FAVOR,AGAINST
what an angry ranting speech full of obvious lies and outright hatred of half his own country this guy is a danger to the world,FAVOR,AGAINST
dam mike get ur game face up we know putin is ur daddy,FAVOR,AGAINST
trump cant f with biden its not even close anymore,FAVOR,AGAINST
lie after lie angry yelling lowest rated president in history,FAVOR,AGAINST
to those that do vote blue to those that dont vote blue,AGAINST,FAVOR
he just turned trump into a bad hombre,FAVOR,AGAINST
oh they pumped him up full of steroids and aderall,NONE,NONE
maga mike doesnt stand up for united states of america he sits there like lump moses you aint buddy,FAVOR,AGAINST
i will be at the swearing of my president joe biden in november god bless you,FAVOR,NONE
mr president you want more bomb to kill and destroy in ukraine while millions americans dying on the street without food and shelter you are not american sir,AGAINST,NONE
not only the worst president of the last century but also a cruel and vicious demagogue who has used to power of the federal government to go after his political opponents not just trump terrible guy worst president,FAVOR,AGAINST
what an angry loser,NONE,AGAINST
the president biden did excellent job,FAVOR,NONE
10300 honesty lol,NONE,AGAINST
what is it about drugs you are senile and just lie so perfectly and they of course believe you,AGAINST,NONE
pathetic senile incompetent lets go briben,AGAINST,NONE
biden nor trump nor jfk can save the usa from the national debt of 34 trillion dollars sooner or later us economy will fall and will disintegrate will take time though 10 years at max de dollarization is in full swing bonds will crash market will crash us is finished,NONE,NONE
he is so full of shit this is way i dont vote,AGAINST,AGAINST
johnson looked like pinocchio came to life but had no will just a lot of smarmy sly as a fox smirks throughout sotu address,AGAINST,FAVOR
im surprised they didnt turn comments off like the rest of corrupt news,NONE,FAVOR
jobs is sector is a failure have millions of people with criminal records but thee government double jeopardy them every day to use a so call criminal record against them where they cant get a job the hole government is a incompetent feeble minded failure,NONE,FAVOR
mousey mike did not stand up and clap at we are the united states of america what does he want maybe back to the ussr,FAVOR,NONE
for me it was like uss iowa skyrocketing over an hour this is what the president sound when he speaks not like the whining predecessor,FAVOR,NONE
is this the same biden he didnt itch his eye touch his nose or cough not once,AGAINST,NONE
im so happy to hear fjoebs priorities last nightthat americans deserve a properly filled bag of potato chips smh,FAVOR,NONE
biden was toying around with republicans,AGAINST,NONE
there are 3 influential political parties in the usa the democrats the republicans and the magas the only difference is that maga controls the republicans what a shame,NONE,FAVOR
the magas are cowards they dont even clap when biden makes a important statement but it will be their demise,FAVOR,NONE
stand up to turkey iran and qatar too,FAVOR,FAVOR
is there a presidential seal on the podium,NONE,NONE
scott jennings better open his ears and shut his mouth,NONE,NONE
what a joke a joke the usa has become a load of clapping seals i thought i had tuned into jerry springer rip why is the bloke next to pants down harris nodding like a good little boy history is watching lol jan 6 lol insurrectionists joe got 81 million votes with hardly winning a county china must be watching on with glee,AGAINST,FAVOR
america you are lucky to have this man as president cherish him while you can,NONE,FAVOR
best speech lately may the free world prevail arm ukraine,FAVOR,NONE
if i were smart i would go home now thats our president what a joke hes lucky he didnt have to field questions this guy is worthless,AGAINST,NONE
are you kidding me you came into office at the toughest time this country is ever faced and youre leaving behind this country and a great state financially morally and ethically you are a massive narcissistic hypocrite you are spewing and talking lies upon lies upon lies,AGAINST,FAVOR
that was awesome usa,NONE,NONE
geez that was hard to watch,NONE,NONE
thats my president,NONE,FAVOR
this is not a man who is too old unaware of his surroundings or unable to complete a sentence,FAVOR,NONE
you cant only love your country when you win old joe still admitted defeat in ukraine bravo its time to stop funding this war,AGAINST,NONE
what an awesome speech fantastic trumps coffee boy and kaputin supporter mike johnson was smirking in the background mtg was suitably dressed for the maga circus the republican supreme court was nearly all there to get a roasting from biden trumps reaction is childish immature pathetic and wretched,FAVOR,AGAINST
america and the world just watched republicans show their support not to america but for themselves by staying seated while true americans rose and clapped,FAVOR,AGAINST
now thats a president,FAVOR,NONE
he talks about the deficit in one minute and then talks about wanting to raise funding here and there and income for this and that person why didnt you do it already why wait until elections to do anything or to talk about what you want to do how about just do it if you love your country no matter whether you win or not like you said you should,AGAINST,NONE
brilliant speech truly impressive president biden,FAVOR,NONE
i couldnt listen to lies,NONE,FAVOR
id be a winnernot really joe biden,AGAINST,NONE
this speech are marvelous it heats real truths so touching,FAVOR,NONE
i guess this was what fox news feared a presidential speech unlike the hatred trump spread daily,FAVOR,AGAINST
irrespective of how much money we pump into the ukraine there is absolutely no way that a tiny country like the ukraine can lose approximately five hundred thousand men compared to around fifty thousand for russia and expect to win this war the ukraine will be surrendering before the elections in november and all of this bs talk by this liar is not going to change the inevitable what biden would never admit is that the only reason we are involved in the war in the ukraine is because president zelensky has those seventeen missing telephone conversations hooking the biden family into the corruption in the ukraine,AGAINST,FAVOR
vote for america not russia,FAVOR,AGAINST
you were a baptist preacher tonight lol,FAVOR,NONE
johnson looks very scared,NONE,NONE
todays news tomorrows chip shop wrappings peter otoole,NONE,NONE
kamala haris is like the devil in female guise,FAVOR,FAVOR
thank you mr president from nepal,FAVOR,NONE
that was a powerful speech lets hope he makes it in november,FAVOR,NONE
lol he made it that s something something good something not so talk is talk lets see,NONE,FAVOR
so full of himself,NONE,FAVOR
id love the coctail he just got he is proof that medical science has cured alzimers,FAVOR,NONE
did you see mike johnson nod his head at the beginning there get that up you donald ya orange baldy,NONE,AGAINST
im not a us citizen and after hearing joe talk i can say if i was a us citizen i would be proud and i know who i would be voting for,FAVOR,NONE
look at the clown over his left shoulder in the red tie love politics even when biden says something that is totally logical etc he cannot clap or stand and clap because he is politically brainwashed and a tool to the rich,AGAINST,NONE
this is a joke and the good ol dsadivided states of america is becoming a huge joke also the land of double standards i take huge offense to our leaders playing games with my daughters life the lives of every american citizen and the lives of countless civilians around world so the rich men north of richmond can get richer its so horribly sad to see this once great nation ran straight into the ground we have to take care of home and our government first before worrying about homes and government in other countries put the american citizens first for a change,FAVOR,AGAINST
if this pilgrim wants to restore america he should return it back to the native americans,NONE,NONE
3 minutes in and weve already quoted ronald regan clown country were fucked wassup beijing,NONE,NONE
is harris cheerleader,FAVOR,NONE
i have really missed ringling brothers circus especially the s,NONE,NONE
that someone waving that cane in right corner of the screen like give me what i want and ill go away,NONE,NONE
trump said it all when he stated he would like to see america crash and burn while biden is in officehe has never cared for any americans but himselfmost of us see thatvote blue to save democracy,FAVOR,AGAINST
vote for donald j trump for president save america from this lonatec as as stupid as you can be,AGAINST,FAVOR
great speaker well done america make sure you vote for him and make the world safer love from scotland,FAVOR,NONE
