comment,biden_stance,trump_stance
wow the opening statement,FAVOR,NONE
still wearing a mask really bernie like thats going to protect you,NONE,FAVOR
politics politics too much politics its to much,NONE,NONE
whats with all the white coats all they need is their white hats now,NONE,NONE
if a tax cut reduced child poverty by half wasnt at least half of child poverty caused by taxation,FAVOR,FAVOR
he is like barby dolla ha ha ha ha,NONE,FAVOR
read that teleprompter so fast that he started studdering theres nothing being made in the us yes put together but not built from our resources,AGAINST,FAVOR
that simply must be canned applause,NONE,NONE
i cant believe i used to be interested in politics its all so phony and manipulativeall of it,NONE,NONE
this is so beyond sad that its hilarious,NONE,NONE
hes a capitalist when has he ever earned a cent instead of getging it seized from taxpayers,NONE,FAVOR
when you shut down the entire country then it opens back up and then yes people get their jobs back inflation is outrageous all lies youve done nothing,AGAINST,FAVOR
rfk jr 2024,NONE,NONE
sounded like a threat to the supreme court,NONE,AGAINST
this man will put us into wwlll if we the people dont bring him and his paid entourage from power this speech is full of lies if you dont see them you belong with them,FAVOR,AGAINST
5620 if this is sort of to you,NONE,NONE
biden has brought america to its lowest levels of political intelligence poor old bastard ruined a once great nation fjb,AGAINST,FAVOR
republicans wore laken riley pins during president joe bidens march 2024 state of the union address laken riley was a university of georgia student who was killed by an illegal immigrant it is absolutely unacceptable that her life was taken by the hands of one individual one illegal immigrant however that one individual does not represent all immigrants fleeing those same everyday atrocities in their home countries by drug cartels gangs and even their own governments furthermore wearing a pin for one university student killed by an illegal immigrant as a political taking point while remaining silent and refusing to act on the fact that thousands of innocent people including children are gunned down across the united states of america every day week month year is disgusting pathetic and unfathomable the republican party is complicit in all mass shootings by not acting most gunmen committing mass shootings are rightwing extremists republicans are not prolife republicans are prowhite prowhite male heterosexual patriarchy promisogyny prorightwing extremists prohate proexclusion prooppression etc republicans do not care about laken riley republicans only care about taking the united states back to 1861 that is what they mean by make america great again,NONE,NONE
thats all very nice joe why are you risking it all for israel,FAVOR,NONE
idk we are so screwed the choices we are faced with in 2024 civil war or ww3 trump is a racist and biden is a hawk doesnt get much worse,AGAINST,AGAINST
i guess it depends on the subject whether or not its your choice we werent allowed a choice with covid,NONE,NONE
if the race was simply about being presidential and having class the choice would be clear,FAVOR,AGAINST
ridiculous speech just a bunch of lies,NONE,FAVOR
is it just me or am i seeing things wrong how come so many republican senators did not stand up when he said we are the united states of america,FAVOR,FAVOR
he sounds good,FAVOR,NONE
100 was it roosevelt who put the sheep out to mow the white house lawn,NONE,NONE
wouldnt know the truth if it slapped him,NONE,FAVOR
history is leaving behind the ideals if u can call them that of the republican party you cant ship the minorities back to wherever you cant bottle up the lgbtq community and pretend they doesnt exist and hopefully women at last will come out en force like nothing the country has seen to date to put this republican party in its final resting place this isnt bing crosbys america anymore,FAVOR,AGAINST
i say this 1 2 3 4 and 5 everyone stands and claps,NONE,NONE
too bad biden didnt have clean drinking water when he was a kid his parents couldve avoided the resultant brain damage that is clearly obvious during this political speech this is not a sotu this is a campaign speech i wonder how much juice they filled him with to do this campaign speech,AGAINST,NONE
speaker johnson the could not once move his head in the direction he should have each and every time haha hilarious,NONE,NONE
as far as i can tell putin invaded ukraine because he saw we had a weak malleable president who would bow instantly to the slightest bit of attention or flattery and allow him to and again i quote do whatever the hell you want if instead of the us sending aid and support under biden we had a president who sent that same support to putin to invade his neighbors leaving the rest of europe too scared of that dark alliance to stand against it where would we be standing today probably world war 3 im sick and tired of open fascists and nazis in the united states of america people who think the correct response to losing an election is angry mobs violence and death who think agreeing or compromising with your political opponents on anything even things that would save lives is weakness people who dont want a democracy or a republic but a dictatorship this isnt a damned game the world is at stake people act like adults vote like adults shape a world in which your children and grandchildren and your neighbors children and grandchildren can be safe happy and healthy,AGAINST,FAVOR
republicans are against nato wow insanity,FAVOR,FAVOR
jeez this administration is sick and corrupt,AGAINST,FAVOR
trump will sweep this election,NONE,FAVOR
watch mike johnson during the speech he knows hes fighting for the wrong team but hes more worried about himself than his country,FAVOR,AGAINST
i want lower grocery prices,NONE,NONE
mumbling sweating shaking forgetting pausing yelling lying blaming and staring off into space typical biden still embarrassing all of usthe light upstairs is just a dim flickering nightlight he should just go home and enjoy the months he has left in his old age instead of being put on display like a fool,AGAINST,NONE
this is what presidential looks and sounds like,FAVOR,NONE
we are a republic not a democracy get that straight,NONE,FAVOR
this is a perfect example of crap falling out of a shit bag,NONE,AGAINST
biden bowed to ukraine it remains to kiss zelinskys ass,AGAINST,NONE
i thought it was a joke but literally you americans have your own clapping monkeys for a walking dead,NONE,AGAINST
great speech he will win reelection,FAVOR,FAVOR
the covid vaccine was available when trump was president a week after the election it was released so the credit goes to trump not biden,NONE,FAVOR
address the nation on foreign issues that americans are the least concerned about we need help on us soil you bonehead,AGAINST,FAVOR
this impressive speech by joe biden has historic implications for not only america but for mankind throughout the entire world the realization of russian terrorism has demonstrated the manifestation of russian fascism on the european continent,FAVOR,NONE
during communism communists in ussr were cheering and aploading barely moving and talking brejnev for his every fart stalin was getting the same apload this is how totalitarean regime based on pure lie acts the urge for submission to power of these soulles people is insatiableamerica now this whole thing is dreadful to watch,FAVOR,FAVOR
biden has bowed done to putin what has he done to stop putin,AGAINST,NONE
the corporate tax cuts is why the economy inflation was good under trump biden screwed that up,AGAINST,FAVOR
the corporate tax cuts is why the economy inflation was good under trump biden screwed that up,AGAINST,FAVOR
young people need to vote for trump not idiot biden economy inflation the border where illegals come in taking jobs away from the young people,AGAINST,FAVOR
great speech brought tears to my eyes i watch this over and over love you mr president biden,FAVOR,NONE
biden is showing how stupid he is many mail in votes for him were duplicated,AGAINST,FAVOR
biden said putin will not stop at ukraine what has biden done to stop putin for 2 years absolutely nothing,AGAINST,NONE
is the man on stimulating drugs to hide some of his dementia,FAVOR,AGAINST
1450 and i ensure you im happy to buy them,NONE,NONE
this administration is treasonous dont fall for it america the are passing legislation to allow the illegal immigrants to participate in federal elections this is the biggest voter fraud in american history demand same day ballots with id they are cheating and if we allow them another four years your country will be no more im not a republican and dont really like trump but this man has singlehandedly destroyed our economy and national security in three years while violating the first second and fourth amendments completely lied to us multiple times and insulted our intelligence is destroying our country and trying to disarm us so there can b a smooth transition to communism and i dont know about you but i feel like the economy is the worst its been in my life ill spend 100 at the grocery store and walk out with like five things everything has doubled and tripled in cost,AGAINST,FAVOR
well yeah crime rates go down when people dont get arrested for crimes they commit,NONE,FAVOR
why does this give me hunger games vibes,NONE,NONE
biden said it if he was smart he would go home but hes not trump will send him home,AGAINST,FAVOR
love this guy,FAVOR,FAVOR
johnsons head reminded me of a lifeguard flagman his head went side to side up and down and his eyes rolled in even directions i didnt know there were i was waiting for his head to start spinning,NONE,NONE
but joe if you cut credit card fees down to 8 bucks the ceo of these banking companies might not be able to afford their 3rd yacht,FAVOR,NONE
isnt this supposed yo be the sotu address and not a reelection speech but the sheeple will still go baaaahhhhh we are such a doomed species,AGAINST,FAVOR
dementia joe is a mental health crisis,AGAINST,FAVOR
that darkest of days,NONE,NONE
httpsyoutubea0yvc2qhn5esiwwadvh3hpwzecrs0 if you are smart or understand knowledge is power and applied knowledge is freedom youll watch rfk jrs honest evaluation of the real state of our union and real solutions to empowering all americans through healing unifying and truly making this nation prosperous again through ending the military industrial complex and our involvement in other countries wars ending corporate capture corruption within our government and leveling the playing field for all americans,AGAINST,FAVOR
i agreeyoure not smart so you stayed and lied repeatedly,NONE,AGAINST
the resident of the usa spoke many lies in his state of the confusion address here are some of the nonsense he spewed the state of confusion lies with the resident of the white house the resident of the usa and his party only say what they want people to believe but not what they actually do he said so many lies they dangle a carrot giving a pittance to this group and that just to pay for them to vote demoncrap and it usually turns out to be a lieas they are mostly lawyers knowing full well that much of what they say will not actually happen it is similar to the devil asking each person i will give you this if you just vote to mrer babies also the resident and his admin ruined bankrupted america with ieg and war he got rid of all safeguards against the border and then when his voters finally understood what problems this causes the problems we were already talking about even prior to trump taking office now he says that he is going to do something about the problem as though he is wonderful to correct a problem he caused the resident and his admin are always undermining the american constitution and citizens rights as laid out for us in the bill of rights what took the dems that are now crying about the problems of ieg so long to open their eyes and contemplate the economic damage that such a horrible policy would manifest throughout our society in so many ways it was what we had all known it was all obvious how much more damage will be done to our country before the dems wake up in addition are the demoncraps really so dumb that they dont think if you overtax corporations or make them feel overtaxed that those persons which provide goods and services will just make the same or more profits by increasing their prices they need to start using the brain god gave them they each have one and need to stop sharing one brain no the dems creating these policies know what why they are doing it rather it is the dems voting for them that have their brains shut off to doing real research and finding out the truth all the people voting for them do is believe the repetitive propaganda that is just what they want you to do dont wake up just keep believing the headlines dont do any research past the mainstream news and 9999 of this side of the aisle is not against ivf another lie it would be a good idea to stop using aorion as birth control we do not ban books that is another liewe get stuff that was once considered porn out of schools porn is wrong but it is legal for adults not people under 18 yrs of age get the facts stop repeating the lies they want you to believe and start researching the truth in the freedom to vote act has legalese written into it which gives illegals the right to vote that is wrong the citizens of the country vote for their country they came in illegally and then that is the type of people you want in your country people who start out committing a crime this is one of the main reasons the biden admin allowed so many illegals into the country and gave them a bunch of free living expenses and places to live they get 1000 a month and a free place to live do you have a free place to live do you get 1000 a month wake up it is all just in order to make it possible that these persons would vote for the carrot being dangled in front of them these are corrupt democrats deluding the votes of the real citizens and paying for votes by essentially people of other countries and how sad for that dad steve nikoui gold star family who lost a child due to bidens awful exit from afghanistan to be arrested when he yelled after he heard biden exclaim a liethat america is safer now than when he took office when illegals are attacking police raiding homes king and rping you all here that vote demoncrap are asleep at the wheel real christians research the truthnot hearing the truth here shocking that the commentary is not explaining how the border bill and other bills is a tiny tiny amt of money in comparison to the majority of the money allocated in biden admin bills is for bankrupting americans out of their taxes by protecting other countries borders and not our own thats why the congressionals on the other side of the aisle do not vote rather do not want to vote for most of what the demons put forward you all here in this video keep the truth hidden why it has been a game for the hiden lien briben coniven biden admin to make huge bills with a laundry list of items bankrupting americans and funding other countries part of the money sent to ukraine each month is aprx 20000000 just to pay for their administrations salaries pensions thats just a fraction of our money that they get it is bribery money to keep the war going so that ukraines government does the bidding of the biden regime just imagine if they put the same amount of money into helping and fixing the problems here in our own country instead of funnelling it to many other countries the bidens have hidden and not paid their fair share they are corrupted with all the money they have received from thier deceptive involvements with other countries the audacity of joe saying that people should pay their fair share when his family members and himself have hidden money and not put it on their tax reports not small amounts huge amounts it has been documented of bribery with ukraine company and now do you wonder why so much money is given to ukraine to keep people in the know so happy with money that they will not speak up when are you all going to stand up for the constitution and the bill of rights and the needs of americans first do you feed your neighbors kids and leave yours to starve do you leave your doors open at night and stand guard around your nieghbors house at night wake up b4 our country gets any worse lets go branden,NONE,NONE
i cant stand it,NONE,FAVOR
that was the most dark divisive demented deranged angry false and horrendous sotu speech in us history this guy his entire cabinet and half of the entire house are rabid communists that are pushing radical marxist stalinist leninist tactics and ideologies that will destroy america as they are meant to by design the globalists are working overtime on the destruction of america and they use a half dead reanimated corpse like biden to embarrass us worldwide,AGAINST,FAVOR
biden has clear voice much better than young men even better than trump structure old but brian sharp give him a second term,FAVOR,AGAINST
great speech,FAVOR,NONE
what a nasty speech,AGAINST,FAVOR
wheres his wedding band was this actually biden,AGAINST,NONE
with every word spoken by president biden the republicans trumpers and magas are being proven bigger bigger liars i dont feel sorry for the gullible and delusional people that never double check what they are told they just swallow the lies like the children of israel did with the lies of the corrupt sadducees of jesus day as christ said stain at the gnat but gulp down the camel,FAVOR,AGAINST
3 minutes in and he already is taking quotes out of miscontext from our former president,AGAINST,FAVOR
women are not without electoral or political power,NONE,NONE
wowwhat a wonderful speechhe hit all the us dreams that havent been touched in years praying it is all heard by everyone in this world thank you mr president,FAVOR,NONE
the lie that stands out for me was no american boots on the ground follow that up with no american fighter bombers no bradley tanks no american weaponry no american money but he wants us to look at the boots two state solution is israel and america the jews have used americas might to destroy palestine israel has committed genocide desecrated and decimated palestine with american complicity biden may be fuming at bibi netanyahu on the down low but he has given bibi the hawk full reign to conduct his 1000 palestinians to 1jew formula trust no man,AGAINST,NONE
worst president in history without a doubt,FAVOR,AGAINST
great speech,FAVOR,NONE
shannon bream fox poll state polling from 57 voters show they have less money in their pockets than last year how accurate are those polls,NONE,NONE
he reminds me of fire marchal bill with that stupid smile how gay,NONE,NONE
the treatment of mtg after her defiance of house rules shows there is a double standard one for republicans and one for democrats there is going be hell to pay when the shoe is on the other foot miss taylor no longer greene has shown herself to be a lover of self 2 timothy 32 new living translation for people will love only themselves and their money they will be boastful and proud scoffing at god disobedient to their parents and ungrateful they will consider nothing sacred,FAVOR,AGAINST
clapping seals waiting for a fish from their trainer,NONE,NONE
we need to take this guy out of office,FAVOR,AGAINST
seehes not all there,NONE,AGAINST
when biden said we all came from somewhere but we all are americans the gop members shown were stonefaced i guess that dont like the real america,FAVOR,AGAINST
when is he off to the old folks home he must be close with that dementia,AGAINST,FAVOR
i am not a democrat or republican its like i am watching idiocracy 2 lol,NONE,NONE
history is not watching so much as i am watching you,NONE,AGAINST
look at how disgusted the republicans are when he talks about billionaires paying taxes these people are demons,FAVOR,AGAINST
great speech,FAVOR,NONE
imagine if all this crap came truewed be screwed no jobs,NONE,NONE
he definitely was on a happy pill other wise he would of slurp words i must say he was pretty good,FAVOR,NONE
what a shoe,NONE,NONE
this is a joke more like a campaign speech no solutions to all the problems he has caused,NONE,AGAINST
the problem is that people vote thease ahs in its horrible along with cnn msnbc csnbc bbc and the rest of the shenanigans,AGAINST,FAVOR
i wish i can say i am proud of the us president speech in bitter reality it is quite contrary repulsive speech full of lies,AGAINST,FAVOR
the worst president in history worse then carter god forbid if they do cheat this time around,FAVOR,AGAINST
doesnt our country have better issues than a womans reproductive system since when are we involved in ibf and a womans right to choose who are you people,FAVOR,AGAINST
this wasnt a state of the union address,NONE,FAVOR
hahahahaha thank god we are not a democracy but a constitutional republic we dont say to the democracy for which we stand we say to the republic for which we stand beware of the democommies narrative,AGAINST,FAVOR
president deserves respect thank you for standing mike johnson,FAVOR,NONE
this speech is what makes this country the shining hill bravo the unity in us creates unity all over the world excellent speech,FAVOR,NONE
all these comments from woke boomers are hilarious,FAVOR,NONE
when you get to be my age certain things become clearer than ever example america is a nation that can be defined in a single word asdfoothasdhtin_uh_ftftfot,NONE,NONE
something needs to be done about the border gods children are at stake when you leave the borders open for the chance of gods children to be abducted into south america with the border being opened that is easy to do and you say you wanna give immigrants the possibility to pursue their dream they canget a green card like everybody else the american people have to pay our corrupt government for everything we do but someone not from this country can take our jobs and live tax free for 7 years but we struggle daily my question is do you have a grudge on our country please put more focus on our border maybe not a wall have applications for immigrants to fill out with their background with their job experiences and let them drop their application at a border station by making a grant call it the dreamer grant and bring in so many immigrants yearly or quarterly with that grant it beats cartels and more drugs pour into our country please consider something thank you and god bless,FAVOR,FAVOR
even reading through these comments most people joke around on both sides too we are being slowly moved into a communist system you will own nothing and be happy meaning they dont want you with any money they want you fatsick they want you depending on them these people all need to go democrats and republicans we need real people who will actually represent us the people and these old sick corrupt grandma and grandpa mothers lovers need to go would you feel comfortable with your 82 year grandpa running the country i know i wouldnt,AGAINST,AGAINST
why do americans insist on being lead by the elderly,AGAINST,NONE
this state of the union is horrible not only does he openly show his hatred towards anyone who may be a republican conservative or anyone who isnt a far lefty but he is speaking lie after lie after lie and the most annoying part is the fact that this is all stagedtheatre for the history books plus you have every useful idiot standing up and applauding like he solved world hunger after every sentence sit down shut up and listen to him talk he stated that the covid vaccine is now starting to help treatcure cancer awesome show us the studies the proof just because you say things doesnt make them true give us evidence give us clear facts the border is a complete screw up the economy is horrible incredibly hard to save any money they tax us on everything we are in a slave system with the illusion of freedom our government with zero remorse is bombing and killing innocent people overseas for their own personalfinancial gain as they continue to use our tax dollars to fund this crap and these people are laughing and have the audacity to say everything is fine theyre talking about how companies put less chips in their bags and how he wont let that continue no one cares about that our country is slowing being destroyed youre making our lives harder and crazier by the day and people still side with these people wake up mr president youre corrupt and most anyone with an ounce of common sense people want you gone,NONE,NONE
nursing home,NONE,NONE
chronic news network,NONE,NONE
politics is all such a show for the masses,NONE,NONE
this is the same speech he did last year and the year before if you dont believe me look up mark dice,NONE,NONE
how about reproductive responsibility you shouldnt have to have abortions if you are reproductively responsibility sex isnt a sport it isnt an activity it isnt a contest wake up people wake up boys and men you are guilty of using women of deserting girls women when they get pregnant what you had nothing to do with this take responsibility man up that child did not ask to be created that baby does not have to be killed get real sex is a beautiful sacred thing meant to unite people in love and setting a safe place for family america is going down in irresponsible behavior god forgive us sad gramma,FAVOR,NONE
joe got my vote for this one,FAVOR,NONE
we can say we are strong and getting stonger because we are americansnot because of your political manipulations,FAVOR,AGAINST
drinking game you have to take a shot every time he says america,NONE,FAVOR
i dont wanna listen to this asshole,NONE,AGAINST
what a lying pos he is 100 im voting for trump i dont want world war 3,AGAINST,FAVOR
joe biden is a manipulator in everything he says,AGAINST,NONE
