channel_name,video_title,published_at,video_id,view_count,like_count,comment_count
ABC News,Trailer for the highly anticipated Joker sequel premieres,2024-04-10T23:28:52Z,wewAxFKCXck,10204,80,29
ABC News,"Americans spending hundreds more each month compared to 2023, data shows",2024-04-10T23:26:15Z,H3JttdmOzW8,47462,549,537
ABC News,Celebrating Eid Al-fir,2024-04-10T23:03:05Z,8rA5HAgx0bw,3969,46,3
ABC News,Alejandro Mayorkas&#39; impeachment trial delayed,2024-04-10T22:45:40Z,tNOXQ51p2kQ,15666,117,263
ABC News,Deadly storm wreaks havoc in the South,2024-04-10T22:33:13Z,iq_WD93PZSs,2920,39,11
ABC News,Walmart shoppers could qualify for cash from $45 million settlement,2024-04-10T21:30:37Z,NH9YvfYN7DQ,49378,1293,71
ABC News,Police respond to Philadelphia neighborhood shooting amid Eid celebrations,2024-04-10T20:37:31Z,yy4p0ypuo04,61949,939,309
ABC News,Legendary basketball coach Tara VanDerveer announces retirement,2024-04-10T18:15:00Z,-McVXbaI5Uw,1314,24,4
ABC News,&#39;It will happen&#39;: Israeli Prime Minister Netanyahu says date has been set to invade Rafah,2024-04-10T17:45:44Z,4JFlfvnxpXA,9340,48,81
ABC News,Trump says Arizona upholding near total abortion ban law goes too far,2024-04-10T17:20:07Z,opVTsHxaHUk,22248,327,109
ABC News,Georgia sorority sisters rescue mom and kids from sinking car,2024-04-10T17:00:01Z,2ZV7oHZid3A,6551,170,16
ABC News,Speaker Mike Johnson says ousting him would be &#39;unproductive&#39; as Marjorie Taylor-Green adds pressure,2024-04-10T16:45:04Z,owyvioIFnZ0,69088,822,457
ABC News,Trump says Arizona abortion ban went too far,2024-04-10T16:25:33Z,80E1IJZsC_c,8578,89,268
ABC News,Pres. Biden and Japanese Prime Minister Kishida deliver opening remarks ahead of summit,2024-04-10T15:37:14Z,-0Na56ebuuQ,5884,71,37
ABC News,Opening statements begin in Chad Daybell&#39;s triple murder trial,2024-04-10T15:30:11Z,gOEV7BViB8Q,21912,179,34
ABC News,Prime Minister of Japan arrives for White House visit,2024-04-10T15:08:21Z,J_ZTjJI9u0M,3574,41,34
ABC News,Trump lawyers scramble to delay hush money trial in latest bid,2024-04-10T15:00:29Z,Nwg6ZMBhc_g,44214,543,580
ABC News,See the newly released police body camera footage of a Chicago traffic stop turned deadly,2024-04-10T14:45:00Z,D2MKgZfckN0,38047,235,551
ABC News,Former Trump organization CFO Alan Weisselberg sentenced to 5 months in jail,2024-04-10T14:31:49Z,lEeEcwNBwp4,21587,374,221
ABC News,Ex-Trump Organization CFO Alan Weisselberg to be sentenced for perjury,2024-04-10T13:45:01Z,PY3UlE6xopo,5272,103,45
ABC News,Breaking down the impact of March inflation surge,2024-04-10T13:41:17Z,nUoPPTQ3IXg,113604,656,1795
ABC News,Impact of Arizona&#39;s near-total abortion ban as state Supreme Court upholds Civil War-era law,2024-04-10T12:00:31Z,P2RgmQcPdB0,6006,62,203
ABC News,New whistleblower claims against Boeing&#39;s 787 Dreamliner planes,2024-04-10T11:11:10Z,uA-xi9aBWPo,5994,63,46
ABC News,School mass shooter&#39;s parents sentenced to 10 to 15 years in prison,2024-04-10T08:31:11Z,Ve5Aig0jn0M,135432,1266,2141
ABC News,The father of modern bluegrass on his new album,2024-04-10T06:00:02Z,6QCGXp_JYb0,7649,23,2
ABC News,Alabama residents fight environmental injustice along a freeway,2024-04-10T05:00:08Z,K-y_kJU7cjc,6138,86,17
ABC News,"Giant waves crash over seawall, flooding street in western France",2024-04-10T04:30:07Z,PuYsi2BO2Rk,19238,174,36
ABC News,How Arizona&#39;s abortion ruling could impact political races,2024-04-10T04:00:38Z,ymS0AYDvms0,1263,13,19
ABC News,"Program brings intervention, awareness and education of Black maternal health",2024-04-10T03:30:03Z,85O1yMp6fs8,1393,21,3
ABC News,"LIVE: ABC News Live - Tuesday, April 9",2024-04-10T03:20:37Z,DbHf6SYPIz0,132277,898,
ABC News,Planned Parenthood official reacts to 160-year-old Arizona abortion ban,2024-04-10T03:00:16Z,VWnADt1DSiw,4151,83,98
ABC News,Ewan McGregor on his new role in ‘A Gentleman in Moscow&#39; and that peculiar mustache,2024-04-10T02:40:28Z,bnj-saieh-g,1727,25,8
ABC News,Bodycam video released from deadly police shooting in Chicago where 96 shots were fired,2024-04-10T02:10:35Z,LDwB49Ce2GE,54836,334,607
ABC News,"ABC World News Tonight with David Muir Full Broadcast - April 9, 2024",2024-04-10T02:00:16Z,mHSewYrONPY,416018,4504,702
ABC News,Arizona Supreme Court upholds state&#39;s near-total abortion ban,2024-04-10T01:51:48Z,oUh6hCYw6Os,2131,27,38
ABC News,Parents of the Michigan school shooter sentenced to 10 to 15 years in prison for manslaughter,2024-04-10T01:15:04Z,MlbWBEu-C1Y,301437,1930,1485
ABC News,ABC News Prime: Arizona abortion ban; Parents of school shooter sentenced; Environmental racism,2024-04-10T00:31:28Z,UIgvmd3ZMAI,35510,572,
ABC News,Biden welcomes Japan’s prime minister to White House,2024-04-10T00:18:59Z,ahkIUPwgxHk,20936,324,135
Fox News,‘The Five’: Scrabble dumbs itself down for the ‘woke’,2024-04-10T23:30:04Z,CXbCrYzdAaM,82165,1781,775
Fox News,‘The Five’: Trump orders milkshakes while Biden lashes out,2024-04-10T22:45:00Z,WyOt5No6q5U,395452,11987,4240
Fox News,"RFK, Jr.: Biden could seal the border overnight without an executive order",2024-04-10T22:00:22Z,Uyfn-02lapw,38971,1552,766
Fox News,McEnany: This was a very powerful admission,2024-04-10T21:00:30Z,fGq74YegP74,425372,9579,2072
Fox News,Trump expects Arizona will have to change abortion laws after state&#39;s ruling,2024-04-10T20:15:00Z,Z9PErlAri3Y,31416,536,948
Fox News,Iconic board game releasing &#39;less competitive&#39; version for Gen Z,2024-04-10T19:30:02Z,Aihl5f_oFMg,13123,279,299
Fox News,McEnany: The press would have never let Trump get away with this,2024-04-10T18:45:00Z,ENTKaCD3ZkM,230779,5288,1648
Fox News,Idaho teen accused of planning ISIS church massacres,2024-04-10T18:00:19Z,fG0CzPU86E4,91054,1784,1056
Fox News,Biden says US-Japan alliance has never been stronger,2024-04-10T17:58:32Z,OPvu5cndYJI,17581,262,260
Fox News,Trump eviscerates Fani Willis: She’s ‘totally discredited’ #shorts,2024-04-10T17:30:03Z,GBzWejf6FWs,138367,12745,523
Fox News,Biden deliberately takes Trump out of context to manipulate Latino voters: Garza,2024-04-10T17:15:00Z,2VD5lyj8eSs,39986,1108,836
Fox News,Bret Baier: Will President Biden ever debate former President Trump in 2024? | Will Cain Show,2024-04-10T17:11:12Z,FSOde04eZvE,11558,313,60
Fox News,Trump torches DA Fani Willis: &#39;She&#39;s a criminal!&#39;,2024-04-10T16:30:06Z,Ww_IISpOLew,261378,10597,2939
Fox News,Eric Trump makes BOLD 2024 prediction: &#39;I know we&#39;re going to win&#39;,2024-04-10T16:30:12Z,j_1zqwBD3Z8,30192,2559,152
Fox News,Longtime NPR editor exposes news station&#39;s bias,2024-04-10T15:45:00Z,Co2wr2MmZNo,53701,1399,651
Fox News,President Biden welcomes Japanese PM Fumio Kishid to the White House,2024-04-10T15:39:02Z,h74qxtXXh20,15660,153,110
Fox News,FBI Director Wray reveals the &#39;defining threat&#39; of this generation,2024-04-10T15:00:06Z,8pWdfLAjcR8,32043,1065,589
Fox News,Ainsley Earhardt: This is Joe Biden&#39;s crisis,2024-04-10T14:15:03Z,wpBTmiH2g5E,70819,2063,950
Fox News,Eric Trump hits back at Trump&#39;s left-wing critics: &#39;I know we&#39;re going to win&#39;,2024-04-10T13:30:03Z,877VeH_7fjk,84121,4858,1912
Fox News,Tim Scott: We need &#39;4 more years&#39; of Donald Trump,2024-04-10T13:00:34Z,ZY6lF5J2k3Y,40665,5195,372
Fox News,Biden called out by his own former chief of staff,2024-04-10T12:45:02Z,mDS0wscVJW4,87088,2284,833
Fox News,&#39;NEW WORLD OF LAW&#39;: Fallout from prison sentences for school shooter&#39;s parents,2024-04-10T12:15:01Z,Kgi8xlpFWpc,156320,2454,1918
Fox News,Biden admin torched for &#39;shamefully defending&#39; China visa policy,2024-04-10T11:30:24Z,xS6vr4N3exg,28090,626,301
Fox News,Mayorkas to testify before Congress as House delays delivery of impeachment articles,2024-04-10T10:45:02Z,tTPiu_EE8Ss,41645,884,609
Fox News,Mike Huckabee: Israel&#39;s existence is being threatened,2024-04-10T10:00:38Z,mrhCH1-EZQg,32495,1314,457
Fox News,NPR has eliminated ‘diversity of thought’: Vivek Ramaswamy,2024-04-10T09:00:05Z,4DN1ZUzLs7k,92924,3091,766
Fox News,Tim Scott: We need &#39;4 more years&#39; of Trump,2024-04-10T08:00:31Z,ibAnsiRe1TI,15630,748,412
Fox News,Could the New York hush money case impact Trump&#39;s election bid?,2024-04-10T05:00:10Z,EEkHwy8aUAY,43480,669,1101
Fox News,Jonathan Turley: The left is treating justices like they are fungible,2024-04-10T04:15:00Z,F0ZxfRDuchA,65457,1755,408
Fox News,Who’s the ‘dumbest of them all’ on ‘The View’?: Gutfeld,2024-04-10T03:30:26Z,oC_dc6oK_GI,455798,13125,1739
Fox News,Jesse Watters: Parental ignorance is no longer a defense,2024-04-10T03:00:21Z,h75k6dKYQ_E,83721,2707,595
Fox News,"Jesse Watters: Everyone is asking, &#39;Where is Kamala?&#39; #shorts",2024-04-10T02:45:02Z,_960FdCivDI,168797,9321,553
Fox News,Sean Hannity: Journalism has been replaced by liberal activism,2024-04-10T02:30:14Z,XVr2xqRMIEg,42833,3778,203
Fox News,Sean Hannity: Journalists are far-left hacks,2024-04-10T02:15:00Z,9D4CYo3n__w,69212,3316,1033
Fox News,Ingraham: Biden is losing ground big time,2024-04-10T01:45:00Z,MqxMH7wJNmg,83496,3419,644
Fox News,Jesse Watters: Kamala wanted to talk about herself,2024-04-10T01:02:34Z,VPR_mpFcKtg,414413,8787,2249
CNN,What it&#39;s like to fly for 33 hours on a B-52 bomber,2024-04-10T23:10:48Z,VrjsIfaFGoc,110169,2842,116
CNN,Why Trump&#39;s appeal hearing was held in a basement,2024-04-10T22:42:22Z,jHViieftxMc,470046,8156,2876
CNN,Arizona state senator who had an abortion blasts restrictive ban,2024-04-10T21:15:00Z,7L5V_KvVASQ,26230,549,512
CNN,John Dean: Trump’s appeals are ‘frivolous’ and ‘desperate’,2024-04-10T20:45:01Z,kjQ5jt64Xts,132892,1805,712
CNN,&#39;Crazy&#39;: Witness describes shooting scene,2024-04-10T20:12:06Z,Uq_bQDtca3o,47325,566,467
CNN,CNN anchor rolls tape on Kari Lake&#39;s abortion stance before the state Supreme Court ruling,2024-04-10T19:30:02Z,Q_nk244TMmw,191214,2738,1051
CNN,Hear Trump&#39;s reaction to Arizona&#39;s abortion ban,2024-04-10T18:35:58Z,UTOhPtDRqBk,102158,1405,943
CNN,Zelensky tells CNN the US needs to send aid to avoid Putin from starting WWIII,2024-04-10T18:00:58Z,m5ljXYNTZEg,111480,1647,2570
CNN,See why a soccer team had to duck-and-cover during practice,2024-04-10T17:37:59Z,h5c2rGVCd-k,25324,542,33
CNN,Ex-Trump CFO sentenced to 5 months in jail,2024-04-10T17:25:46Z,bJU5xmEZins,186708,3007,1501
CNN,Trump’s lawyers file another appeal in hush money case,2024-04-10T16:46:33Z,ePsEDtI2Ro4,466107,7392,3533
CNN,Is the pricey Apple Vision Pro worth it? We spent 2 weeks using one to find out,2024-04-10T13:00:05Z,6gWXThBz_4w,13979,125,98
CNN,See GOP lawmakers reaction to MTG&#39;s push to build support to oust Johnson,2024-04-10T13:00:40Z,YBekm9zH2EA,585040,8009,2511
CNN,RFK Jr.&#39;s running mate says Democratic lawmaker asked her to quit. Hear his response,2024-04-10T10:00:42Z,tNCoON2pK7U,41518,450,698
CNN,How do you pick a jury for Donald Trump? Elie Honig explains,2024-04-10T02:30:21Z,mt29WEtojFM,43100,536,422
CNN,Maggie Haberman on the ‘one out’ that Trump may take on abortion stance,2024-04-10T01:30:29Z,gWTuLLfVHPY,125256,1752,683
NBC News,Trump says Arizona abortion ruling went too far,2024-04-10T23:45:02Z,vFg7hScf2Q0,3933,43,63
NBC News,Severe storms and tornadoes sweep through Gulf Coast as millions face flooding risk,2024-04-10T23:36:28Z,TiN-buU-B_w,34037,253,42
NBC News,Meet the Press NOW — April 10,2024-04-10T22:45:00Z,A5FuIc5-tPY,129725,707,182
NBC News,Empty bus catches on fire and crashes into Missouri home,2024-04-10T22:15:01Z,TMy0KqGnq-8,6045,85,16
NBC News,Speaker Johnson uses &#39;McCarthy-esque&#39; tactics after House Republicans block FISA bill,2024-04-10T22:00:31Z,hpPEutPOxDk,33681,317,209
NBC News,Chuck Todd: Why a political middle ground no longer &#39;exists&#39; on abortion,2024-04-10T21:30:04Z,QpAvzbIiQbo,37598,407,199
NBC News,Police: Three wounded and five arrested at Philadelphia Ramadan celebration,2024-04-10T21:00:01Z,aXO2oII7abY,5964,60,38
NBC News,Trump says he would not sign a national abortion ban,2024-04-10T19:45:00Z,usOT-FfmEis,5431,86,30
NBC News,Missouri death row inmate executed despite calls for clemency ,2024-04-10T19:30:07Z,scjJoBzUqtk,31363,585,393
NBC News,An escaped horse runs loose at a train station,2024-04-10T18:30:21Z,cnkPPCgC71Y,14033,312,12
NBC News,EPA announces new rules targeting &#39;forever chemicals&#39;,2024-04-10T18:18:12Z,A5tf5nDyzOI,17330,185,84
NBC News,Trump says he would not sign a national abortion ban,2024-04-10T18:00:23Z,vZ2tD9hGeYM,8458,148,70
NBC News,Watch: Biden holds joint press conference with Japanese prime minister | NBC News,2024-04-10T17:56:43Z,wsQay_O9L0Y,19274,498,127
NBC News,Arizona Supreme Court ruled a near-total abortion ban from 1864 is enforceable,2024-04-10T17:30:03Z,I7vhbDbuki8,32400,695,330
NBC News,Mississippi &#39;Goon Squad&#39; members sentenced for torturing Black men,2024-04-10T17:30:04Z,exMqg9c1wEQ,269672,4047,1759
NBC News,President Biden and Japanese PM Kishida meeting intends to deepen defense ties against China,2024-04-10T17:00:00Z,0s8XKlsEIjI,4014,44,34
NBC News,Morning News NOW Full Broadcast - April 10,2024-04-10T16:40:26Z,MdmIFsnUuzg,127897,436,68
NBC News,Surveillance video shows a woman attacked and robbed outside a New York City church,2024-04-10T13:17:35Z,qSt8z4KHCSM,9383,62,80
NBC News,March inflation report shows costs rose 0.4% on a monthly basis,2024-04-10T13:15:05Z,pe6gG9ThzuI,6048,53,118
NBC News,This Morning’s Top Headlines – April 10,2024-04-10T12:48:07Z,Xa6-ijLuFHk,15561,149,37
NBC News,Biden says Netanyahu is making a &#39;mistake&#39; with his handling of the war with Hamas,2024-04-10T11:00:25Z,NZkcvLnZ8W0,4819,61,72
NBC News,Amateur photographer captures one of eclipse&#39;s most stunning images,2024-04-10T05:00:01Z,0QqfCyoyOJo,60044,958,99
NBC News,"Thousands evacuating in Russia, Kazakhstan after severe flooding",2024-04-10T04:30:06Z,IeImRgW0dV8,29825,303,124
NBC News,New York City&#39;s police commissioner on his mission to reduce crime,2024-04-10T04:00:15Z,TzXmBEY2dfs,2652,33,23
NBC News,Giant wave crashes over seawall during storm in France,2024-04-10T03:45:03Z,_oWqnCu-wqk,16575,286,11
NBC News,Top Story with Tom Llamas - April 9 | NBC News NOW,2024-04-10T03:44:01Z,TSvfqoQH44U,108282,356,67
NBC News,Former educator charged with child neglect in case of student who shot teacher,2024-04-10T03:30:18Z,uCI6ko9q4vQ,4441,37,17
NBC News,Prosecutors say Alec Baldwin had &#39;no control&#39; of emotions on &#39;Rust&#39; set,2024-04-10T03:15:02Z,x_sWINyIi5Q,28723,85,91
NBC News,Goat named ‘Jeffrey’ trapped for hours on ledge in Kansas City,2024-04-10T03:15:02Z,jcid7Axo6Uc,31836,484,18
NBC News,American farmers sending aid to rebuild Ukraine&#39;s farming industry amid war,2024-04-10T03:00:02Z,4bkW-VSWACo,3419,67,13
NBC News,Families of hostages held in Gaza call for action,2024-04-10T02:45:00Z,1_J0oVTkXuI,8942,230,51
NBC News,Stay Tuned NOW with Gadi Schwartz - April 9 | NBC News NOW,2024-04-10T02:34:54Z,JIvZwZQrbC4,16031,107,28
NBC News,Amanda Knox faces new slander trial in Italy,2024-04-10T02:30:10Z,OqHeMxOauhQ,108042,1190,1038
NBC News,Nightly News Full Broadcast - April 9,2024-04-10T02:00:31Z,rBfqksmYY-0,692002,6943,1183
NBC News,Akron police release body cam video showing officer shoot teen carrying toy gun,2024-04-10T01:45:03Z,oOqhRqSeo6I,79747,753,1089
NBC News,Syphilis cases in the U.S. at highest level since 1950s,2024-04-10T01:30:03Z,aqpa__y7tD8,7585,133,66
NBC News,Hallie Jackson NOW - April 9 | NBC News NOW,2024-04-10T01:18:28Z,mU4NeZCcfNY,215479,773,141
NBC News,Two-story houseboat spotted on the bay,2024-04-10T01:15:01Z,jBr9TOw4zLA,21623,355,27
NBC News,Missouri executes death row inmate despite calls for clemency,2024-04-10T01:00:09Z,PBlUTU1ZDyU,472920,3867,2989
NBC News,NYPD commissioner says New York is heading in &#39;right direction&#39; despite high-profile crimes,2024-04-10T00:45:00Z,_U62KwPNwSg,2845,29,7
NBC News,Norfolk Southern agrees to $600 million settlement in Ohio train derailment,2024-04-10T00:30:02Z,adoNepdDtHE,2239,30,5
NBC News,Whistleblower raises safety concerns about Boeing&#39;s 787-Dreamliner,2024-04-10T00:15:00Z,CJVytcEttiI,58281,731,365
NBC News,Idaho teen arrested for allegedly planning to attack churches,2024-04-10T00:00:07Z,9kxbfFXYc6g,9668,91,57
BBC News,7 members of Hamas leader’s family killed in Israeli airstrike - BBC News,2024-04-10T22:11:32Z,8SepfTHRJ3U,316729,3760,3547
BBC News,Muslims around the world have begun celebrating Eid al-Fitr. #Shorts #BBCNews,2024-04-10T21:00:31Z,jAI0Qz94pKk,28862,1541,141
BBC News,"Japan, US and UK will hold regular joint military exercises from 2025 | BBC News",2024-04-10T20:21:12Z,QOUGlWEpwL4,50821,715,306
BBC News,TV cosmetic doctor exchanged Botox for sex with patient. #Shorts #TijionEsho #BBCNews,2024-04-10T20:00:01Z,2Q1U08ZJoZA,29658,418,80
BBC News,How much aid is actually getting into Gaza? #BBCVerify #Shorts,2024-04-10T18:57:04Z,365xI9u6GUk,5946,111,71
BBC News,A two-storey houseboat was towed through San Francisco bay. #SanFrancisco #Shorts #BBCNews,2024-04-10T16:31:36Z,3tEuDebwwR4,29149,763,45
BBC News,Russia flood: Thousands evacuated from homes as Ural river water levels continue to rise | BBC News,2024-04-10T15:57:04Z,T05I-SBhXoI,163229,2143,894
BBC News,"Pressure on Israel not enough, say dissenting US officials | BBC News",2024-04-10T13:00:27Z,L7tj1O8N2oQ,48103,596,382
BBC News,Biggest coalition aid airdrop into Gaza marks end of Ramadan | BBC News,2024-04-10T11:45:15Z,pPjGTh9SQ-s,31941,461,278
BBC News,Rafah residents hold Eid prayers by destroyed mosque. #Gaza #Shorts #BBCNews,2024-04-10T11:43:40Z,pbB0bJnSV5Q,16953,491,54
BBC News,Boeing hit after new whistleblower raises safety concerns | BBC News,2024-04-10T10:30:06Z,Iz-XY6XfXjk,54722,846,221
BBC News,Arizona Supreme Court reinstates near-total abortion ban from 1864 | BBC News,2024-04-10T09:20:46Z,yXHLS8RLg14,22813,361,476
BBC News,The parents of a Michigan teenager who shot dead four students have been sentenced. #Shorts #BBCNews,2024-04-10T08:50:25Z,CpG9lcsJ4KU,19282,427,56
Al Jazeera English,Russia floods: Record-high water levels in Orenburg persist,2024-04-10T22:55:34Z,QrbqMqzd71o,7125,112,52
Al Jazeera English,"Killing of Haniyeh’s children, grandchildren ‘does not happen randomly’: Analyst",2024-04-10T22:24:04Z,loNQY12sP3c,159357,2304,1540
Al Jazeera English,Israeli strike kills three sons of Hamas political leader Ismail Haniyeh | AJ #Shorts,2024-04-10T19:56:32Z,vkipqO1apoI,140738,8531,686
Al Jazeera English,Activists spray paint UK’s Ministry of Defence building red | #AJshorts,2024-04-10T19:54:29Z,jz4WKLbA4vk,67034,7757,461
Al Jazeera English,"What high-tech weapons are Japan and the Philippines buying, and why?",2024-04-10T19:36:23Z,GmKfcJMtT0w,90638,1250,397
Al Jazeera English,Russian attack on Kharkiv region: Three killed in attacks in northeast Ukraine,2024-04-10T19:15:00Z,Odrlz1nk6Go,6137,103,43
Al Jazeera English,Can there be Eid when people are dying? | Quotable,2024-04-10T19:05:17Z,nrcrpqqwoPs,29309,2696,141
Al Jazeera English,European Parliament passes asylum and migration reforms,2024-04-10T19:00:15Z,SdNip4rs7Ms,3723,62,17
Al Jazeera English,Israeli army claims attack on Haniyeh’s children in Gaza,2024-04-10T18:41:50Z,84S0owLrd4A,148205,2557,1890
Al Jazeera English,Congress cafeteria blocked by pro-Palestine activists | #AJshorts,2024-04-10T17:37:10Z,x8pYZdd3INs,176454,18581,947
Al Jazeera English,What&#39;s behind Berlin&#39;s unwavering support for the Jewish people? | Inside Story,2024-04-10T17:30:03Z,H3dkupPrERI,95606,1562,1506
Al Jazeera English,Haniyeh to Al Jazeera: Killing of family members won’t affect Hamas’s demands,2024-04-10T17:00:24Z,jOOdfoh1cG0,156383,2756,1908
Al Jazeera English,European migration pact: EU Parliament to vote on asylum reforms,2024-04-10T16:45:01Z,g4Evu_4td-U,5442,71,42
Al Jazeera English,How do the hungry mark Eid al-Fitr in Gaza? | The Take,2024-04-10T16:34:25Z,6BXjG4FSE8M,15095,436,71
Al Jazeera English,Lost Futures: How greed is destroying our planet | Dying Earth: E1 | Featured Documentary,2024-04-10T16:30:04Z,PCdseac57_Y,169530,4052,817
Al Jazeera English,"UN says 38 dead, including children, as migrant boat sinks off Djibouti",2024-04-10T16:15:01Z,EiDxexLO9gA,2419,35,15
Al Jazeera English,"Israeli air attack kills 3 children, 3 grandchildren of Hamas leader Haniyeh: Report",2024-04-10T15:38:08Z,4RsD346_n3g,122751,2402,2212
Al Jazeera English,Eid in the occupied West Bank: Palestinians visit graves to remember the dead,2024-04-10T14:45:03Z,ebmhdWXkZmg,22349,767,135
Al Jazeera English,Rare phenomenon in skies over Italy’s Mount Etna | #AJshorts,2024-04-10T14:36:41Z,10pFNeY-5p0,39815,2098,135
Al Jazeera English,Eid al-Fitr in Sudan: Thousands gather to pray for peace,2024-04-10T14:30:01Z,2mdViLrgmAM,11830,456,65
Al Jazeera English,Djibouti shipwreck: At least 38 migrants die after boat capsizes,2024-04-10T14:15:05Z,mDDa9hEe7Fk,5337,91,22
Al Jazeera English,‘Steadfast despite grief’: Palestinians in Gaza mark solemn Eid al-Fitr,2024-04-10T13:45:02Z,YtRjIX4d7Eg,21817,705,111
Al Jazeera English,Road to Paris 2024: Cheptegei aims for Olympic gold,2024-04-10T13:30:20Z,kfxus3ycUeo,1541,43,6
Al Jazeera English,Wartime Eid begins for Palestinians in Gaza | Al Jazeera Newsfeed,2024-04-10T13:27:46Z,stfrHJbHeJU,57453,1772,216
Al Jazeera English,Ratings agency Fitch lowers China’s sovereign credit outlook to negative,2024-04-10T13:00:18Z,QeOfr8Ozfc4,2388,37,12
Al Jazeera English,Myanmar fighting: Military is losing key bases to armed groups,2024-04-10T12:30:04Z,2Dk2_nscOuY,131956,1774,265
Al Jazeera English,Sudan displacement crisis: UN says little response to appeals for funding,2024-04-10T12:21:52Z,DBjCCZrFERQ,2244,66,10
Al Jazeera English,Journalist fired after boycotting Israeli-bound goods | Quotable,2024-04-10T12:04:59Z,g88zxvcLmf4,24268,2177,271
Al Jazeera English,"‘At this point, it looks like a Rafah invasion is inevitable’: Analysis",2024-04-10T12:01:01Z,CZ43VCp8CFI,54203,916,376
Al Jazeera English,Mexico releases footage of Ecuador police storming its embassy | Al Jazeera Newsfeed,2024-04-10T11:24:56Z,UaEGVM616YY,30802,909,154
Al Jazeera English,US protesters call to defund Israel&#39;s Gaza war during budget hearing | AJ #shorts,2024-04-10T10:57:19Z,acJk4trHrg4,26831,3430,108
Al Jazeera English,Eid under the shadow of war: Palestinians try to keep traditions alive,2024-04-10T10:56:52Z,JaqMSTRAyKE,29395,854,124
Al Jazeera English,"Iran’s Khamenei blasts Israel, West for ‘bloody’ Gaza war in Eid speech",2024-04-10T10:15:47Z,pIW-WAmvLgY,249540,2815,1126
Al Jazeera English,Retired US General says Israel&#39;s war on Gaza is ‘about land’ | Quotable,2024-04-10T08:56:35Z,OlwLE0Vhzdk,64996,6408,344
Al Jazeera English,Thousands gather for Eid al-Fitr prayers at Al-Aqsa Mosque,2024-04-10T08:41:28Z,AMQmGDyjUqg,25990,726,127
Al Jazeera English,Eid prayers by Palestinians in Gaza and Al Aqsa | AJ #shorts,2024-04-10T08:27:33Z,fLM6Wov4f5c,206661,25891,555
Al Jazeera English,Biden says Israel’s Netanyahu making a ‘mistake’ on Gaza | AJ #shorts,2024-04-10T06:57:35Z,khTtDIfpHBw,271716,8835,2606
Al Jazeera English,"Israel bombs central Gaza, kills 14 in Nuseirat, as calls for more aid grow",2024-04-10T06:01:58Z,KhhBg7GEvoQ,35886,900,336
Al Jazeera English,Parents of US school shooter jailed: Ethan Crumbley killed four students in 2021,2024-04-10T03:50:58Z,UOEScaI0wUs,5356,92,21
Al Jazeera English,US steel deal under pressure: Board to vote on takeover by Japanese rival,2024-04-10T03:50:55Z,QN7_CkLqLnE,3825,67,16
Al Jazeera English,"Russia floods: More than 10,000 homes submerged in the Urals",2024-04-10T02:27:59Z,eqJWYWyDseo,4433,103,26
Al Jazeera English,Mexican embassy in Quito raided: Former vice president Jorge Glas arrested,2024-04-10T00:55:29Z,Xj3HBxM1TGA,11400,145,85
