comment,stance_llama_8b
are any republicans and democrats talking to one another do so go over to the other side and chit chat please,LIBERAL
i hope the january 6 insurrectionists were able to watch bidens speech from their prison cells,LIBERAL
he says american democracy prevails like it was some event against another nation lol it was all americans that stormed the capital says trump didnt care about the pandemic i believe he got out vaccines pretty darn quick says trump told putin to do what he wants lol yeah right thats why putin didnt do anything while he was in office then fragile biden comes in and he invades ukraine joe why is the border flooded with ppl drugs why are prices through the roof we leave noone behind what about how you withdrew from iraqafghanistan lies bs lies bs its amazing how many sheep believe this moron yeah jobs in america but where does all the parts come from not america you could go on forever funny the other news channels shut off the comments i wonder why,CONSERVATIVE
bad actors they are getting paid for clapping and their fake smiles ill give him credit for making all those numbers up lol but dont quote himhypocrisy its real in the left side,OTHER
this was a campaign speech,CONSERVATIVE
excellent speech talking about the things that really matter time for economic reform so that ordinary working people get their fair share more security at the border without eliminating immigrants who deserve to arrive and we need international cooperation to resolve global crises a rational approach to dealing with climate change which is a reality as the people in north texas must realize by now lets hear reputation based in reality instead of all this ridiculous name calling,CONSERVATIVE
he was so jacked up he didnt talk about what people going through what the idiots all he talk about all stupid democrats all of them problem oriented wow god help our country people must come together take him out of the wh people wake up not stupid,CONSERVATIVE
trump said biden is going to get us into world war ii terrifying,CONSERVATIVE
what kind of drugs did they give him just to get through the speech probably some of the drugs hes been letting come over the border,CONSERVATIVE
shame on us,CONSERVATIVE
rfk jr 2024,CONSERVATIVE
all the fake news channels turned off comments remember when gropy joe ran the last time youtube took off the counter for thumbs dawn and didnt allow comments,CONSERVATIVE
our enemies inside and outside our open boarders are smiling and ringing their hands,CONSERVATIVE
from me and my organization plus other organizations this was the most state of the union address we ever heard a president deliver our president dont need no cognitive test at all cause this man is on point oh my god we say go go go commander president joe biden people votepeople vote we and many others are behind commander joe biden we even have many republican friends that will be voting for commander president joe biden right along with us bidenharris 2024 vote katie britt you are trumpitize you full of that juice your speech was fake fake fake fake sitting in your kitchen like a rich princess dont know anything about being poor girl please you are just as bad of a as donald face trump our commander president joe biden laid it all down trump need to move to russia and be vice president for puden we dont need no donald face trump were on the commander president joe biden vote we are on just like our commander president joe biden we our commander president of the joe biden our president joe biden put you maga people on display tonight maga people yall are a,OTHER
trumps brain is turning into mush and every penny you send him will go to paying the selfproclaimed billionaires legal bills,CONSERVATIVE
what were they thanking him for,CONSERVATIVE
thatwas utterly embarrassing,CONSERVATIVE
sleepy joe you let the country down,CONSERVATIVE
why did the border only become a problem because of an upcoming ellection all of a sudden its not secure,CONSERVATIVE
bidens speech was exhibitionistic like a circus but katie britt is a real airhead,CONSERVATIVE
id actually love our country to go back back to morality virtue godliness etc,CONSERVATIVE
history is watching how you are destroying the value of usa,CONSERVATIVE
he talked about billions from companies and we have a 1 trillion ever 3 month problem,CONSERVATIVE
cantankerous old man no doubt hyper caffeinated for the evening not to mention a hyper partisan speech far from a genuine state of the union address,CONSERVATIVE
what a great speech biden wins,LIBERAL
laken riley is a democrat and she hates republicnas why are you trying to use her as a political pawn lmao,CONSERVATIVE
trump i agree with you,CONSERVATIVE
room full of stupid people and paid actors it takes a really stupid person to believe anything coming out of his mouth,CONSERVATIVE
well done biden you knocked it out of the park,LIBERAL
liar is going to lose,CONSERVATIVE
i swear this was a complete shitshow lies and propaganda ukraine what about your own people what a sham,LIBERAL
mike johnsons facial expressions are pure gold,OTHER
he really started with jan 6th then say we must speak the truth pathetic i just cant thanks foxnews but i can not take him anymore,CONSERVATIVE
biden needs a body double and a different speech writer,CONSERVATIVE
a life time of practice a life time of liesyou know i mean the big guy haha,CONSERVATIVE
pres trump must sue biden 6 january insurrection blaming djt from safrica,CONSERVATIVE
whats pelosi doing there ugh,CONSERVATIVE
ill tax you and you and then ill tax that tax so i can tax you more keep you in poverty lets go joe burden,CONSERVATIVE
whats with all the witches in white,CONSERVATIVE
vote against this regimebefore its too late,CONSERVATIVE
would like to see a random drug test on brandon fjb,CONSERVATIVE
you cant love your country only when you win but its ok to disrespect the supreme court when you dont,CONSERVATIVE
that traitor johnson is for continuing the war in ucraine,CONSERVATIVE
so i am an enemy of the state because i support trump,CONSERVATIVE
dynamite speech thank you president biden for taking care of the citizens of the us capped drug prices caps on bank overdraft fees to 8 internet service heading to ruralurban america repairing old bridges and roads raising tax brackets so as to not eat up your pay raise strong economy per realfactual data and the long list goes on,LIBERAL
the white house has become an assisted living facility,CONSERVATIVE
i think this was the worst state of the union i have ever watched,CONSERVATIVE
you cant love your country only when you win tell that to hillary clinton,CONSERVATIVE
maga trump trump trump trump,CONSERVATIVE
state of union address by a clown,CONSERVATIVE
i cant finish this gaslighting session just nonstop lies and ukraine support what happened to american citizens,LIBERAL
these puppets clap for lies then the cackler kamala stand up for everythingyep they pull her strings,CONSERVATIVE
fdt,CONSERVATIVE
this man told so many lies in this speech he wouldnt know what truth is,LIBERAL
look at all the idiots clapping all satans puppets,CONSERVATIVE
address the real problems of the usa will u joe for a change,LIBERAL
i cant watch probably a giant train wreck,CONSERVATIVE
omg biden give me headache just listening to him,CONSERVATIVE
people r a virus to the planet they have to go i firmly believe in population control too many idiotsim not black anymore either i now identify as a caucasian binary triangular squirrel respect my gangster and im telling santa claus kids r fake this yearvote for trump 2024 long live the illuminati someone gonna be butthurt over thiswelcome to my social experiment,OTHER
this is like the exercise yard at san quinton full of criminals,CONSERVATIVE
katie you had your speech made up ahead of time it sounds like you were talking about trump all the way,CONSERVATIVE
incredible speech poor rump i wonder if he still wants to debate he better start practicing,CONSERVATIVE
such a mean old man,CONSERVATIVE
dream on biden shows the mentality of the demorat party pray for peace putin lives in bidens head dear god biden is crazy he wants war from safrica,CONSERVATIVE
what a disgrace to our nation,CONSERVATIVE
you all are talking about lies without citing one thing that he said you are so brainwashed,LIBERAL
couldnt stand watching for more than the first 10 minutes so tell me did biden say anything about securing our borders which is one of the most important things the potus should do to ensure our national security i am going to guess not did he know that he has the authority to invoke the defense production act without needing congress to agree so that ammunition supplies artillery shells and other military equipment production could be increased and supplied to ukraine i am also going to say not did he explain why he continues to forgive student loan debt and transfer that debt to other taxpayers even though the supreme court told him that he did not have the authority to do so again i am going to say he didnt,CONSERVATIVE
its funny republicans would probably get along very well with biden hes old white been in the government for decades a selfadmitted capitalist wants manufacturing jobs to go back to america and clearly loves this country as evidenced by how much he proudly proclaimed it today,LIBERAL
oatmeal brains,CONSERVATIVE
who are those idiots clapping including haris,CONSERVATIVE
all the news supporting the pres has the comments off this guy lied about everything has had four years in office and ruined everything was fighting the texas to secure the boarder and now is acting like he is for protecting it,CONSERVATIVE
inflation has gone down where mars,CONSERVATIVE
every time i see biden i hear circus music not exaggerating,CONSERVATIVE
a horrible state of the union address and an even worse response to it one of the cringiest night in american history,CONSERVATIVE
i see the trolls and censors are very active here,CONSERVATIVE
bidenlie only we have to way to remove biden is to old to be a president he looks like mummy,CONSERVATIVE
this man was a senator for 36 years and a vp for 8 yet he blames everything on trump he has done nothing for this country in 50 years nothing will change now,CONSERVATIVE
cant tell whose walking sticks these are,CONSERVATIVE
mr speaker the president of the united states 3644 actually starts at 4608,CONSERVATIVE
where are these 100k jobs with no college degree,CONSERVATIVE
typical yt is burying comments again,CONSERVATIVE
i see bidens writers are still using pieces from other presidents very nice very historical,CONSERVATIVE
sorry guys im changing my vote to bidenhe can do the job and isnt divisive and as dishonest as trumpamerica needs to come together and that wont happen with trump plus no standing up to putin could be the one of our biggest ever mistakes and frankly no president of mine will not support ours allies against the murdering thug who like china and iran will do anything to damage america,CONSERVATIVE
worst president ever and cabinet they should all be ashamed of themselves for destroying this country,CONSERVATIVE
this guy is quick to forgive china but has it out for putin kind of interesting considering china just killed millions of people across the globe,CONSERVATIVE
god they are so far removed from the people,LIBERAL
this man is just too old seriously he would not respond well any moment of pressure 11535,CONSERVATIVE
great speech a true leader who knows how to get things done winning,CONSERVATIVE
fox will have a field day with this speech and a massive thank you to marjorie taylor green and all involved in honouring laken riley,CONSERVATIVE
joe has an ear piece,CONSERVATIVE
he cant even get the name of a girl who was murdered because of him correct everyone that says they will still vote for him are a pathetic excuse of an american citizen,CONSERVATIVE
the worst president in us history giving his last state of the union address thank god trump,CONSERVATIVE
so much for decorum marjorie taylor greene is an insult even to the republicans at this point mike johnson must be so pleased to be part of the same party good christian right she is a despicable human being i hope trump chooses her as his running mate it would be so appropriate,LIBERAL
i must be honest the demorats to be chanting 4 more yearsfor biden their mental state must be in question its unbelievable to think these demorats make decisions on behalf of america citizens god help you all pray god bless pres trump and the maga patriots and god bless israel in the mighty name of jesus christ amen and amen from safrica amen,CONSERVATIVE
not convinced the subtext was i have energy but the performance was that of a method actor the tone was angry bitter and accusatory the libs are terrified of trump,CONSERVATIVE
actions speak louder than words as always they lie and promise without delivering look around you and youll know what the democratic party really wants mass illegal immigration to take jobs sew chaos having us welcome a policesurveillance state with open arms to be safe from the thousands of criminals hes all but rolled out a red carpet for they care nothing for americans,CONSERVATIVE
biden gets all his kick backs from ukraine so do many democrats,CONSERVATIVE
this guy is a legend he is 13 the age of the usa,CONSERVATIVE
why are they applauding,CONSERVATIVE
irf millions of people from around the world and desdly drugs can make it easily through thr border this is not the time to ban assault weapons or the black market and gangs will have them imagine rhe outcome,CONSERVATIVE
time for a diaper change and an ice cream cone as promised,CONSERVATIVE
im 20 minutes in and are asking myself who the tf voted for this idiot wo ever voted for this fn idiot should be ashamed,CONSERVATIVE
everyone hates these crooks yet there in office wow theres a few good ones,CONSERVATIVE
obama never underestimate joes ability to fck things up,CONSERVATIVE
i like how cnn disabled comments,CONSERVATIVE
his mouth didnt match him actually talking correctly and it appears biden was ai generated because of his ability to speak as we all know is messed up most of the time his hands were also flat when he talked most of the time which is a sign of ai generated graphics i call the whole thing totally faked,CONSERVATIVE
what drugs do they give him that makes him angry and coherent,CONSERVATIVE
hes a piece of crap,CONSERVATIVE
biden spent the majority of his time yelling at the top of his voice admonishing others in an attempt to distract from the true state of the american union since he took over a speech with absolutely no substance by a president who is barely alive at this stage surely the us can do better than that he is an embarrassment,CONSERVATIVE
what a complete waste of time and tax payers money,CONSERVATIVE
he couldve concluded all these in one word asufutimaehaehfutbw but he didnt,CONSERVATIVE
he had to bring up jan 6 as americas darkest day what an idiot,CONSERVATIVE
but he didnt say her name he called her lincoln not laken,LIBERAL
angry old wannabe tyrant gaslighting and shouting down at everyone hes a jerk,LIBERAL
biden on target sincere nothing like his predecessor additionally britts repub rebuttal pure theatrics bored me after 10 minutes,CONSERVATIVE
who careswhy are we covering this,CONSERVATIVE
how did they prop him up,CONSERVATIVE
all i seen tonight was biden telling us a bunch of lies that he has done so much for the country well he has he distroyed it he made us a laughing stock with the world,CONSERVATIVE
one of bidens best speecheshes winning reelection for sure now you cant love your country only when you winremember that republicans,LIBERAL
hunters absence was the first highlight of the night hatred filled the room emanated from pitiful politicians usa was stepped on again with accommodations,CONSERVATIVE
it really does make you wonder like what the end game for these people where are they going to go,CONSERVATIVE
what a disgusting lying piece of crap he belongs in an institution not the white house worst president in history,CONSERVATIVE
gtb instead of gdp 14606 this is why our country is fed up,CONSERVATIVE
cartel biden is a national disgrace and global embarrassment fact,CONSERVATIVE
this wasnt a state of the union it was a state of confusion,CONSERVATIVE
proud of our president powerful speechi hope to see the changes he promotes when he is re elected,CONSERVATIVE
we want a republic not a democracy,CONSERVATIVE
that table talk isnt gonna cut it youd been better off just showing proof of his lies one by one with facts or show his numbers vs trumps as far as border crossings i know weve all seen them but guess who hasnt this appeal to family values wont cut it against these demons know your enemy right obviously republicans still dont get it edit ugh not the empty chair technique,CONSERVATIVE
what a crock of lies and deception whats up with harris always standing up clapping and staring at the camera like a deer in headlights he has pulled the wool over a lot of peoples head as fellow americans suffer just a touch on this subject criminals can get and do whatever they want and banning something keeps the law abiding the prey he needs to walk away and give up on 24,CONSERVATIVE
interesting speech but the gops response had more substance,CONSERVATIVE
hes the threat to our country,CONSERVATIVE
joe biden is 100 full of bologna,CONSERVATIVE
look at this theyre all laughing shaking hands joking around this is serious solemn business how about acting like it im profoundly disgusted with our representatives what a circus of hypocritical clowns,CONSERVATIVE
this was the state of the gaslighting i cant believe he used this speech as a campaign speech ohwait this is sleepy joe the opportunist,CONSERVATIVE
cocaine is hell of a drug,OTHER
the longer we collectively put up with this treasonous dogshit the longer it will happen,CONSERVATIVE
hunter biden dont pay taxes,CONSERVATIVE
hey kamala clean up san francisco too many homeless on the streets make use of yourself,CONSERVATIVE
i am just now watching this i turned the volume all the way down and hit the speed button at the top just to watch the expressions it was quite comical i know from the past 3 years he told all lies then read some of the comments,CONSERVATIVE
that was not a state of the union speech it was a campaign speech his speech writers are horrendous,CONSERVATIVE
we might as well communism in our futureif he is reelected,CONSERVATIVE
what a show thx fox to keep comments open,CONSERVATIVE
it very much seems the house is divided,CONSERVATIVE
train wreck,CONSERVATIVE
proud democrats of what sad sad very sad i have nothing to say about aging but this is from lie after lies of sin,LIBERAL
this guy is a complete demon,CONSERVATIVE
i was thinking he was going to walk up to the podium forget where he was and look around like grampa simpson and go which one of you is the mailman,CONSERVATIVE
a state of union or a state of confusion,CONSERVATIVE
amazing how much joe and this government cares more about ukraine than our own countrys problems,CONSERVATIVE
i dont know why the speaker of the house was clapping he need to get some balls he needs to get all that information to adjudge and get this guy out of office he compiled enough information to proceed to put president joe biden in his place im talking about impeachment impeachment impeachment no more inquiryfire him persecute him put him in jail,CONSERVATIVE
the wrath of god is coming upon this nationbiden is godless,CONSERVATIVE
sorry laken died but so do thousands,CONSERVATIVE
old cronies cluband we pay for these guys to rip us offwhen are we the people who pay their wages going to wake up to the evil that has destroyed our country its so very sadthe entire world has gone madmay god and his magnificent son be with us all in these evil days come quickly lord jesus,CONSERVATIVE
the angriest political speech in my lifetime how could he start with ukraine he was well medicated and rambling couldnt get trump out of his mind without mentioning his name had no idea what is going on in the country,CONSERVATIVE
is this a state of the union address or a prom celebration could not tell the difference,CONSERVATIVE
inflation immigration economy omg everything going up all talks no action can we all just get along,CONSERVATIVE
lie after lie contradiction after contradiction this is a of s,CONSERVATIVE
united states is a dying empire just as rome and the empires that came after it,LIBERAL
so amphetamin can make speak even an old dement cheater liar mass murderer,CONSERVATIVE
fire joe he is the worst,CONSERVATIVE
i feel like its late on christmas eve and the kids are all wound but we have to hold it together while the elders get their brandy slushes and cackle and reminisce waiting for tomorrow mornings wonder and glory like christmas is coming but all the while being the adult now and knowing aghh its just work and more work pass the moth balls and the brandy slush its gonna be a long wait,OTHER
and these are the criminals from both sides deciding americas fate disgusting,CONSERVATIVE
biden is a dictator,CONSERVATIVE
hes high,CONSERVATIVE
i thought it was the most divisive state of the union i have ever seen for a guy that was going to bring the country together 3 years ago,LIBERAL
either you stand with us for democracy against russia or you admit that you are nothing but an enemy of the state i used to disagree with the right on simple things but now i feel they are nothing but puppets for the enemy i hope that i am proved wrong,CONSERVATIVE
joe biden is so distant from america and especially all american citizens problems and needs its actually sad to see how low america has fallen with joe biden his democrat woke politicians administration government that dont even know what america needs are especially whats important to american citizens like the protection america and of israel,CONSERVATIVE
by youre doing you sick f putin is by far a better man and president than you sir whoever you are,CONSERVATIVE
i just came over to look at these people who forbid me buying bioshock in my country,OTHER
how are you going to compete with president joe biden with a wonderful state of the union like this doansl trump aka the crooked nepotic grifter with your 98 charges,LIBERAL
israel has the right to defend herself,CONSERVATIVE
we picked bernie both times,LIBERAL
so happy i missed this what a joke,CONSERVATIVE
wow he killed it trump would have been lost the entire time,CONSERVATIVE
the look on johnsons face shows the true state of our nation its sad that we have a president that cares about everyone but us,CONSERVATIVE
my goodness hes one angry elf,CONSERVATIVE
woow kamala is actually real 4 more years of this guy would be an absolute disaster,CONSERVATIVE
biden 2024 what a great speech mtg is a disgrace republicans under trump are doomed best part was when they cut to langford and he says its true on what would have occurred if the border deal passed trump supporters are delusional economy is booming america is rising and trump and his antidemocratic supporters and enablers will be defeated again democrats will keep the presidency expand their control in the senate and retake the house biden knocked it out of the park mike johnson told the house republicans to not act out they could not follow it and it was hilariously sad to see his face of disappointment and embarrassment biden baited them to act out and they took it he threw it back on to them dark brandon is activated trump is going to lose 2024 and will be convicted in 2025 and behind bars repealing roe v wade and pushing moderates away from the party is the killing blow to trumps hopes in the general election,OTHER
one of the worst state of the union speeches ever it was full of lies and hate,LIBERAL
that sad shell of what was possibly human at some point in time couldnt tie his shoes unless they where children hair flavored ice cream cones and people think he runs america bahaha the war is comming be ready the people arent gonna stand for this for much longer god bless america,CONSERVATIVE
when he was 29 the senate leader who was a white supremest liked joe and let him into the senate early back in those days joe talked about the jungles that senate leader left his desk to joe and joe never marched with mlk he lies,CONSERVATIVE
biden threatened the woman in the supreme court biden spoke something very dangerous,CONSERVATIVE
im 62 and have heard quite a few state of the union address speeches tonight i heard literally one lie right after another despicable disgraceful sickening are a few words coming to mind,CONSERVATIVE
the unpatriotic americans on fox spin news are furious that president biden proved that he has the mind of a very healthy 18 years young man,LIBERAL
i cant listen to him for more than a few seconds the amount of lies and corruption he has perpetrated and perpetuated throughout our country is all i think about when i hear him it makes me rise to 100 on the inside with all of my heart and soul i hate this man for what he has done is treasonous and evil the propaganda the mishandling and free will with our tax dollars looking at his watch during a salute repeatedly at every salute to the dead and the list is endless he deserves to be charged with treason 100 times over and everyone who has allowed his masters to corrupt them as well,CONSERVATIVE
watched to see if he would make it no other reason its all rhetoric,CONSERVATIVE
liars will be liars pig will stand with pigs and pigs are better than the government,CONSERVATIVE
creep,OTHER
how about the safety of our boarders fzjb and his administration,CONSERVATIVE
why did they choose that fake drama queen to do the rebuttal,CONSERVATIVE
