comment,stance_llama_8b
ok mr president just listen to my words slowly and you will be fine,CONSERVATIVE
this was a campaign speech,CONSERVATIVE
lets go brandon,CONSERVATIVE
5005 im confused he says his team developed a by patrisian deal when they bood it was oh u hate the rep bill they put together then explaines why its good once the cheer starts it was his credit so which is it rep deal or his good or bad,CONSERVATIVE
lies lies lies he is a corrupt criminal that has been destroying this great country all he spoke were lies lies lies shut the border down now all the americans that have died is because you and the left their blood is on your hands worst president ever,CONSERVATIVE
its much better to watch from the fox seats vs cnn how do thoae libs live with themselves they think biden is the best thing sinceuh all electric cars,CONSERVATIVE
good morning sir please to meet you today keep it and going on sir,CONSERVATIVE
when did he teach the second amendment for 12 years,CONSERVATIVE
why was that man arrested yes arrested for speaking out against the marines that were killed,CONSERVATIVE
biden is trash worst president ever,CONSERVATIVE
it would be a historic day to see the first american president to go to prison for treason and corruption,LIBERAL
when me as a senior reach a certain age time to go he to old for that postion and he frailspeak the truth shame devil do better fine a young man who can just move faster my lord help us jesus amen that settle it in heaven on earth and be safe amen amen,CONSERVATIVE
im yet to see a state of the union that was just an election speech,CONSERVATIVE
that is such a weird behavior in the beginning,LIBERAL
so is the blm riots the antifa and fbi agents that were proven to have pushed people into the capital are what exactly thats not political violence and a blatant insurrection but some people walked around the capital when they were let inside after antifa pushed the gates down and ran to the door and thats an insurrection right,CONSERVATIVE
total political rally and the only one hell ever have because these are the only people that cheer for him ever put them in front of a crowd and all theyll do is heckle him which is why he will never do any type of rally,CONSERVATIVE
is this for real im cutting the deficit by another trillion dollars by making corporations wealthier,LIBERAL
he would have been better off saying how he single handedly destroyed this country,CONSERVATIVE
these reps chewing gum vulmiting experience,CONSERVATIVE
you can tell the bigger lies by kamala harris standing to applaudhow do you know when biden is lying hes talking,CONSERVATIVE
since when do you socialize before a state of the union address and wires everybody bending over and talking to him like hes a little kid oh thats right because he acts like one i thought he was going to walk in with an ice cream cone,CONSERVATIVE
protest civilians in gaza the way we did in japan in wwii,OTHER
i really didnt hear the state our union is in but just a lot of yelling at us americans that see through this admins bs,CONSERVATIVE
hunter pay your fair share,CONSERVATIVE
this was not the state of the union address it was more like a campaign speech biden i dare you to get up and debate with president trump i dont think you can do it because youre worthless weak,CONSERVATIVE
welcome to good house it ukraine and usa,CONSERVATIVE
what a bafoon,CONSERVATIVE
who cares about lower prescription costs when we are being invaded with millions of people getting free money food and places to live that are rasing are taxes we already are losing half our pay checks to taxes lower cost on prescription dont matter if our country gets destroyed by a 3rd world war or we are killed by migrant crimes get your priority in order joe people arent as dumb as you think,CONSERVATIVE
the reptilian next to the speaker exposed herself a few times during jeckyl s speech,OTHER
recorded clapping cuz who in their right mind would clap for byeden,CONSERVATIVE
whatever they pumped biden full of for this speech i want some,CONSERVATIVE
a huge asset president joe trumpstomper biden has is his opponents underestimate him just like hes done before trumpstomper biden came out of his corner landing one hard punch after the other crowding the gop against the ropes and pummeling them he ended up toying with them like that time sugar ray leonard faked the big exaggerated windmill windup with one hand and then punching roberto duran in the face with his other hand republicans cant say we did this or we did that because they stopped trying to make things better in america years ago all they want to do is argue and hurl insults help russia bring down a us president and stare at photos of hunters club look who their honored guest was george santos there are no republican fingerprints on the new firetruck new health clinic modernized water treatment plant new clerk of the courts office or many other projects in my district making things better thanks to joe biden republicans declined a chance to share credit for bringing broadband to the rural area where i live or to fix the roads i drive republicans dont want to lower prescription drug prices help more people get health insurance help families with the child tax credit or give relief to victims of predatory lenders instead republicans threaten my social security republicans want to defund the police make sure crazy people can get ar15s and prolong the border crisis,OTHER
its hilarious that all the sudden biden claims to be worried about the border when this problem started 5 years ago all the sudden now hes worried right before the election what a joke a political farse,CONSERVATIVE
he gave a coherent intelligent speech and gave people hope and at least attempted unity didnt ramble on about nothing contrast this with trumps vile lie filled semi coherent ramblings that are filled with hate bigotry divisiveness and lie after lie the contrast is startling,LIBERAL
my boy joe nailed it what happened to the right can any explain it cant be the abortion issue because they care leas when a mom tosses a baby in the dumpster often alive on a hot day i mean what has your party so out aligned with realityits amazin wooo,LIBERAL
how can the leader of america stand up there and lie to the american people the people in that room know he is full of bs most people at home watching also know he is full of crap some people at home are watching with a blanket on and candles lit because they cant afford their bills due to bidenomics thanks joe for taking half our paychecks to give it to aliens that hate us and wish us harm and contribute nothing to society but waste,CONSERVATIVE
what a waste of time watching this,CONSERVATIVE
hunter gave too much of his stash,CONSERVATIVE
biden said he believes in freedom and democracy core values like honesty decency dignity equality and respect and that other people his age see it differently way to lose the votes of us seniors,CONSERVATIVE
he say bunch of lies last night on thursday night,CONSERVATIVE
old people yell a lot,LIBERAL
biden and trudeau should be sent to an island prison both criminals,CONSERVATIVE
how many clones do they have of this guy lol why cant he debate trump if he can talk like this why doesnt he sound like the other 95 of the time if you cant debate your opponent you damm sure cant protect this country from other countries that hate us,CONSERVATIVE
biden foolish old man im surprised he could stay awake,CONSERVATIVE
i tried watching this video but i cant this man is such an asshat he opens his speech by talking about a foreign war we have no business funding i dont know if hes the worst president in history but hes got to be top 3,CONSERVATIVE
not 45 minutes into the speech of lies his dose of amphetamines is starting to running out he begins stumbling and slurring words,CONSERVATIVE
in my lifetime 64 yrs now i have never heard during the state of the union any president taking up time speaking about their predecessor none the less deciding them disgusting,CONSERVATIVE
harris is an amazing leader what the hell are you talking about brandon,LIBERAL
i had to turn it off i cant stand even looking at that idiot,CONSERVATIVE
what about freedom of speach,CONSERVATIVE
the authors of the constitution never meant for politicians to make a career in congress thats the biggest problem we have in americas government,CONSERVATIVE
ok fauxnews do your best to report the news not greet fined another half billion dollars,LIBERAL
katie britt i salute you after this biden circus gggrrrr,CONSERVATIVE
the white house where residents feel like presidents,CONSERVATIVE
but he said the most correct if not the only accurate thing he will say during the entirety historyiswatching and so is god,CONSERVATIVE
this is supposed to be the state of the union not the state of the ukraine,CONSERVATIVE
i found it very hateful and i dont know what drugs hes on but thats all hes doing is screaming and lying and thats my opinion,LIBERAL
what the hell did they give him before coming out hope it wears off before bed time hes got to be on something extremely strong yelling and screaming angrily other times not so much sotu has taken on a very dark and ominous tone wow,CONSERVATIVE
from what i see in this circus president putin has nothing to worry about,CONSERVATIVE
ive never seen so much evil straight from hell in one room,CONSERVATIVE
some women should not wear white,LIBERAL
another perfectly appropos opportunity to use one of my favorite elf quotes you sit on a throne of lies,CONSERVATIVE
did anyone notice he signed hr40 just before they cut the stream you werent paying attention were you hr40 gives 12000000 to study the effects of slavery for reparations,CONSERVATIVE
i believe this is the most people that have ever showed for a biden rally,CONSERVATIVE
what a total joke,CONSERVATIVE
i cannot believe that i used to be a democrat i do not stand for anything this man or the democratic party stands for the only thing i feel theyre doing very well is destroying our beautiful country god help us,CONSERVATIVE
joe sounds like he hit a line of cocaine that was found in the white house,CONSERVATIVE
they gave him the red pill from super pill from limitless cause he is never this sharp,CONSERVATIVE
he sees a future where we continue to send all our tax dollars overseas instead of helping our own people treason,CONSERVATIVE
why the hell is nagging nancy pelosi there what is her title again,CONSERVATIVE
most of what he said was pretty based regardless of how mentally unfit he is,CONSERVATIVE
watching them clap for brandon makes me sick to my stomach you dont clap for the man who has ruined our country and destroyed everything the troops fought for 20 years when he pulled out,CONSERVATIVE
a threat to democracy is a weak incompetent president like joe biden who has allowed thousands upon thousands of deaths in the us he says that legals are killing eachother but yet he has done nothing to stop that either like what get him out of here seriously he has to go,CONSERVATIVE
andleave alabama out of this malarkey,CONSERVATIVE
we are taking water and tossing it on fires outside our country while our fire burns more violent every day focus on the american people and our needs first,CONSERVATIVE
god just look at camila bro she is literally waiting for the opportunity for joe to pass away so she can step in and run this country down to the ground even more,CONSERVATIVE
500 billion dollars that will go back into their pockets,CONSERVATIVE
i just threw up in my mouth a little,CONSERVATIVE
impressive much better than i anticipated,CONSERVATIVE
everything hes talking about we already had with trump,CONSERVATIVE
the lying machine in action,CONSERVATIVE
mean angry and just so out of touch,CONSERVATIVE
the majority of the state of union address was about trying to blame and attack president trump instead of telling the truth about biden and the lefts horrific and destructive policies republicans should have stood up and walked out of the building the moment the first lie came out of bidens mouth i saw speaker johnson shake his head so many times in complete disgust because of joes dishonest and delusionally insanè statements and i too felt embarrassed from having to listen to such blatant lies from such a foolish corrupt and incompetent commanderinchief democrats have become morally bankrupt reprobates like romans 11832 describes and ppl on the left are incapable of being honest and upright and its why america is crumbling to pieces,CONSERVATIVE
in the book of revelation the united states of america once mighty lost its hold its reign of power now a distant past,CONSERVATIVE
trump 2024 biden has destroyed our country,CONSERVATIVE
this man is a walking zombie shame on anyone who reward his incompetence with another four years to do even more damage to our economy and our social structure,CONSERVATIVE
obama is the pepet master of lieing joe biden i hope and pray the republicans get more stronger and stop the democratic party fixing the voting because we americans know the fix is in we need president donald j trump,CONSERVATIVE
biden is sharp smarter than trump at least he has more vocabulary words and more experience on government a vote for trump is a vote for putin last night we saw the tackiness of the republican party and karen marjorie example of how republicans behave,LIBERAL
biden is ok hes a grownup unlike trump who is a failed insurrectionist and pro sexual assault on women,LIBERAL
shits all talk and no walk,CONSERVATIVE
what an angry sad old man i have no sympathy for the devil and the devil he is,CONSERVATIVE
wow biden did better than expected,LIBERAL
i didnt watch it i get enuff bullchit out in the pasture ive watched clips and yep it was bullchit,CONSERVATIVE
buy more ammo,CONSERVATIVE
pathetic uninspiring very divisive no way your going to be reelected,CONSERVATIVE
i would rather watch someone have hemorrhoid surgery than watch his entire speech,CONSERVATIVE
11219 when you get to be my age certain things become clearer than ever unlike my pronunciation of the word clearer in this sentence the big guy,OTHER
he dont give a dam about our country embarrassing president ever wake up america we need our future president trump back 2024 he will make america proud again president trump will take back our country we dont want sleepy joe 4 more years horrible president in the history,CONSERVATIVE
he forgot to bring the ice cream machine,CONSERVATIVE
when they say x is a threat to our democracy what they really mean is x is a threat to democrats being in power they act like they are the only party that should run this nation disgusting,CONSERVATIVE
4 more years,CONSERVATIVE
90 on epsteins list are here,CONSERVATIVE
he thinks its a kids partyf off australia,CONSERVATIVE
speaker johnson did a super job at holding the impulse to vomit the poor guys not going to have any lips left by the end of this speech,CONSERVATIVE
what planet does this guy live on what a buffoon,CONSERVATIVE
if i were smart id go home now so true,CONSERVATIVE
hes right americans are under attack read deuteronomy in your bible and understand these illegal immigrants are here for one reason and one reason only to serve the black master in destroying america i dont believe this is joe biden,CONSERVATIVE
having your own baby murdered isnt healthcare and it isnt reproductive rights,CONSERVATIVE
i love how they wave red herrings and avoid saying abortion when talking about abortion,LIBERAL
four more years how can anyone cheer for that,LIBERAL
holy crap hunter has him turned right up,CONSERVATIVE
and why is steve scalise trailing behind this imbecile smiling and acting so giddythis entire government body has become a club of crooks designed to rob the we the people of not only our hard earned money but now of our god given freedoms this corruption and deception of we the people cannot continue as it has under clinton bush obama and the worst last 3 years ever this nothing more than a stagethe largest hypocrite ever prop joe biden along with several of those top villains wearing black robesand we cannot leave out the biggest joke of all vp harris so seriously pathetic unprecedented how much these socalled leaders have hurt our great nation overall god help us if joe biden is shoe horned into office another 4 years,CONSERVATIVE
biden licks ice cream,CONSERVATIVE
hello biden make america great again first please you talking to lies,CONSERVATIVE
political violence has no place unless its orchestrated by our guys,CONSERVATIVE
putinists in full attendence here in these comments the denail here is epic,CONSERVATIVE
sounds more like a campaign speech than a state of the union,CONSERVATIVE
junk fees are annoying but isnt there a difference between making a purchase with a convenience fee tacked on at the end of a transactions and credit card companies charging a late fee that is more than what it costs to instigate collection one is deceptive pricing just include the fee in the price which makes sense to regulate especially in the case of a monopoly like ticketmaster the other is in your credit card agreement known from day one its even called an agreement credit card companies arent moral paragons or anything but it is a business we should normalize not signing agreements and contracts we dont understand rather than having the government regulating what companies do that consumers agree to,OTHER
the only danger to democracy is you and your diseased party,LIBERAL
sadly 51 of the population if not more are idiots and will actually vote this idiot back in office,CONSERVATIVE
they say they are going to raise taxes on billionaires but normally they way they do that is by taxing the ways that they usually make money business owner vs employee what ends up happening is small businesses pay a higher corporate tax rate while the billionaires democrats say they are going after have the best lawyers and accountants who can exploit the ever increasing loopholes in the increasingly complicated tax code when biden says working people it is safe to assume he means people who file a w2 and millionaires and billionaires or the wealthy can safely be assumed to mean business owners,CONSERVATIVE
mike johnsons face says it all,CONSERVATIVE
first president that could ever be assassinated by a punch,CONSERVATIVE
all lies hows the drug problem in usa employment everything is going down hunter biden is making lots of money in china billions of dollars is being spent to ukraine while the americans doesnt even have family benefits now i believe fentanyl makes you talk too much,CONSERVATIVE
not one cent in taxes but inflation as a result of increasing charges to corporations is still a cost on tax payers,CONSERVATIVE
i dont think this guy will make it to 2030 just saying,CONSERVATIVE
wait to the drugs wear off and he falls on his face,CONSERVATIVE
dont try and steal this election either joe you are not our president you have done nothing good for this country people are worse off than ever and our country is in danger because of our border situation,CONSERVATIVE
everything from the beginning has been lies and more lies its time for you to go joe,CONSERVATIVE
this man is a disgrace and completely sickening abortion is not treatment,CONSERVATIVE
what about the american people nothing for us trump202now,CONSERVATIVE
joe says give me your money so i can choose how to spend it,CONSERVATIVE
all those people cheering him on are really pathetic,CONSERVATIVE
the funniest part were the sycophants that surrounded him at the end you were phenomenal you knocked it out of the park the fact that joetato was able to stand up for one hour at a time telling lies should not be considered impressive utterly worthless as a president and the harm hes done to this country will take a generation to fix,CONSERVATIVE
joe people do not want government hand outs they want a decent job and self respect period that means tax cuts to companies to give those jobs,CONSERVATIVE
sounded more like a wish list than a state of the union address,CONSERVATIVE
amazing what some uppers can do for a guy,CONSERVATIVE
wait people clap for him,CONSERVATIVE
no your border bill was crap how about you close the border instead of building an expressway,CONSERVATIVE
not what farmers say sorry thats false,CONSERVATIVE
after voting for trump twice i will never do it again i wasnt going to vote this time around but after this speech it has me thinking about voting for biden dont like the guy but i hate how much trump whines and complains and only talks about himself he failed to deliver on any policies he made promises on during the campaign i regret giving him a second chance in 2020 and voting for him trump should have let viv become the candidate,CONSERVATIVE
what money,CONSERVATIVE
full of sh,OTHER
voted for trump twice not a biden fan but i have to give him credit when due he delivered the speech well we need to stop hating the other side and start spending time trying to find a middle ground ever since trump came into politics full grown adults are acting like little kids its okay to disagree and we should disagree but the name calling and each side calling each other unamerican needs to stop just because someone has liberal or conservative views doesnt make them unamerican we all are american my party has really disappointed me lately its lost focus on the country and become a party of trump instead of a party for america we all need to do better,OTHER
the border will never be fixed by any president and neither will the economy her dithering diminshed comment it an insult to all seniors in america and the economics falls on the shoulder of the wealthy and large investors and banks unless at will employment and monopolies and wallstreet investment vehicles are altered nothing will get fixed administrations are straw bosses,CONSERVATIVE
joe mafia and all his little criminal state of the union minions,CONSERVATIVE
what was that guy shouting 10005,CONSERVATIVE
the contrast between a man who wants to be president to benefit the american people and a man who wants to be president to benefit himself and use the presidency as his vessel for retribution is crystal clear biden might stutter his words and hes not as progressive as bernie sanders who in my perfect world would be president but hes miles and metrict tons better than trump on not just character but most importantly policy when trump has to ask for your vote so that he can pardon himself from his numerous crimes rather than to help his voters that says everything that i need to know,LIBERAL
got all day to debate with the maga cult gop bring what you got,LIBERAL
close the borders close the borders close the borders,CONSERVATIVE
biden the great divider,CONSERVATIVE
lol spin and lies,CONSERVATIVE
last night was a sad frustrating and despicable display of brash diabolical politics for the nation and the world to witness watching the democrats bounce up and down supporting a socialist and corrupt dictator was a national disgrace and embarrassing to watch there was no message for unification but simply a disgraceful delivery of nonsensical and unrelated issues,CONSERVATIVE
president joe poopy pants state of confusion,CONSERVATIVE
most disgusting pathetic speech ever,CONSERVATIVE
biden was a joke over and over sad human being send him home,CONSERVATIVE
he hide in the basement and won the election just think hes out he should win in in a landslide joe biden 2024 go get them joe,CONSERVATIVE
joe wants to hire perverts to teach our children to not fear them the perverts,CONSERVATIVE
i wonder how much they paid the clapping seals to be there for that jackass,CONSERVATIVE
im speechless the first thing he mentioned is ukraine funding he is so delusional,CONSERVATIVE
all un truths and everyone knows it,CONSERVATIVE
what a joke america is toast,CONSERVATIVE
i find it funny all comments are turned off with cnn and the white house page they know theyd get cooked on every platform they will lose,CONSERVATIVE
even rbg didnt think roe v wade would hold up to scrutiny because it wasnt constitutional the supreme court does not exist to implement law but to make determinations on it its very possible for most americans to be wrong on a legal translation,CONSERVATIVE
this is not a state of the union address shame on this idiot and who was the idiot who wrote his script another idiot and why is palosi there well thats all the proof we need,CONSERVATIVE
and his very first comment about trump is an out of context quote used as a lie,LIBERAL
a pathetic response but what can you expect from the modern republican party complaints about the border i guess its a good thing they tanked their own border deal i mean its probably better to try to shift blame on that issue than to blame the democrats for the repeal of roe vs wade anyone remember the old phrase the victors write the history books i dont think that applies when you have a voter base that amount to a bunch of mindless sheep that eat any sht you bother to feed them,CONSERVATIVE
wow talk about detached from reality delusional and outright lying to the people,CONSERVATIVE
looks like a geriatric convention nothing but projection and lies kackling kamala is definitely high again,CONSERVATIVE
this individual makes my physically ill he leaves out the money for ukraine the lies are overwhelming stunningly nauseating said lakens name wrong a stoke of the pen opened the border a stroke will close it no more bills needed he will not do anything except to keep destroying america,CONSERVATIVE
yes joe you will not walk away but for a small fee me my fellow dems and family will only charge 10 of the billion dollars you will make,LIBERAL
my god hes pumped full of adderall look at his eyes,CONSERVATIVE
this is his last,CONSERVATIVE
he is the biggest lier i have ever seen if the american people put that sob back in office we will get what we deserve,CONSERVATIVE
