channel_name,video_title,published_at,video_id,view_count,like_count,comment_count
ABC News,"Pro-Palestinian protests lead to arrests, escalating tensions on college campuses",2024-04-23T23:50:15Z,6th5w6xoB7o,42885,366,675.0
ABC News,"Heavy rain, severe flooding slams southern China",2024-04-23T23:00:00Z,-7oibpAF-Ms,287229,5912,265.0
ABC News,Caitlin Clark to have her own signature Nike shoes,2024-04-23T22:34:56Z,mUW9KDfWZe0,7471,116,37.0
ABC News,European Championships of Gullscreeching in Belgium,2024-04-23T21:55:48Z,i1O9-_vwnQo,23758,428,43.0
ABC News,The Rock &amp; Roll Hall of Fame 2024 inductees announced,2024-04-23T21:37:25Z,JJRAASCe6Jo,23850,709,45.0
ABC News,Dust storm creates red haze in eastern Libya,2024-04-23T21:00:10Z,HTb12HOJIm0,16181,479,72.0
ABC News,"Trump responsible for overturning Roe v. Wade, Biden says",2024-04-23T20:30:33Z,3Jo1ct1n864,12135,329,392.0
ABC News,LIVE: Second day of testimony in former Pres. Trump’s historic hush money case,2024-04-23T20:17:36Z,PNJ8HLOq108,174144,896,
ABC News,Justice Department settles with Larry Nassar victims over claims of FBI misconduct,2024-04-23T20:17:44Z,yGBQvrQHeVs,3603,41,13.0
ABC News,Trump&#39;s hush money trial wraps up Day 2 of witness testimony,2024-04-23T20:00:06Z,wT_NG3hjAqE,99240,1197,804.0
ABC News,Oregon police arrest suspect in kidnapping case caught on camera,2024-04-23T19:45:00Z,HarlUa9faI8,48715,478,197.0
ABC News,Kidnapping suspect arrested after home-security camera shows woman carried away,2024-04-23T19:25:00Z,61bCRQH8HJM,245510,8112,634.0
ABC News,Thieves use heavy machinery to allegedly steal cash machine from bank in U.K.,2024-04-23T19:15:00Z,YMw-c3_HLQE,1163456,20919,2798.0
ABC News,Aunt of two children killed in birthday party car crash speaks in court,2024-04-23T18:15:01Z,5CwOb7_Wlb8,152357,6774,483.0
ABC News,"Nationwide Amber Alert issued after ex-cop kills girlfriend, ex-wife; abducts child",2024-04-23T18:08:44Z,N33rcynPioU,80753,773,486.0
ABC News,Dust devil lifts inflatable jumper 100 feet into air,2024-04-23T17:44:13Z,Iv4_cHXTNbk,120744,1195,46.0
ABC News,"The fight to save the whitebark pine, a critical tree species found in national parks",2024-04-23T16:54:44Z,HHVSTYU3LFQ,2056,31,2.0
ABC News,‘Baseball-sized’ hail and severe storms expected to hit the heartland,2024-04-23T15:50:17Z,qv98XUJeM8E,3750,32,2.0
ABC News,Trump hush money trial: Tense hearing on contempt ends without ruling,2024-04-23T15:42:05Z,VXKDfpLVvp4,172301,2782,1138.0
ABC News,Investigation underway after close call at JFK involving five planes,2024-04-23T14:30:11Z,ggYbZZZ13Oc,31302,230,113.0
ABC News,Judge issues critical ruling in Idaho college murders case,2024-04-23T14:15:04Z,YpH67OWQAgc,95130,657,609.0
ABC News,"‘Michael Strahan &amp; Jon Bon Jovi: Halfway There’ | Sunday, April 28th on ABC",2024-04-23T14:00:09Z,Cc2ItNoB5EM,46456,336,25.0
ABC News,Senate considers major foreign aid package,2024-04-23T13:58:57Z,5FbVy3iUUfU,2489,50,39.0
ABC News,Arrests grow as college campus protests boil over,2024-04-23T11:00:00Z,-epRKDM4iz0,22949,243,580.0
ABC News,Supreme Court justices appear open to allowing cities to fine homeless people,2024-04-23T10:30:10Z,FtNOr41MMBw,16932,127,537.0
Fox News,‘The Five’: Kamala receives ‘brutal’ feedback from focus group,2024-04-23T23:30:09Z,ftU67hCYlvc,601874,10857,2533.0
Fox News,Tyrus: We have a terrorist group marching in New York right now!,2024-04-23T22:45:00Z,KisbbLuB-WQ,409073,18953,5424.0
Fox News,‘The Five’: Trump clashes with prosecutors over gag order,2024-04-23T22:00:14Z,QHh9B2VXO60,232233,6089,2479.0
Fox News,Biden ripped over cannibal claim: &#39;A plagiarist and a liar&#39;,2024-04-23T21:15:00Z,a82pVg2ndP4,81678,2633,1259.0
Fox News,Trump: The gag order is &#39;totally unconstitutional’,2024-04-23T20:26:41Z,Rl14by2FRGw,57359,1395,1878.0
Fox News,Fury as Chicago approves new funding for migrants: &#39;We&#39;re coming for your seats!&#39;,2024-04-23T19:45:00Z,nyQyPa9Jo6A,278141,7706,3101.0
Fox News,This was an unforced error by Trump: Urbahn,2024-04-23T19:00:03Z,8EwuiXumRIE,68242,939,1318.0
Fox News,&#39;Liars&#39; are encouraging &#39;insane&#39; college protests,2024-04-23T18:15:01Z,ImayEj9SwNI,80423,2359,1170.0
Fox News,Peter Doocy: Biden had a layup and he missed it,2024-04-23T17:30:06Z,rVdcegxVDq4,131611,2264,741.0
Fox News,David Sacks stands against &#39;Forever War&#39; in Ukraine PLUS Jay Glazer! | Will Cain Show,2024-04-23T17:18:58Z,ZD0Z2kuEi7g,16348,323,77.0
Fox News,"&#39;Fox &amp; Friends&#39; reveals groups, funding behind anti-Israel protests",2024-04-23T16:45:05Z,ySCl6MCPIw0,288620,6507,2190.0
Fox News,No &#39;common sense&#39; to AOC&#39;s idea of &#39;peaceful&#39; protests,2024-04-23T16:00:22Z,V4xN3mEa6yo,26438,631,408.0
Fox News,Veteran: Government &#39;should not allow’ people to get away with this #shorts,2024-04-23T15:30:16Z,dECCHiFbAEA,196679,14130,1083.0
Fox News,‘Gutfeld!’: Democrats wave Ukrainian flags on House floor,2024-04-23T15:15:00Z,DM6mi0rjYko,221370,8396,1470.0
Fox News,Fetterman takes aim at Columbia president amid protests: &#39;Do your job or resign&#39;,2024-04-23T14:30:11Z,ZjhCMblW4ys,93506,1822,901.0
Fox News,Lawrence Jones: We have lost our minds,2024-04-23T13:45:03Z,s5vA9dOpN6U,205122,5204,2460.0
Fox News,&#39;Startling&#39; development on first day of NY v. Trump,2024-04-23T13:00:51Z,njQrM3tHd7U,285241,4157,3002.0
Fox News,Alec Baldwin harassed by anti-Israel protester in NYC,2024-04-23T12:15:02Z,PHq6TKjeIKo,202787,3481,1681.0
Fox News,Dozens of Yale protesters arrested amid violent anti-Israel protests,2024-04-23T11:30:11Z,VjsALwuHpWM,98849,3735,1823.0
Fox News,Columbia president facing bipartisan calls to resign over anti-Israel protests,2024-04-23T10:45:02Z,o5Kizsl_wz8,92773,3362,1328.0
Fox News,Every student involved in antisemitic activity should be expelled: Newt Gingrich,2024-04-23T10:00:41Z,oBW4TsiPqOs,86328,3493,1125.0
Fox News,&#39;Priority crisis&#39;: Lawmakers under fire for waving Ukraine flags,2024-04-23T09:30:05Z,Fcwy15MF3Ng,21834,586,536.0
Fox News,Alan Dershowitz: This is a scary time,2024-04-23T09:00:46Z,vmH8UbifyIA,344625,8920,3121.0
Fox News,&#39;ACCESSORY TO EVIL&#39;: AOC criticized for praising student led anti-Israel protests,2024-04-23T08:30:17Z,fy3xXcdL9Dk,210072,4553,2135.0
Fox News,Columbia University teaches rocket science but can&#39;t define hate speech: student,2024-04-23T08:00:07Z,7o_b7GNYze8,44298,1596,905.0
Fox News,Chris Hansen: &#39;These are merchants of death&#39;,2024-04-23T06:30:08Z,SnwhSFjarnI,171091,2874,692.0
Fox News,Trump should not take the stand: Legal expert,2024-04-23T06:00:00Z,13bYulVYCdg,20894,632,439.0
Fox News,What can we expect from NY vs Trump?,2024-04-23T05:30:14Z,yneFUcnx0ws,25182,714,403.0
Fox News,Robert Kraft to Hannity on the rise of antisemitism: &#39;It&#39;s very sad to me&#39;,2024-04-23T04:30:13Z,nDLGCx5Rv_I,52960,1299,600.0
Fox News,Trump legal spokesperson: You can&#39;t make this up,2024-04-23T03:45:00Z,4Wdbv2--Dts,139427,5194,1501.0
Fox News,Sean Hannity: The pro-Hamas crowd is running the show,2024-04-23T03:00:08Z,Fhh-qVMZGt0,57900,2353,813.0
Fox News,Laura Ingraham says Biden’s record should be on trial #shorts,2024-04-23T03:00:01Z,21V7KYz-fEc,73341,6863,577.0
Fox News,Jesse Watters: The media didn&#39;t tell you this about NY vs Trump,2024-04-23T02:15:00Z,4GZCrO2QeM8,328042,14592,3328.0
Fox News,Ingraham: Put Biden’s record on trial,2024-04-23T01:30:11Z,QAvq_UvbmmQ,58646,3101,967.0
Fox News,Anti-Israel protests on campuses didn&#39;t just happen overnight: Perino,2024-04-23T01:00:10Z,OyVcWBhuhyI,93621,2717,1268.0
Fox News,Trump attorney: It&#39;s a sad day for democracy,2024-04-23T00:15:00Z,1fS2ccsQLCw,48289,1615,988.0
CNN,‘Treated like royalty’: Sketch artist describes Trump&#39;s presence in court for hush money trial,2024-04-23T23:22:03Z,sTqXPXAS5Rs,88543,1118,716.0
CNN,&#39;I&#39;m restricted because I have a gag order&#39;: Trump speaks after second day of testimony wraps,2024-04-23T18:58:02Z,AURWcqN5N_M,171743,2444,3353.0
CNN,CNN reporter on why she thinks Trump&#39;s gag order hearing was a &#39;disaster&#39;,2024-04-23T18:45:01Z,g4HLVdl11Sk,423514,6408,1480.0
CNN,&#39;A profound betrayal&#39;: Stelter reacts to Pecker&#39;s testimony about Trump,2024-04-23T17:59:21Z,pntlrMfdV-c,877748,12732,3268.0
CNN,Judge raises voice at Trump&#39;s attorney during gag order hearing,2024-04-23T16:05:05Z,tdkFdGNiuiE,420798,5577,1593.0
CNN,"Trump co-defendant was told he&#39;d be pardoned, notes from FBI interview show",2024-04-23T15:41:01Z,AOQl_2OZ-aE,307179,5295,1249.0
CNN,Why Trump is upset about what&#39;s happening outside the NY courthouse,2024-04-23T14:43:46Z,LaAtsCyHCpg,421673,6893,2960.0
CNN,Palace releases new photo of Prince Louis in an unusual way,2024-04-23T14:19:26Z,p_uAOnlVTEQ,42945,1327,125.0
CNN,&#39;He will be found guilty&#39;: former prosecutor on risk of Trump taking the stand,2024-04-23T13:31:17Z,WJXRiy_TpDI,192653,7150,540.0
CNN,What Camels Teach Us about the Future,2024-04-23T08:17:08Z,Z2-Hi1E5hlA,8283,60,47.0
CNN,Russian media praises MTG for trying to derail Ukraine aid bill,2024-04-23T02:44:54Z,d1BZ8ekxNe8,194813,2854,2484.0
CNN,Haberman on why David Pecker testifying is &#39;fundamentally different&#39;,2024-04-23T01:27:47Z,J_mdzTsvmkQ,281297,3284,794.0
CNN,Ex-Trump aide on how Melania could react to the hush money trial,2024-04-23T01:15:24Z,yp5gmFMvuqg,466671,5008,2045.0
CNN,Legal expert on what she thinks was a missed ‘big opportunity’ from Trump’s defense team,2024-04-23T00:24:55Z,ompkUFPsztg,251746,3431,620.0
NBC News,Campus protests spread around the country,2024-04-23T23:45:55Z,b8fpq4d65EM,33803,398,644.0
NBC News,Former National Enquirer publisher testifies about how he helped Trump,2024-04-23T23:38:22Z,6EPlzVT_WQA,11400,161,68.0
NBC News,New Mexico paid intern program paves professional path for high school students,2024-04-23T23:00:33Z,oODtbNW6OHM,859,23,2.0
NBC News,Meet the Press NOW — April 23,2024-04-23T22:45:00Z,Abt-PQrEqRc,255566,1399,316.0
NBC News,Progressive Democrat stands by vote opposing aid to Israel despite primary challenge,2024-04-23T22:30:08Z,YbRc8t6Gm_w,8296,86,53.0
NBC News,"WSJ journalist Evan Gershkovich appears at Moscow hearing, loses appeal",2024-04-23T22:00:30Z,Y8uNDwK68Bk,1811,13,5.0
NBC News,Teens watch Trump trial in court,2024-04-23T21:45:00Z,L7I2lM1b5sk,16234,355,98.0
NBC News,Israel trying to ‘preempt’ potential U.S. sanctions on IDF military unit,2024-04-23T21:30:00Z,2e4xB1RvgUs,9187,55,56.0
NBC News,Exclusive preview: FBI director warns of three-part TikTok threat as Senate considers ban,2024-04-23T21:00:36Z,zfoh7MOVKX4,3818,50,65.0
NBC News,Watch Biden&#39;s full speech slamming restrictive state abortion laws in Florida,2024-04-23T20:45:00Z,9Gt4SrkDDgY,10342,241,200.0
NBC News,Biden: Trump &#39;bragged&#39; about overturning Roe v. Wade,2024-04-23T20:30:00Z,DF23XRX7VWo,2070,42,49.0
NBC News,DOJ to pay victims of Larry Nassar more than $138 million,2024-04-23T20:00:03Z,6Tq9mi0Z4Ys,1007,15,4.0
NBC News,David Pecker testifies about &#39;catch-and-kill&#39; scheme during Trump hush money trial,2024-04-23T19:30:03Z,PRXGpENaYjA,17317,198,92.0
NBC News,New York City mayor eyes &#39;outside agitators&#39; in college protests,2024-04-23T19:00:25Z,bRxPEWkkWbY,6783,63,121.0
NBC News,How climate change is harming the coastal culture of the Gullah Geechee,2024-04-23T18:00:33Z,peb59HVZspE,1990,36,7.0
NBC News,Officials work to move alligator off Tampa Air Force Base,2024-04-23T17:53:55Z,NCD5dIhySko,11783,167,24.0
NBC News,David Pecker testifies about his relationship with Trump at hush money trial,2024-04-23T17:00:05Z,5uva_PaaW0I,10148,126,66.0
NBC News,Morning News NOW Full Broadcast - April 23,2024-04-23T15:47:55Z,sl0vtEDHQZM,196138,819,190.0
NBC News,Dozens arrested at Yale University pro-Palestinian protest,2024-04-23T14:31:15Z,mk68BPTp7Qo,9248,100,154.0
NBC News,Two Malaysian military helicopters collided and crashed during a training session.,2024-04-23T14:25:00Z,1ybNit0l8fo,362868,6874,222.0
NBC News,Nine people injured after a Russian strike on the Ukrainian city of Odesa,2024-04-23T13:30:17Z,RHnq-j3fRhw,2238,24,11.0
NBC News,Flipping the Script: Autistic musicians speak about performing as part of ASD Band,2024-04-23T13:07:02Z,TbAmTqO3fxQ,857,24,1.0
NBC News,Supreme Court likely to hear arguments on regulating ghost guns in next term,2024-04-23T13:00:31Z,MCASH5JU6js,3779,21,39.0
NBC News,Bicycle ride through Gaza shows the devastation caused by war,2024-04-23T12:30:23Z,cvnQyAKr_Tw,3945,38,44.0
NBC News,This Morning’s Top Headlines – April 23,2024-04-23T12:16:39Z,EquEEvt1lOw,26208,178,18.0
NBC News,"San Francisco&#39;s oldest LGBTQ bar, &#39;The Stud,&#39; reopens",2024-04-23T12:00:11Z,D8AxHOqWY0Y,1423,30,22.0
NBC News,Stay Tuned NOW with Gadi Schwartz - April 22 | NBC News NOW,2024-04-23T10:00:32Z,VRAyfzMgOIE,92439,372,92.0
NBC News,NYPD arrests protesters for trespassing on NYU campus,2024-04-23T05:00:22Z,TV6zh_TsrPE,72921,444,696.0
NBC News,"Alabama high school prepares students with STEM, cyber and hacking classes",2024-04-23T04:00:36Z,zCTfSro2L_g,3719,68,22.0
NBC News,How to tell the difference between Botox and fauxtox,2024-04-23T03:45:02Z,ve05tEmTng4,984,12,5.0
NBC News,"Female patients are less likely to die when treated by female doctors, study shows",2024-04-23T03:30:08Z,Mztkq9bEGBE,1628,41,11.0
NBC News,"5 people, including 2 children, found dead in Oklahoma City home",2024-04-23T03:15:01Z,RK1pkJtH5Fo,33787,243,123.0
NBC News,Barry Manilow makes history with Radio City performance,2024-04-23T03:00:35Z,uk59y0afwhM,1773,48,11.0
NBC News,Southern border sees surge of global migrants,2024-04-23T02:45:00Z,MXWiTOPv7DY,11728,109,119.0
NBC News,Top Story with Tom Llamas -  April 22 | NBC News NOW,2024-04-23T02:34:37Z,pcPNmenMGjA,265415,621,126.0
NBC News,Researchers working to keep microplastics from laundry out of water supply,2024-04-23T02:30:15Z,ItAcf22FcTg,18500,115,36.0
NBC News,Bill Nye gives tips to reduce plastic waste,2024-04-23T02:00:04Z,CSaUzORm8s8,6071,136,91.0
NBC News,Nightly News Full Broadcast - April 22,2024-04-23T02:00:31Z,wK9wdT5AmBA,678153,6605,1305.0
NBC News,Hallie Jackson NOW - April 22 | NBC News NOW,2024-04-23T01:50:42Z,rzv4vhbrfBo,74856,380,79.0
NBC News,Officials investigate wave of murders targeting Mexican political candidates  ,2024-04-23T01:45:01Z,tXfKO5xU8sM,19087,283,185.0
NBC News,Surge of Chinese migrants crossing Southern border into the U.S.,2024-04-23T01:30:23Z,XQKxP8rUk1I,31257,294,388.0
NBC News,Volkswagen workers vote to unionize in Tennessee assembly plant,2024-04-23T01:00:01Z,24TWdEZ_8mc,1606,34,16.0
NBC News,Dozens of pro-Palestinian protesters arrested at Yale,2024-04-23T00:30:23Z,uNQaqf2oFp8,109500,1018,1656.0
NBC News,"Prosecution, defense paint competing visions of Trump as trial begins",2024-04-23T00:15:01Z,dvcC1qB4Vnw,21581,533,214.0
BBC News,BBC witnesses tragedy as 7-year-old and four adults die trying to cross English Channel | BBC News,2024-04-23T22:19:12Z,b6WCQt5r3rk,69209,889,1171.0
BBC News,Netflix buys rights to British South Asian drama Kaur | BBC News,2024-04-23T21:45:48Z,HX7_Q9FPt1U,15429,181,46.0
BBC News,Boy wins competition with seagull impression | BBC News,2024-04-23T20:45:00Z,1zbUWMhec14,62299,635,141.0
BBC News,Larry Nassar: US justice department to pay abuse survivors $138m | BBC News,2024-04-23T19:30:02Z,FZhgVT8hY84,14504,203,62.0
BBC News,Nasa’s Voyager-1 sends usable data from deep space | BBC News,2024-04-23T17:00:35Z,hE2Mnd9Qgjs,762498,11976,2499.0
BBC News,Ten dead as navy helicopters collide in Malaysia. #Malaysia #Shorts #BBCNews,2024-04-23T16:20:54Z,9E1IsYrGerc,88690,1262,116.0
BBC News,Donald Trump faces second day of hush-money trial | BBC News,2024-04-23T16:01:41Z,YKx1VG9hXzI,36122,369,234.0
BBC News,Taylor Swift fans flock to a London pub apparently referenced on her new album. #BBCNews #Shorts,2024-04-23T14:39:04Z,80jRK4elNww,16071,313,35.0
BBC News,Five people including child die in Channel boat crossing | BBC News,2024-04-23T12:30:26Z,TH76GS4w48Y,61342,736,1380.0
BBC News,Joe Biden&#39;s uncle may have fallen prey to cannibals after his WW2 plane was shot down. #BBCNews,2024-04-23T11:58:46Z,-lmksRI93_4,32803,445,230.0
BBC News,China floods: Heavy flooding sees tens of thousands evacuated | BBC News,2024-04-23T11:33:20Z,mtmLinjzur4,119231,1472,269.0
BBC News,UK passes controversial immigration Rwanda bill  | BBC News,2024-04-23T08:02:38Z,VtsiHlkkQGg,233738,1751,1413.0
Al Jazeera English,US universities crackdown on pro-Palestine protests | Al Jazeera Newsfeed,2024-04-23T20:31:15Z,wqo0J2Cs0dM,44320,1754,861.0
Al Jazeera English,"‘Attacks on UNRWA have nothing to do with neutrality,’ Lazzarini tells Al Jazeera | AJ #Shorts",2024-04-23T19:29:20Z,bXQFK0geR6E,20462,2845,154.0
Al Jazeera English,Indigenous tribes march for justice in Brasilia to protect their land and cultural rights,2024-04-23T19:01:31Z,fulkGQHntiw,2461,81,11.0
Al Jazeera English,"Columbia, NYU, Yale on the boil over Israel’s war on Gaza",2024-04-23T18:45:01Z,PcRKmFlgoys,107114,3939,1305.0
Al Jazeera English,Israel’s attacks on the agency are political: UNRWA chief Philippe Lazzarini,2024-04-23T18:17:06Z,86XM88On7JA,16521,402,127.0
Al Jazeera English,Will Israel hold to account those responsible for Hamas attack? | Inside Story,2024-04-23T17:30:05Z,Uw5hyV92jUc,64784,896,285.0
Al Jazeera English,Indonesia grapples with plastic waste crisis amid global UN plastic treaty talks,2024-04-23T17:00:38Z,r65pWm7Lfd4,3732,82,17.0
Al Jazeera English,175 nations meet in Canada for UN plastic treaty talks,2024-04-23T16:45:00Z,8sljwbEucBQ,1886,65,22.0
Al Jazeera English,English Channel boat deaths: At least five killed and 47 rescued at sea,2024-04-23T16:09:32Z,TMQZFEa05qA,4107,57,17.0
Al Jazeera English,Muted Passover celebrations: Jewish holiday overshadowed by war on Gaza,2024-04-23T15:47:04Z,KayPNNNVUgQ,7419,97,53.0
Al Jazeera English,Highest-level rainstorm warning issued in south China’s Guangdong,2024-04-23T15:15:00Z,9LqFT2d46Xo,9133,124,24.0
Al Jazeera English,Discovery of mass graves ‘stark evidence of war crimes’: Al-Haq,2024-04-23T15:00:47Z,uwKcWBJajBw,36873,1557,483.0
Al Jazeera English,Lebanon-Israel escalation: UN peacekeepers patrol border region,2024-04-23T14:45:05Z,z4vuMDIL7dI,17068,301,88.0
Al Jazeera English,Why Israeli military units could be sanctioned by the US | The Take,2024-04-23T14:25:08Z,on6kOg1UXd0,33760,960,285.0
Al Jazeera English,Is the US about to ban TikTok? | Al Jazeera Newsfeed,2024-04-23T14:19:27Z,x-5BwyJDeL0,2326,72,12.0
Al Jazeera English,Togo approves constitutional reform changing how president is elected,2024-04-23T14:15:03Z,oH0R20uxXxM,1505,29,1.0
Al Jazeera English,African Counter-Terrorism summit: Leaders discuss combating armed groups,2024-04-23T14:00:23Z,KrTGFUotCAg,3923,81,33.0
Al Jazeera English,US says Israel&#39;s attack on Rafah will ‘lead to inordinate civilian harm’,2024-04-23T13:35:11Z,syG06TOmJGE,27908,459,314.0
Al Jazeera English,Israeli settlers attack Palestinian village of Burqa,2024-04-23T13:15:00Z,59E6BuV0-BU,13745,532,207.0
Al Jazeera English,Are celebrities doing enough to stop the war on Gaza? | The Stream,2024-04-23T13:00:13Z,HwMXW_eEWtM,138520,3967,793.0
Al Jazeera English,"Turkey’s Erdogan meets Iraq PM for talks on water, security and trade",2024-04-23T12:49:12Z,d9DmNE5AImY,10919,265,42.0
Al Jazeera English,"100,000 people evacuated from China flood zone | #AJshorts",2024-04-23T12:12:24Z,adu9Kv_AbUU,23421,930,43.0
Al Jazeera English,Modi accused of anti-Muslim hate speech | Al Jazeera Newsfeed,2024-04-23T12:06:18Z,tshlJqWO3ug,439543,17094,6509.0
Al Jazeera English,UK passes law to send asylum seekers to Rwanda after months of wrangling,2024-04-23T11:53:20Z,vlSCDwQwjwc,5127,58,47.0
Al Jazeera English,Mexico’s leading presidential candidate stopped by masked men ‘seeking an end to cartel violence’,2024-04-23T11:05:31Z,q-GWyhMJikQ,4543,65,33.0
Al Jazeera English,Pro-Palestine protesters condemn German president over Israel support in Istanbul,2024-04-23T10:31:29Z,MFCyW1eKTLg,25747,936,314.0
Al Jazeera English,Dramatic video of burning train in Canada | #AJshorts,2024-04-23T10:21:22Z,uTXbnFBtyaU,6855,172,7.0
Al Jazeera English,"Torrential rains ravage southern China, thousands displaced",2024-04-23T09:19:13Z,S-5qS1VgayU,7393,121,22.0
Al Jazeera English,Kim Jong Un oversees North Korea’s first ‘nuclear trigger’ simulation drills,2024-04-23T08:32:27Z,r7WG9YqJwCo,99709,927,209.0
Al Jazeera English,Pro-Palestinian demonstrations surge at US campuses after Columbia University arrests,2024-04-23T08:08:59Z,TrbHdzlURc0,125538,3685,1729.0
Al Jazeera English,Israeli military intelligence chief resignation will put peers on the spot,2024-04-23T07:13:15Z,IZ5zjY6S-iQ,23001,370,100.0
Al Jazeera English,Israel gave no evidence UNRWA staff linked to ‘terrorism’: Colonna report,2024-04-23T06:09:50Z,8rMIALKFZdk,17709,706,265.0
Al Jazeera English,Two military helicopters collide mid-air in Malaysia | Al Jazeera Newsfeed,2024-04-23T05:46:17Z,BtwRLbYx5yM,64081,1558,81.0
Al Jazeera English,‘Battlelines’ drawn as jury hears opening remarks in Trump hush money case,2024-04-23T05:24:35Z,ntCaUvpe4Ww,1549,27,15.0
Al Jazeera English,War on Gaza: Doctors and medics repair parts of damaged al-Amal hospital,2024-04-23T05:03:11Z,Fdf7p4VWlZc,10622,414,280.0
ABC News,Mama bear saves cub after it falls in river,2024-04-22T23:00:25Z,yKCm8sXyup4,1097055,65901,1012.0
ABC News,LIVE: Attorneys present opening statements in Trump&#39;s historic hush money case,2024-04-22T22:55:59Z,PLo6gTpDrHs,306022,1536,
ABC News,Introducing the Rock &amp; Roll Hall of Fame class of 2024,2024-04-22T22:40:27Z,HzRAgfQ0nGU,9640,121,77.0
ABC News,Woman shot at Delaware State University identified,2024-04-22T22:02:08Z,cLRbG2LjKS0,3613,38,5.0
ABC News,Gonzaga University climate expert says America gets a &#39;C-&#39; for taking action against climate change,2024-04-22T21:02:29Z,lFx-VdaEMNU,1379,26,17.0
ABC News,Israeli intelligence chief resigns over Oct. 7 attack,2024-04-22T20:00:10Z,UKfFduU1i04,47009,254,94.0
ABC News,Former special counsel to Donald Trump reacts to criminal trial opening statements,2024-04-22T19:45:03Z,zY9xRaG7YO8,20837,194,89.0
ABC News,Former National Enquirer publisher takes the stand in Trump hush money trial,2024-04-22T19:30:04Z,f2ArXGywLv4,79702,642,356.0
ABC News,"Columbia University students arrested, suspended during Israel-Hamas war protests",2024-04-22T18:04:24Z,jxFwFXiSHoQ,15549,97,315.0
ABC News,Trump reacts to opening statements in hush money trial,2024-04-22T17:15:28Z,JSjDEtzAY_A,35376,503,244.0
ABC News,Opening statements have concluded in Trump hush money trial,2024-04-22T16:36:05Z,7-7Ik1VqnQk,197341,2689,797.0
ABC News,Kids News Now: Earth Day Edition,2024-04-22T16:00:47Z,xJ01chGo6_I,936,8,0.0
ABC News,House passes bill to force the sale of TikTok from Chinese owners,2024-04-22T15:15:00Z,6ogXc1ZW2CU,18311,169,255.0
ABC News,Supreme Court to hear high-stakes case on homeless encampments,2024-04-22T15:00:25Z,GO5h2YwzufQ,5635,52,98.0
ABC News,Can celebrities help move the needle on climate change?,2024-04-22T14:51:41Z,drAs7uUyyv4,1024,14,29.0
ABC News,House Speaker Mike Johnson pushes through foreign-aid bill,2024-04-22T14:45:02Z,P4OF8yacwmc,10551,132,148.0
ABC News,Trump gives remarks before courtroom opening statements in hush money trial,2024-04-22T14:40:30Z,6rq8mqGTjEc,21473,389,236.0
ABC News,Security concerns at Columbia University amid Israel-Hamas war protests,2024-04-22T14:10:06Z,GOdNSKe1yRA,34797,113,474.0
ABC News,Man rescued by Good Samaritans after being trapped in burning SUV,2024-04-22T13:44:18Z,H3sNBahmlqg,4594,75,13.0
ABC News,Trump to hear opening statements in hush money trial,2024-04-22T12:56:17Z,DK3QXRYIom0,46706,648,260.0
ABC News,Columbia University campus security concerns ahead of Passover,2024-04-22T11:29:01Z,0vyRKHEXEv8,6656,47,138.0
ABC News,Bear lounges in swing at the Orphaned Wildlife Center,2024-04-22T05:59:25Z,bCAoLllBCOw,267597,15501,289.0
ABC News,How Earth Day volunteers help to clean up the planet,2024-04-22T05:00:05Z,DCOy3dQSnPQ,2412,27,14.0
ABC News,House Speaker Mike Johnson faces uncertain fate,2024-04-22T02:30:31Z,iAFnAIq1k_Y,119022,931,1099.0
ABC News,"ABC World News Tonight with David Muir Full Broadcast - April 21, 2024",2024-04-22T02:00:06Z,InG0OE_kSTw,658252,5646,773.0
ABC News,SCOTUS to hear appeal over lower court ruling on homeless case,2024-04-22T01:30:12Z,e70Smph7eMs,6630,66,48.0
ABC News,Passover warning from New York authorities to Jewish community,2024-04-22T01:15:11Z,O3s-0CCtNs0,20730,186,229.0
Fox News,Jesse Watters: Biden&#39;s No. 3 Justice official gave the opening statement in NY vs Trump,2024-04-22T23:30:08Z,vCOsaCA-FTg,142609,5128,1793.0
Fox News,‘The Five’ reacts to Hillary Clinton’s ‘unhinged’ attack against Trump,2024-04-22T22:30:06Z,pKV-K5jVZJA,511017,10637,3860.0
Fox News,What&#39;s clear about this case is that Trump is right: Turley,2024-04-22T21:45:00Z,jqqvjcRko7o,152363,4002,1660.0
Fox News,Former Trump opponent warns trial &#39;is clearly election interference&#39;,2024-04-22T21:00:13Z,Dz9WvuCiXF8,183450,3408,1594.0
Fox News,Kayleigh McEnany: This could backfire on the Democrats,2024-04-22T19:30:05Z,e4NEOwj0GjI,349376,8544,2902.0
Fox News,Biden claims Inflation Reduction Act is the &#39;most significant investment ever&#39;,2024-04-22T19:12:35Z,W0sZy1vNUbc,30185,332,717.0
Fox News,Trump rails against trial: &#39;I should be campaigning&#39;,2024-04-22T18:45:01Z,n9GHONUqdl4,36530,652,1007.0
Fox News,&#39;Hollywood has-been&#39; Michael Douglas mocked for defense of Biden,2024-04-22T18:00:22Z,tAb2SFmBwwU,210417,4078,2953.0
Fox News,"Dana Perino in-studio! PLUS, five things to know as Trump trial opens | Will Cain Show",2024-04-22T17:10:41Z,GTXXOhMDzUk,43764,965,149.0
