channel_name,video_title,published_at,video_id,view_count,like_count,comment_count
ABC News,"Israel weighs response to Iran attack: U.S. won&#39;t participate in retaliation, officials say",2024-04-15T11:16:42Z,ZuWZzIjHSRg,27301,194,138.0
ABC News,Man completes marathon run in every U.S. state,2024-04-15T06:30:01Z,agbpQQ4T6qM,1493,15,1.0
ABC News,"ABC World News Tonight Full Broadcast - April 14th, 2024",2024-04-15T02:00:30Z,z4Uu3vggopo,587107,5243,938.0
ABC News,At least 40 people shot over the weekend in Chicago,2024-04-15T00:30:08Z,9_g5sRPwQ_c,29560,229,304.0
ABC News,Trump criminal &#39;hush money&#39; trial to start on Monday,2024-04-15T00:23:31Z,5P_NmoxDVDM,25105,218,357.0
Fox News,It’s no surprise Americans have ‘Trump nostalgia’: Judge Jeanine,2024-04-15T23:15:01Z,e60MM0BQYFs,65699,2266,993.0
Fox News,‘The Five’ reacts to first day of Trump hush money trial,2024-04-15T22:30:04Z,Enl4vw04jlc,428793,10628,5852.0
Fox News,Trump: Judge is not going to allow me to attend my son&#39;s graduation,2024-04-15T21:45:00Z,EtzaikcXy3A,101394,2810,3267.0
Fox News,Who is organizing this &#39;hate America&#39; movement?: Harris Faulkner,2024-04-15T21:15:01Z,zkKqMutchSg,325249,7769,4828.0
Fox News,Jonathan Turley: This is legally absurd,2024-04-15T20:30:07Z,jkuJTjErkGs,296228,7572,2984.0
Fox News,Biden reportedly told Netanyahu &#39;take the win&#39; after intercepting Iran attack,2024-04-15T19:45:02Z,XOmX6GH665E,69679,1361,950.0
Fox News,Jack Keane: This has been an absolute miserable failure for Biden,2024-04-15T19:15:00Z,9kS5p-fE85Q,200032,3693,1072.0
Fox News,White House claims gas is cheaper than a year ago; it&#39;s up 52% since 2021,2024-04-15T18:45:40Z,iHKQ5uXOEHo,52186,521,521.0
Fox News,Retired general: Iran would use nukes if they had them,2024-04-15T18:45:02Z,bVed1KP3VB4,80827,1122,732.0
Fox News,Anti-Israel protests cause chaos in cities nationwide,2024-04-15T18:42:54Z,QsiOaesKkaw,96274,1510,1221.0
Fox News,Fetterman breaks with Biden on Israel: &#39;ASTONISHING&#39;,2024-04-15T18:00:24Z,t2LylG7lEkU,156704,4062,1155.0
Fox News,Biden admin slammed for leaking call with Netanyahu #shorts,2024-04-15T18:00:20Z,pkTDCpXuanU,60145,3954,256.0
Fox News,"Iranian regime must be &#39;toppled,&#39; Israeli official says",2024-04-15T17:15:01Z,P73ZY2I1iEw,75231,1266,861.0
Fox News,What to know about Trump in court - PLUS Iran on the brink | Will Cain Show,2024-04-15T17:13:54Z,D24WceF4sVg,46543,1007,153.0
Fox News,"If your last name is Trump, the standard of justice is turned on its head: Jarrett",2024-04-15T16:45:03Z,_1Ttx2_Y264,30371,815,1067.0
Fox News,This justice system is willing to abuse the law to &#39;crush&#39; Trump: Urbahn,2024-04-15T16:00:35Z,ewdBEwbSlXI,98497,2140,1402.0
Fox News,George Stephanopoulos shocked governor still backs Trump,2024-04-15T15:30:07Z,N3VDTW9KoZQ,139004,2426,1052.0
Fox News,Trump says hush money trial is &#39;political persecution like never before&#39;,2024-04-15T15:30:07Z,Hw_zC3KwvYw,38752,4444,553.0
Fox News,Trump BLASTS hush money trial ahead of jury selection: &#39;Assault on America&#39;,2024-04-15T14:41:23Z,fCIIcVd77xU,16424,540,709.0
Fox News,&#39;Obsessed&#39; left-wing media melts down over Trump&#39;s hush money case,2024-04-15T14:30:00Z,1DT01ZW0fNY,61085,2061,926.0
Fox News,&#39;NO BALANCE&#39;: Trump hush money trial dominates mainstream media headlines,2024-04-15T13:45:07Z,unUJNxpzdU4,49202,884,790.0
Fox News,Anti-Israel activists applaud Iran&#39;s attack on Israel in &#39;appalling&#39; video,2024-04-15T13:00:50Z,xpFOeyin7Y4,95414,2692,1323.0
Fox News,Trump sounds off as hush money case begins: &#39;This has never happened&#39; before,2024-04-15T12:15:03Z,dFF6J857vEw,62301,1045,1502.0
Fox News,White House slammed for leaking Netanyahu call details,2024-04-15T11:30:31Z,t5ArI48zdfY,269698,6034,1940.0
Fox News,Biden admin: US won&#39;t participate in possible Israel counterattack,2024-04-15T10:45:02Z,qP0gMh9lCZU,135855,2402,1500.0
Fox News,Legal experts share how jury could shape outcome of Trump hush money trial,2024-04-15T10:00:07Z,6qD8TrYfeWM,34506,668,881.0
Fox News,Iran issues warning to US after Israel attack,2024-04-15T09:00:00Z,-Bx_sK38NM8,562315,8421,3200.0
Fox News,Kevin McCarthy: The American people have woken up,2024-04-15T08:00:14Z,GgSkiB1La74,75009,2859,688.0
Fox News,Bret Baier: We Will Have At Least One Trump/Biden Debate | Will Cain Show,2024-04-15T07:00:10Z,DD3VJpuPvg8,24767,429,295.0
Fox News,Drivers complain higher gas prices leading to painful receipts at the pump,2024-04-15T06:00:04Z,90P51jOY1lQ,37217,889,833.0
Fox News,Crisis in California: Migrant boat landings bring ‘chaos’ to San Diego beaches,2024-04-15T05:00:08Z,Dav32qSVXp4,297871,3532,1800.0
Fox News,&#39;WEAKNESS&#39;: Trump slams Biden for not deterring Iran&#39;s attack,2024-04-15T03:00:19Z,PMEjggFVCqM,51715,1259,944.0
Fox News,Anti-Israel protesters applaud Iranian attack,2024-04-15T02:00:14Z,RHgYp6kRWOQ,90924,1999,1212.0
Fox News,This is an absurd case: Jonathan Turley #shorts,2024-04-15T01:00:19Z,RxSGvTnwHiM,70025,3071,466.0
Fox News,"Crisis in California: An illegal immigrant, $6,500 and a plan for DoorDash",2024-04-15T01:00:09Z,OLYdQ_1iZyg,225185,4460,1802.0
Fox News,&#39;INEFFECTIVE LEADERSHIP&#39;: Rand Paul slams Speaker Johnson for &#39;siding with Democrats&#39;,2024-04-15T00:00:12Z,TwSMohIXrPw,170243,3963,1318.0
CNN,Israel vows to ‘exact a price’ after Iran attack,2024-04-15T23:58:02Z,aguehKDFfR8,158173,1223,1072.0
CNN,This is what McDougal said about Trump in 2018,2024-04-15T23:06:48Z,TxmnLktjgxU,352866,3433,1177.0
CNN,Judge admonishes ‘Rust’ armorer during sentencing,2024-04-15T22:27:41Z,hEtAjvX61DA,238449,5697,567.0
CNN,Beijing Half Marathon under investigation after a controversial finish,2024-04-15T22:00:09Z,NpJ0XMwqPng,263505,5851,729.0
CNN,Judge admonishes ‘Rust’ movie armorer before sentencing,2024-04-15T21:53:52Z,BLN7VXOejEo,257347,3598,3195.0
CNN,Why Arizona Matters So Much,2024-04-15T21:18:10Z,iXHeFPmVwGw,9037,82,74.0
CNN,John Dean predicts how long jury selection could last in Trump criminal trial,2024-04-15T21:05:00Z,T7bA4Mv0cqQ,107411,1712,660.0
CNN,Reporter describes potential jurors’ behavior inside courtroom,2024-04-15T20:27:19Z,OyOsHrw7xvo,143483,2350,907.0
CNN,Brawl erupts as parliament considers controversial bill,2024-04-15T20:10:58Z,jxbNXhaZ6qU,41508,891,99.0
CNN,‘Biting his lower lip’: CNN reporter describes Trump’s demeanor in court,2024-04-15T17:46:19Z,_KksSejTN9s,734610,9594,3113.0
CNN,Prosecutors ask judge to sanction Trump over social posts,2024-04-15T16:49:02Z,84eepK4nWmI,626828,11784,3169.0
CNN,Collins on Trump&#39;s statement outside court: He did say one thing that is accurate,2024-04-15T14:42:52Z,Y7wNDVof8QY,418634,6808,5462.0
CNN,How we got here: The Donald Trump-Stormy Daniels hush money case,2024-04-15T13:32:40Z,2JmGQI8Yq8g,137274,1587,1023.0
CNN,Attorney: Manhattan jury pool selection &#39;tough&#39; for Trump,2024-04-15T11:58:27Z,vJ3hUui7Fq0,121816,1625,944.0
CNN,&#39;It&#39;s a very big deal&#39;: Petraeus on the significance of Iran&#39;s attack,2024-04-15T11:23:01Z,gAQMmtiCuG4,253356,2309,1139.0
CNN,Iran &#39;clearly wanted to telegraph this&#39;: Retired colonel on how US got intel ahead of attack,2024-04-15T01:15:00Z,3ceZd93ahpk,881109,6386,3431.0
CNN,&#39;We are not seeking war&#39; after Iran&#39;s attack: Israeli President Herzog,2024-04-15T00:45:31Z,waff-GuGZlE,145305,1488,1997.0
NBC News,Jury selection begins in Trump&#39;s hush money trial,2024-04-15T23:31:32Z,CF9AzGrJFsI,25335,555,239.0
NBC News,Gaza City bakery reopens drawing large crowds waiting to buy bread,2024-04-15T23:15:02Z,yhiaSyyVNR0,6919,65,37.0
NBC News,House Speaker Mike Johnson weighs options with foreign aid bill,2024-04-15T23:00:06Z,98prCzEe1gU,23532,217,254.0
NBC News,Meet the Press NOW — April 15,2024-04-15T22:45:00Z,J8GQTvFaxyE,287576,1450,361.0
NBC News,Supreme Court allows Idaho ban on gender affirming care for transgender minors,2024-04-15T22:30:06Z,qFhcpdvWBvU,263733,3395,4379.0
NBC News,Middle East expert: Iranian strikes were meant as a ‘cease and desist message’ to Israel,2024-04-15T22:00:25Z,nwjAn3lEO5Y,19393,104,75.0
NBC News,Trump calls hush money trial a ‘scam’ at end of first day,2024-04-15T21:30:05Z,Q2hhGJGmNnQ,26593,282,445.0
NBC News,Coral scientists explain how coral bleaching happens,2024-04-15T21:00:21Z,N6CtDLt2WJI,24691,152,29.0
NBC News,&#39;Dinks&#39; explained: The lifestyle of families with two incomes and no kids,2024-04-15T20:30:07Z,waxLs3-Ea-E,34846,470,201.0
NBC News,Video shows Ohio man confront Uber driver before fatal shooting,2024-04-15T20:15:00Z,P3ut__kV3KE,3763334,34101,22733.0
NBC News,Kari Lake warns things will get &#39;intense&#39; ahead of the general election,2024-04-15T20:00:05Z,Hvmkezc2hzs,4503,43,98.0
NBC News,"Man steals SUV, narrowly misses hitting family while trying to flee",2024-04-15T19:45:01Z,xQPOEyA7obc,17747,258,8.0
NBC News,Bishop stabbed during livestreamed Sydney church service,2024-04-15T19:32:54Z,IvNnafBYrHc,35642,268,369.0
NBC News,Video shows armed thieves ransack California jewelry store,2024-04-15T19:15:00Z,8OJ77hZMxtA,7174,61,44.0
NBC News,&#39;Rust&#39; armorer sentenced to 18 months in prison after fatal shooting,2024-04-15T19:00:30Z,lzpkmguQJqk,12532,79,129.0
NBC News,Watch: White House holds press briefing | NBC News,2024-04-15T18:47:37Z,ZsnLr4oxr58,16024,233,40.0
NBC News,Emotional impact statements offered ahead of &#39;Rust&#39; armorer sentencing,2024-04-15T18:30:17Z,EgKfSgvNfFw,2367,20,9.0
NBC News,Breaker Sunny Choi on training for Olympics,2024-04-15T17:59:58Z,2zvBA8VFZTs,1087,16,2.0
NBC News,Caitlin Clark wrote down her WNBA dreams in second grade,2024-04-15T17:56:33Z,IVcFPAMgR5o,7988,166,5.0
NBC News,Biden discusses Iran&#39;s &#39;unprecedented&#39; aerial attack on Israel,2024-04-15T17:38:09Z,ZqQGxjBH-08,7110,61,96.0
NBC News,Bodies recovered in search for missing Oklahoma women,2024-04-15T17:36:45Z,3EDB66y-x20,86608,1149,190.0
NBC News,Georgian lawmakers came to blows in parliament,2024-04-15T15:56:57Z,9KKVe6MDORo,12395,294,31.0
NBC News,Morning News NOW Full Broadcast - April 15,2024-04-15T15:34:52Z,IUG9trVfmmI,259784,868,174.0
NBC News,Jury selection begins in Donald Trump hush money criminal trial,2024-04-15T14:50:31Z,6MuB42HBpfw,16720,166,160.0
NBC News,Trump arrives at courthouse for hush money criminal trial | NBC News Special Report,2024-04-15T14:09:29Z,OCSD1f3PHAc,171820,2357,1258.0
NBC News,Ukraine&#39;s Zelenskyy calls for air defenses like those that protected Israel against Iran&#39;s attack,2024-04-15T14:00:26Z,mddvgsWpZlo,42266,514,1189.0
NBC News,This Morning’s Top Headlines – April 15,2024-04-15T12:45:48Z,FWE-SoRUeg0,96101,537,125.0
NBC News,Sydney stabbing assailant&#39;s parents say he was a &#39;very sick boy&#39;,2024-04-15T12:00:34Z,Z7THTMSPe1g,120455,1323,692.0
NBC News,Police officer and sheriff&#39;s deputy killed in Syracuse shootout,2024-04-15T11:30:02Z,2JcIf5S_fJ4,10780,69,62.0
NBC News,&#39;You&#39;re incredible:&#39; Biden thanks U.S. fighter squadrons that helped defend Israel,2024-04-15T11:00:08Z,52kVh0LENUU,6507,70,77.0
NBC News,Legacy of the Boston Marathon’s beloved official dog lives on,2024-04-15T03:00:08Z,JeMUB7CtyK4,7967,170,17.0
NBC News,An American in Paris: the carpenter from New England helping rebuild Notre Dame Cathedral,2024-04-15T02:30:24Z,vuUt0oNg_eM,59564,668,95.0
NBC News,Nightly News Full Broadcast - April 14,2024-04-15T02:10:14Z,PElnj24LkJE,671976,6854,1194.0
NBC News,"‘Burglary tourists’ enter U.S. legally then break into homes, according to law enforcement officials",2024-04-15T01:00:00Z,16qGw1BlLtc,47328,437,265.0
NBC News,Arrests made in connection to disappearance of two Kansas moms,2024-04-15T00:30:14Z,Rv-GQ6Ce0z4,143177,1501,226.0
NBC News,Jury selection set to begin in criminal trial over Trump’s alleged hush money scheme,2024-04-15T00:00:09Z,R6krXbNzgwk,20071,125,200.0
BBC News,Israel’s top general says Iran faces retaliation despite calls for restraint | BBC News,2024-04-15T22:43:34Z,lHggWT2iLdo,511368,3615,2438.0
BBC News,What to know about Donald Trump’s hush-money case | BBC News,2024-04-15T21:37:25Z,81KuN24c1Bw,18319,240,253.0
BBC News,Liz Truss says the “world was safer” when Donald Trump was the president of the US. #Shorts #BBCNews,2024-04-15T21:11:44Z,HrtLsyeU6w0,32763,703,442.0
BBC News,Rust armourer sentenced to 18 months for Halyna Hutchins&#39; death. #BBCNews,2024-04-15T19:30:22Z,RAk66pxzPmM,23604,511,102.0
BBC News,Titanic survivor recalls disaster: &#39;I shall probably dream about it tonight&#39; | BBC News,2024-04-15T19:00:14Z,XDInt_k8Dmc,42157,932,154.0
BBC News,"Corals turning white and dying after record heat, say scientists | BBC News",2024-04-15T17:30:02Z,TTUsxD62398,31048,369,556.0
BBC News,Sarah Snook wins best actress at Sunday&#39;s Olivier Awards. #OlivierAwards #Shorts #BBCNews,2024-04-15T16:30:10Z,d6ihkKOXvkk,13243,249,8.0
BBC News,Donald Trump in court for historic hush-money trial | BBC News,2024-04-15T16:00:22Z,JWKtR0wh-UE,38989,796,475.0
BBC News,Israel allies urge &#39;restraint&#39; instead of reaction after Iran drone attack | BBC News,2024-04-15T15:00:19Z,ESjBr9JAgRc,115371,855,787.0
BBC News,Sir Salman Rushdie speaks about stabbing two years ago. #SalmanRushdie #Shorts #BBCNews,2024-04-15T14:30:02Z,4iY6tBSumeQ,22498,489,123.0
BBC News,India election: How Prime Minister Modi&#39;s ruling party is trying to reach southern voters | BBC News,2024-04-15T13:00:32Z,Xiklf9r6EjU,23645,223,253.0
BBC News,Nicole Scherzinger wins acting award at Sunday&#39;s Olivier Awards. #OlivierAwards #Shorts #BBCNews,2024-04-15T12:43:29Z,FqusauLg4HQ,15582,370,35.0
BBC News,Sir Salman Rushdie recalls New York knife attack two years on | BBC News,2024-04-15T11:30:07Z,E2pm70Cfyjs,22648,371,276.0
BBC News,Sudan: Millions driven to extreme hunger in war-ravaged country | BBC News,2024-04-15T10:30:16Z,w6Ln1QB-7zk,27647,299,163.0
BBC News,Donald Trump&#39;s historic &#39;hush money&#39; trial to begin in New York | BBC News,2024-04-15T09:30:02Z,8TuSRVjOBDY,26930,619,512.0
BBC News,"Iran&#39;s attack on Israel has Middle East on the &#39;brink&#39;, warns UN chief | BBC News",2024-04-15T08:09:14Z,TcLlZW7Vh8A,399288,3789,2326.0
Al Jazeera English,Video captures attacker stabbing Assyrian Orthodox bishop in Sydney | AJ #Shorts,2024-04-15T20:11:58Z,-j1pkcdNXxw,43076,1530,394.0
Al Jazeera English,Donald Trump attends first day of ‘hush money’ criminal trial | Al Jazeera Newsfeed,2024-04-15T19:55:03Z,Mu0tHuvFNeY,8237,70,33.0
Al Jazeera English,US commitment to Israel’s security ‘sacrosanct’: US State Department,2024-04-15T18:45:00Z,SZODCnDmqBY,17344,193,228.0
Al Jazeera English,‘We’re on the edge’: Palestinians terrified by Israeli settler violence,2024-04-15T18:30:40Z,wLInUgFCcSg,12160,380,144.0
Al Jazeera English,Devastating floods in Afghanistan claim lives and cause destruction | AJ #shorts,2024-04-15T18:31:01Z,B_kQfSFn5jg,30620,1501,66.0
Al Jazeera English,Will Israel respond to Iran&#39;s first ever direct attack? | Inside Story,2024-04-15T17:45:00Z,WSQ8lCLf9us,162659,1687,668.0
Al Jazeera English,Global awareness about the conflict in Sudan has been pushed into the shadows: Guterres,2024-04-15T17:30:00Z,6xE8b_wd_7c,3618,71,12.0
Al Jazeera English,Sudan&#39;s women bear brunt of war as gender-based violence reaches crisis levels,2024-04-15T17:15:00Z,KihmmRZkPG4,2730,90,22.0
Al Jazeera English,Level of brutality against civilians in Sudan&#39;s war reached unprecedented heights: UNHCR,2024-04-15T16:53:51Z,mWyjIQw0vr0,4017,127,62.0
Al Jazeera English,Notre-Dame fire: Paris cathedral may reopen later this year,2024-04-15T16:30:02Z,Cwi_ibOZydU,2799,60,17.0
Al Jazeera English,Controversial law sparks fight in Georgian parliament | Al Jazeera Newsfeed,2024-04-15T16:21:19Z,kHz0ZkL5v3c,27562,267,272.0
Al Jazeera English,“Bracing for the worst”: Pride and fear in Iran after attack on Israel | Al Jazeera Newsfeed,2024-04-15T15:46:19Z,CVj-ZhwztT0,38256,525,212.0
Al Jazeera English,How Iran’s attack on Israel unfolded | The Take,2024-04-15T15:40:49Z,oyx8lO2XOl4,288811,4496,871.0
Al Jazeera English,Injury of four Israeli soldiers happened inside Lebanon: Military,2024-04-15T15:34:05Z,bvTy9jq0HXk,243782,3016,711.0
Al Jazeera English,Donald Trump in court: Jury selection begins in &#39;Hush Money&#39; case,2024-04-15T15:15:00Z,8l3XGwAatmE,2805,50,10.0
Al Jazeera English,Mass grave found in Gaza: Bodies found in grounds of al-Shifa hospital,2024-04-15T15:00:06Z,7zNfwgxtIK8,60020,2043,768.0
Al Jazeera English,Hong Kong civil Liberties: Govt pushes national security law in schools,2024-04-15T14:30:06Z,AIHAjUdWORA,1670,34,15.0
Al Jazeera English,West should ‘appreciate Iran’s restraint’ towards Israel: Iran’s Foreign Ministry spokesman,2024-04-15T14:00:36Z,mVtm1cxeWYA,52310,921,377.0
Al Jazeera English,"A year of Sudan war forced more than 500,000 people to flee to Chad",2024-04-15T13:45:05Z,ugiTdvU56Nk,2851,78,12.0
Al Jazeera English,Sudanese refugees face gruelling wait in overcrowded South Sudan camps,2024-04-15T13:37:02Z,Lx1TaSZm38c,3069,80,16.0
Al Jazeera English,Palestinians come under Israeli fire as they attempt return to north Gaza | Al Jazeera Newsfeed,2024-04-15T13:11:03Z,4YZmtq2DM9Y,75280,1526,597.0
Al Jazeera English,Jellyfish invasion disrupts Venezuela’s fishing and tourism,2024-04-15T13:08:45Z,6Ce4XXkCaPI,7590,49,11.0
Al Jazeera English,Accusations of ‘double standards’ at UN after Iran’s attack on Israel | Al Jazeera Newsfeed,2024-04-15T12:56:07Z,EORBwh8fCsw,63138,1122,461.0
Al Jazeera English,UN warns of ‘catastrophic’ hunger crisis looming in Sudan,2024-04-15T12:27:51Z,Pr-dw3876fQ,3328,87,15.0
Al Jazeera English,"Israeli settlers set fire to cars, homes of Palestinians under occupation",2024-04-15T12:26:23Z,iIfGIYYeE_U,11427,431,239.0
Al Jazeera English,"Self-defence ok for Israel, not Iran is ‘clearly bunkum’| Quotable",2024-04-15T11:15:07Z,N3Z27PxpxSo,243612,24830,1075.0
Al Jazeera English,What is Donald Trump’s ‘hush money’ trial all about?,2024-04-15T11:10:59Z,9Ov6-H4rPOA,2804,43,9.0
Al Jazeera English,Israeli air base damaged following Iran attack,2024-04-15T10:53:37Z,07Uev5sdVjU,406658,4285,1580.0
Al Jazeera English,The dangers of investigative journalism in Ukraine | The Listening Post,2024-04-15T10:50:46Z,ekK5sVKAb8I,17697,626,100.0
Al Jazeera English,The Indian political ads flouting social media AI rules | Al Jazeera Newsfeed,2024-04-15T10:37:12Z,uU0gR7M_ISE,11988,292,248.0
Al Jazeera English,Heavy rain and flash flooding hits Oman | AJ #shorts,2024-04-15T10:14:54Z,D4C1tDkZlnI,49012,1878,135.0
Al Jazeera English,"A year of Sudan war: Mass displacement, violence and violations",2024-04-15T09:15:11Z,wObfk0ZvPuM,8884,115,39.0
Al Jazeera English,"Nigeria’s Chibok girls kidnapping: 10 years later, a struggle to move on",2024-04-15T07:47:39Z,66E6h3OLN7E,2706,54,15.0
Al Jazeera English,War and famine in Sudan: How did we get here?,2024-04-15T06:43:10Z,ZlfqlFkWplE,6055,162,45.0
Al Jazeera English,Thousands of displaced Palestinians try to return to homes in north Gaza,2024-04-15T06:01:02Z,FMWNMZCXILo,21323,793,229.0
Al Jazeera English,Iran’s attack on Israel: Antonio Guterres calls for restraint at UNSC meeting,2024-04-15T04:56:11Z,JylgXZcPQ0E,62450,974,606.0
Al Jazeera English,Israeli war cabinet split on retaliation to Iranian attack,2024-04-15T04:15:51Z,O2ypf81Jpgs,96794,1048,640.0
Al Jazeera English,Iran claims ‘right to self-defence&#39; in Israel attack | Al Jazeera Newsfeed,2024-04-15T00:13:24Z,_2Qe6KbKgko,91955,3261,903.0
ABC News,Avalanche barrels down Argentine mountaine,2024-04-27T22:00:33Z,oreRV3HX8O4,576065,19634,236.0
ABC News,Tornadoes rip through Nebraska,2024-04-27T19:45:00Z,1avCSwZ1dsU,405243,17269,426.0
ABC News,Millions on alert for tornadoes,2024-04-27T18:00:09Z,Otc4k-CjJ_0,151410,971,301.0
ABC News,Southwest Airlines pulling out of 4 airports,2024-04-27T17:30:00Z,awT0uoLBXVE,92438,180,30.0
ABC News,Colorado paramedic sentenced to 4 years for Elijah McClain&#39;s death,2024-04-27T17:00:27Z,g8OSFg_sbfQ,14760,451,130.0
ABC News,"Student group brings Palestinians, Jews together in dialogue",2024-04-27T16:35:48Z,QY25eFZIjvI,40343,991,410.0
ABC News,Protests continue to breakout on campuses across the country,2024-04-27T16:30:00Z,3cNI-f_-9wk,14231,156,276.0
ABC News,"Man rows 5,000 miles solo from Hawaii to Australia",2024-04-27T10:00:39Z,jzikpDB0mf4,7609,103,18.0
ABC News,Grandma goes viral reading to her grandson over YouTube,2024-04-27T09:00:19Z,RtbdFLUJ64Q,2880,38,6.0
ABC News,Protests erupting across college campuses reach boiling point,2024-04-27T08:07:40Z,5d3AYAPYc38,612178,4861,8881.0
ABC News,Tornado touches down in Kansas,2024-04-27T06:58:02Z,dgP7KpZ2fJM,180104,6073,267.0
ABC News,"Actress Melissa Barrera on &#39;Abigail,&#39; acting since departure from &#39;Scream&#39;",2024-04-27T05:00:15Z,ca_qRMPTA-I,75465,2129,370.0
ABC News,Drag queens of HBO’s “WE’RE HERE” risk arrest to change minds,2024-04-27T04:00:17Z,YUd-SZXvQbk,68625,2691,536.0
ABC News,"ABC News Live - Friday, April 26 | ABC News",2024-04-27T03:20:41Z,UhgiGT2fpis,105494,550,
ABC News,1 cruise company looks to make a difference preserving marine life,2024-04-27T03:00:20Z,fPBh_N1SDWY,18514,238,37.0
ABC News,"ABC World News Tonight with David Muir Full Broadcast - April 26, 2024",2024-04-27T02:00:07Z,ETuFWKalzG0,528935,5122,695.0
ABC News,Trump’s former assistant takes the stand,2024-04-27T01:26:54Z,nhyaonsTfqQ,6702,75,22.0
ABC News,Emergency slide falls off Delta flight in midair,2024-04-27T00:05:43Z,INJECroLFko,127030,1091,790.0
Fox News,GWU student sends message to Biden: &#39;Israel isn&#39;t going anywhere&#39;,2024-04-27T23:00:13Z,XIN3JYId_80,190592,6781,
Fox News,"The border is not a money issue, it’s a policy issue: Former border patrol chief",2024-04-27T22:00:30Z,hI9xoKjU42Y,30723,902,722.0
Fox News,‘DON’T NEGOTIATE’: Colleges slammed for handling of anti-Israel demonstrations #shorts,2024-04-27T22:00:14Z,GUBnxhqADcI,34791,2371,168.0
Fox News,Columbia bans student protestor for saying ‘Zionists don’t deserve to live’,2024-04-27T21:15:00Z,pyYlzIz4CdY,79689,2159,1020.0
Fox News,It is ‘critically important’ that the US continue backing Israel: Gen. Perkins,2024-04-27T20:30:00Z,1Ofsttn96Zo,23016,657,481.0
Fox News,This is the biggest disappointment from the Biden admin: Pompeo,2024-04-27T19:45:00Z,7O3aoigvAIk,85689,2444,704.0
Fox News,Andy McCarthy: What did Trump do that made these payments illegal?,2024-04-27T19:00:21Z,sqPC3p3WohI,85355,2669,1151.0
Fox News,Americans spend nearly $500 more a year in tips: Survey #shorts,2024-04-27T19:00:32Z,ynJzKrzQO2k,39404,1196,224.0
Fox News,&#39;Crime doesn&#39;t discriminate&#39;: Schiff challenger sounds off on luggage theft,2024-04-27T18:15:01Z,JBc_6LcmzEA,74054,1691,595.0
Fox News,Biden touts to Howard Stern he is ‘happy’ to debate Trump,2024-04-27T17:30:04Z,SGgqRBbqaWE,42579,809,1049.0
Fox News,&#39;CLEAN THIS UP&#39;: Report finds food delivery apps pay migrant workers,2024-04-27T16:45:04Z,pxXSoLIRijE,123977,2257,1371.0
Fox News,&#39;AIN&#39;T NO CRIME HERE&#39;: Legal expert says the prosecution hasn&#39;t thrown any punches at Trump,2024-04-27T16:00:38Z,itPYOVsAZpg,110138,2721,1243.0
Fox News,‘TRY IT’: Young Americans skipping out on college for trade jobs,2024-04-27T15:15:03Z,mdPb-sgOIJU,22220,683,451.0
Fox News,Gregg Jarrett says NY v. Trump is an ‘egregious abuse’ of the legal system #shorts,2024-04-27T15:00:15Z,IC2gbqgudGo,65227,6568,531.0
Fox News,&#39;VERY SAD&#39;: USC senior reacts to commencement cancellation amid protests,2024-04-27T14:30:12Z,_rpYAIhGLPY,82436,1248,875.0
Fox News,This is ‘far from a smoking gun’: Former acting AG,2024-04-27T13:45:00Z,MAgrKUKzPgs,63239,1377,739.0
Fox News,Karine Jean-Pierre&#39;s job was not awarded to her based on performance: Joe Concha,2024-04-27T13:00:03Z,1hNju_BdoQ4,118173,2490,1143.0
Fox News,Jordan torches NY v Trump as the former president misses wife&#39;s birthday,2024-04-27T11:00:20Z,RpB6PylokV0,122419,6413,2044.0
Fox News,Gutfeld: Thieves show no respect for Congressman Pencilneck,2024-04-27T10:00:24Z,JEbqvLrW68A,354209,12021,843.0
Fox News,Levin eviscerates NY v. Trump: Judicial &#39;whack-a-mole&#39;,2024-04-27T09:00:24Z,b67vn33rd-A,61564,3012,759.0
Fox News,Biden’s latest claim in Howard Stern interview,2024-04-27T08:00:18Z,ZEFka7Gz0Zw,67940,2345,1364.0
Fox News,&#39;NO CRIMES HERE&#39;: Legal expert slams Alvin Bragg for &#39;indictment about nothing&#39;,2024-04-27T07:00:33Z,xI7v6LETvQI,37735,1439,530.0
Fox News,I’ll be ‘shocked’ if Biden does this: Jason Chaffetz,2024-04-27T06:00:07Z,C7C2tsNSWeQ,92382,1131,729.0
Fox News,&#39;What are we doing here?&#39;: Prosecution&#39;s Trump case faces mockery,2024-04-27T05:00:24Z,sC2qn-PFRnE,408949,6865,2022.0
Fox News,&#39;Gutfeld!&#39;: When AI gets too intelligent,2024-04-27T03:48:45Z,oujreiieTwg,168166,6135,399.0
Fox News,Hannity: Biden&#39;s sit-down with Howard Stern raises eyebrows,2024-04-27T02:30:04Z,AWJn01OMfeQ,156273,4805,2348.0
Fox News,Jesse Watters: Things are so bad for Biden,2024-04-27T01:45:00Z,a1EDLjgkP6k,193197,8329,1701.0
Fox News,Laura Ingraham: CNN is getting &#39;nervous&#39; about this,2024-04-27T01:07:21Z,gywi1na-Udk,252254,9269,1589.0
Fox News,Gutfeld: It&#39;s a protest for the &#39;pathetic&#39;,2024-04-27T00:15:00Z,7zY0H2SIKyY,122512,4279,1172.0
CNN,Hear what John Dean says is keeping him &#39;on the edge of my seat&#39; in Trump hush money trial,2024-04-27T21:48:06Z,0EzGb8JmjMY,258993,3677,903.0
CNN,See what happens when Trump supporter talks to CNN reporter about the Constitution,2024-04-27T20:30:02Z,Q5dovP0vWkw,500515,8855,4269.0
CNN,Former judge reacts to Pecker’s testimony in Trump trial,2024-04-27T19:45:02Z,tTmVI7Afoc8,154683,2094,474.0
CNN,Why NYU professor says instructors who are protesting should be fired,2024-04-27T18:52:34Z,j0-1HFbNUsc,201609,3166,3900.0
