channel_name,video_title,published_at,video_id,view_count,like_count,comment_count
NBC News,NBA player banned for life for gambling,2024-04-18T00:45:00Z,7dmDN-CPF2A,19769,130,118.0
NBC News,Biden calls for much higher tariffs on Chinese steel and aluminum imports,2024-04-18T00:30:31Z,jpvFktKfWwk,4757,38,81.0
NBC News,Boeing whistleblowers appear at congressional hearing,2024-04-18T00:15:00Z,OJRixX4kRhs,5180,46,29.0
NBC News,Columbia University president testifies about antisemitism on campus,2024-04-18T00:00:15Z,bkXSZnWo5hU,7531,31,43.0
BBC News,China’s boom in green manufactured goods fuels tensions with West | BBC News,2024-04-18T22:49:46Z,uIVnMBGckV8,112023,1345,866.0
BBC News,Cloud seeding involves manipulating clouds to help produce more rain. #Shorts #Dubai #BBCNews,2024-04-18T22:00:40Z,yJXsjlU4y8M,33641,801,99.0
BBC News,Elon Musk predicts AI will be smarter than humans by next year | BBC News,2024-04-18T21:45:00Z,P71UeRTzlaM,68128,1001,498.0
BBC News,Iran sanctions: US and UK extend measures against Tehran | BBC News,2024-04-18T21:15:01Z,oeO-osUXe5A,48440,482,408.0
BBC News,German police arrest suspected Russian spies | BBC News,2024-04-18T21:00:22Z,d3KW4D13_kk,37879,758,109.0
BBC News,Ukraine warns of WW3 ahead of long-stalled Congress aid vote | BBC News,2024-04-18T20:00:08Z,DRldheclBeI,52261,647,568.0
BBC News,Dubai airport chaos after Gulf storms | BBC News,2024-04-18T19:15:00Z,Ljv6RKKs3W0,806046,3403,523.0
BBC News,Ballerinas break world record standing &#39;en pointe’. #Ballet #Shorts #BBCNews,2024-04-18T16:45:00Z,GOS71DwOkRI,22569,562,23.0
BBC News,Invasive species of ants will cost Australians more than $22bn if left to run rampant | BBC News,2024-04-18T15:45:00Z,7xxCjaeqHyg,50559,837,218.0
BBC News,Rihanna says she &#39;refused&#39; to buy maternity clothes. #Shorts #Rihanna #BBCNews,2024-04-18T14:34:39Z,ejZKNjFK8Os,27987,664,75.0
BBC News,Qatar reassessing its role as mediator between Israel and Hamas | BBC News,2024-04-18T13:30:09Z,PS44XnG6FvU,61730,762,359.0
BBC News,"Deadly Africa heat caused by climate change, scientists say | BBC News",2024-04-18T12:30:04Z,4983ibLEagk,46245,801,454.0
BBC News,Volcano in Indonesia spews lava and smoke. #Shorts #BBCNews,2024-04-18T11:30:12Z,OndBKN0WmoY,27009,981,59.0
BBC News,Police bust cyber gang accused of fraud worldwide | BBC News,2024-04-18T08:10:26Z,8Q21gXWIPyU,57053,1022,
Al Jazeera English,US showing it’s ‘my way or the highway’ with UNSC veto: Marwan Bishara,2024-04-18T23:28:48Z,ssHvBc0f7zs,205404,4409,1679.0
Al Jazeera English,"‘Unfair, unethical and unjustified’: Palestine responds to US veto",2024-04-18T22:34:45Z,36Su0I-gHvM,126959,4321,1866.0
Al Jazeera English,The White House says it will soon announce a new round of sanctions against Iran,2024-04-18T20:53:53Z,JG0iW0gbbyY,23653,257,209.0
Al Jazeera English,Police crack down on Gaza protest at Columbia University,2024-04-18T20:53:21Z,eIOj0UCtO1o,12570,420,160.0
Al Jazeera English,Is political unity in Somalia achievable? | Inside Story,2024-04-18T20:30:03Z,S3ro_q-kiIQ,72289,980,408.0
Al Jazeera English,How do Muslims in India feel about the general election? | Al Jazeera Newsfeed,2024-04-18T20:28:54Z,SbZ2E0pyH3I,27082,752,755.0
Al Jazeera English,UN Security Council is meeting over situation in Gaza and tensions between Israel and Iran,2024-04-18T20:11:51Z,Zx1rSL71Dh8,25273,809,141.0
Al Jazeera English,German far-right politician on trial for alleged use of banned Nazi slogan,2024-04-18T19:30:01Z,BsnVhGgJT-0,8395,149,77.0
Al Jazeera English,"After Iran struck Israel, how did Jordan and Lebanon react? | The Take",2024-04-18T19:13:28Z,cfVV7A4g8aM,154627,2302,567.0
Al Jazeera English,Nigeria vigilante groups: Local patrols forming to prevent kidnappings,2024-04-18T18:58:10Z,2XtzoFg9uw8,6991,117,28.0
Al Jazeera English,US and UK imposed a new round of sanctions on Iran,2024-04-18T18:08:33Z,QGR6oQ69Nc0,18059,263,233.0
Al Jazeera English,Jeffrey Sachs on why the United Nations should vote for Palestinian statehood | UpFront Web Extra,2024-04-18T17:16:55Z,zrA7a0k7Lc4,75484,2476,562.0
Al Jazeera English,Horrors of Gaza wins &#39;Picture of the Year&#39; at the World Press Photo awards,2024-04-18T16:30:00Z,0QTDWCWo900,23703,760,166.0
Al Jazeera English,Why is Germany maintaining economic ties with China? | Counting the Cost,2024-04-18T15:52:28Z,NTu_3eQVU3E,40624,396,155.0
Al Jazeera English,Israel says Palestine full UN membership bid is for political interest,2024-04-18T15:45:01Z,dybH9H3XqYk,29017,395,928.0
Al Jazeera English,‘Palestinian state could not be harm to peace’: Palestinian representative to the UN,2024-04-18T15:31:45Z,HjglTsEFNlo,31385,807,408.0
Al Jazeera English,Gaza a ‘humanitarian hellscape’: UN chief,2024-04-18T15:15:10Z,UfMu6oR4R8U,18669,599,225.0
Al Jazeera English,Students rename Canadian university buildings after Palestinian places | AJ #Shorts,2024-04-18T14:47:54Z,GUjjmcNU_v8,277539,22945,1334.0
Al Jazeera English,How did Iran approach its attack on Israel? | Project Force,2024-04-18T14:41:04Z,JBc24beLdC4,151099,5544,335.0
Al Jazeera English,How did Iran approach its attack on Israel? | Project Force,2024-04-18T14:39:06Z,XfFQ8pfuVdo,69646,1318,198.0
Al Jazeera English,First of seven phases of the Indian national election is set to kick off on April 19,2024-04-18T14:36:01Z,5h563EtPmaA,4272,83,58.0
Al Jazeera English,"When is violence, terrorism and when is it mental illness? | Al Jazeera Newsfeed",2024-04-18T14:32:24Z,a30e1qAPiHc,84943,5927,1252.0
Al Jazeera English,Saving one of Brazilian Amazon’s largest Indigenous tribes | Witness Documentary,2024-04-18T14:00:23Z,_7Lep46Pwfo,10313,185,21.0
Al Jazeera English,Widespread destruction of the Nuseirat refugee camp,2024-04-18T14:00:17Z,FRHNLlE25BA,5859,256,99.0
Al Jazeera English,Israel&#39;s latest plans to seize more lands in the occupied West Bank,2024-04-18T13:36:14Z,Ps2L-zaaOt0,13400,457,158.0
Al Jazeera English,Video shows Palestinian man forced to strip by Israeli soldiers | Al Jazeera Newsfeed,2024-04-18T12:54:18Z,PxD6R6bj6xw,22778,765,732.0
Al Jazeera English,Hezbollah launches missiles and drones at northern Israel,2024-04-18T12:08:22Z,4sB8W1n7pjQ,213175,2864,521.0
Al Jazeera English,Inside the Buddhist nunnery tearing down gender stereotypes in Nepal | 101 East Documentary,2024-04-18T11:30:09Z,Dv3aB1H6m8Y,97256,2712,307.0
Al Jazeera English,Police make multiple arrests in ‘largest gold theft in Canadian history’,2024-04-18T11:21:16Z,KIyNvScT3H0,6131,70,14.0
Al Jazeera English,Kenya&#39;s mission to Haiti: Leaders under pressure to justify intervention,2024-04-18T10:23:04Z,iKrgNijweo4,24696,222,137.0
Al Jazeera English,Boeing whistleblower says firm is ‘putting out defective airplanes’,2024-04-18T09:39:58Z,wU2saMJa-aE,2576,61,9.0
Al Jazeera English,Israel bombs Gaza north to south with five children among the dead,2024-04-18T09:28:47Z,7-ih073S6z0,25493,727,268.0
Al Jazeera English,Qatar ‘re-evaluating’ role as mediator in Israel-Gaza truce talks | AJ #shorts,2024-04-18T09:14:11Z,zi8Y9xODWGo,51284,2029,204.0
Al Jazeera English,War on Gaza: Palestinian children continue their education at a makeshift kindergarten,2024-04-18T07:46:49Z,ptgL-CWyLgc,6710,365,119.0
Al Jazeera English,Indonesia’s Mount Ruang volcano erupts during lightning storm | #AJshorts,2024-04-18T07:43:38Z,Nt16cEz_xJY,28770,1247,52.0
Al Jazeera English,US reimposes sanctions on Venezuela’s oil and gas sectors over election concerns,2024-04-18T06:08:15Z,XIln1-Sn3_Q,30201,357,235.0
Al Jazeera English,Ecuador declares energy emergency amid severe regional drought and El Niño,2024-04-18T04:33:03Z,0LyJrIlmlZA,5304,86,22.0
Al Jazeera English,UNRWA appeals for protection: Agency warns against efforts to dismantle,2024-04-18T02:50:25Z,4taMr7OtLSM,8399,264,100.0
Al Jazeera English,Columbia University protests: Accusations of anti-Semitism on campus,2024-04-18T02:49:31Z,-EjofufPy3s,14557,388,246.0
ABC News,ABC News Prime: 25 tornadoes across 3 states; Crackdown on college protests; Restoring Bahamas beach,2024-04-26T23:59:16Z,In-yyMbA2A0,58036,863,
ABC News,More arrests made as pro-Palestinian protests grow on campuses,2024-04-26T23:50:18Z,3-WrebROSyQ,14280,152,204.0
ABC News,NFL Draft kicks off day 2,2024-04-26T23:35:55Z,GWikWpnEqew,1319,9,1.0
ABC News,Day 8 of former Pres. Trump’s historic criminal hush money trial,2024-04-26T23:21:16Z,I_pp_sGTUnY,194561,986,
ABC News,Blinken in China amid growing concerns over TikTok ban,2024-04-26T22:56:07Z,U16eYwsXCBA,13469,101,63.0
ABC News,Editor-in-chief of Columbia&#39;s student newspaper talks protests on campus,2024-04-26T21:47:31Z,L4F4XaRqhyQ,17745,221,298.0
ABC News,Student protesters demand schools cease US funding of Israeli military,2024-04-26T21:33:53Z,tTEpb1nsrVs,210721,755,2385.0
ABC News,Mortgage rates soar over 7%,2024-04-26T20:30:05Z,bjWE7kqfnpw,20116,128,99.0
ABC News,Biden says he’ll debate Trump in Howard Stern interview,2024-04-26T20:15:01Z,mGJDUX6GuZE,45785,455,1148.0
ABC News,New protests rage across college campuses amid police clashes,2024-04-26T20:00:15Z,jU5jWS-yQjo,16816,139,287.0
ABC News,Day 4 of witness testimonies underway in Trump’s hush money trial,2024-04-26T19:42:31Z,QNp7FmPeHg4,28489,235,56.0
ABC News,Defense officials meet with allies following aid package to Ukraine,2024-04-26T18:33:54Z,0D7zbzGliBk,5209,78,38.0
ABC News,King Charles III to return to public duties amid cancer treatment,2024-04-26T18:16:51Z,ZjW43v_LJOY,7794,89,42.0
ABC News,Trump attorney concedes private acts don’t get immunity during Supreme Court hearing,2024-04-26T17:06:14Z,fqt-CYfhw1k,28440,278,209.0
ABC News,Gisele Bundchen tearful at traffic stop after saying she was being chased by paparazzi,2024-04-26T15:45:06Z,t_RZXX0nHWc,24599,127,203.0
ABC News,Cross-examination of ex-National Enquirer publisher David Pecker resumes,2024-04-26T15:00:09Z,lJFrn3jFdwo,19159,224,79.0
ABC News,U.S. Secret Service takes action against credit card skimming | ABC Exclusive,2024-04-26T15:00:51Z,wKFZX3NcvbE,334111,3245,1050.0
ABC News,Urgent investigation into death of a man in police custody in Ohio,2024-04-26T14:45:02Z,SigQcw4T0CY,17031,117,240.0
ABC News,"Secretary of State Blinken meets with Xi Jinping on issues related to Russia, Taiwan and trade",2024-04-26T14:30:20Z,wCUSoaY3GdQ,9405,78,54.0
ABC News,Testimony set to resume in Trump hush money case,2024-04-26T14:13:02Z,BkwUy2JuRx0,12744,122,47.0
ABC News,Supreme Court considering Trump’s absolute immunity claim,2024-04-26T14:11:45Z,glvZJOPAK7I,31149,337,327.0
ABC News,Manhattan DA vows to retry Harvey Weinstein case,2024-04-26T13:43:54Z,x3Yr_FmtHbg,1549,19,11.0
ABC News,"2024 NFL Draft happens Thursday in Detroit, where college players become pros",2024-04-26T09:31:34Z,rrHb9mfX3WI,4239,73,9.0
ABC News,Ramon Rodríguez talks hit show &#39;Will Trent&#39; and love for his furry co-star,2024-04-26T04:00:02Z,3Vac5RQd8B8,61675,166,26.0
ABC News,Fire broke out at Oceanside pier,2024-04-26T03:36:25Z,nQPJ8pfapPw,140091,3148,155.0
ABC News,Harvey Weinstein&#39;s attorney responds to the Hollywood mogul&#39;s New York conviction being overturned,2024-04-26T03:30:03Z,9k2ygWMUzQY,3733,26,32.0
ABC News,"ABC News Live - Thursday, April 25 | ABC News",2024-04-26T03:21:06Z,_BoH2iXGXe0,115472,818,
ABC News,The Power of Us: Can we intentionally cool the Earth?,2024-04-26T03:00:08Z,IVuW-l-F9TM,4251,57,32.0
ABC News,SCOTUS hears Trump immunity case in historic first,2024-04-26T02:30:31Z,odbfTfxsFGI,2919,45,25.0
ABC News,"ABC World News Tonight with David Muir Full Broadcast - April 25, 2024",2024-04-26T02:00:19Z,pimRIRF_6Sg,466604,4975,762.0
ABC News,David Pecker gives more details of his alleged Trump&#39;s arrangement,2024-04-26T01:32:25Z,sCpH8IZN7Jw,50702,320,368.0
ABC News,ABC News Prime: Trump immunity case; Weinstein rape conviction overturned in NY; Blocking the sun,2024-04-26T00:32:11Z,ENaU15nODS4,43287,656,
Fox News,Judge Jeanine: Biden has &#39;lost it&#39;,2024-04-26T23:30:01Z,6bOzNz-tW28,442091,12912,3208.0
Fox News,&#39;The Five&#39;: Top California Democrats fall victim to crime,2024-04-26T22:45:00Z,XkjxzioEQHA,322113,8191,2052.0
Fox News,"Trump to Biden: I&#39;m &#39;ready, willing and able&#39; to debate– you name where",2024-04-26T22:00:06Z,BaHwcYq1KZY,250930,4327,3618.0
Fox News,Trump lawyer: This is a serious problem,2024-04-26T21:30:02Z,XBJeqs79s6w,559383,11253,3128.0
Fox News,Laura Ingraham: NY v Trump prosecutors are &#39;trying to make a dead dog bark&#39;,2024-04-26T20:45:02Z,dRQxvkpRAU0,104172,3151,847.0
Fox News,Left-wing outlet calls out Biden for ignoring the media,2024-04-26T20:00:09Z,SlEdANlAEBI,58816,1996,767.0
Fox News,"Trump getting $1M in donations each day he&#39;s in court, says RNC chair",2024-04-26T19:15:00Z,2gKuA_9Acyc,97349,2777,1324.0
Fox News,Ilhan Omar pressed on Jewish students&#39; safety at Columbia,2024-04-26T18:30:00Z,a4_gqgDMZBU,325523,5479,3884.0
Fox News,Trump attorney issues chilling warning on immunity case,2024-04-26T17:45:00Z,AbW4PodG_Z0,327972,4071,2702.0
Fox News,Biden says he will debate Trump ahead of November,2024-04-26T17:00:39Z,qIGKShphj6U,168362,3424,2846.0
Fox News,Concerned officials change Biden&#39;s walking routine to Marine One,2024-04-26T16:00:25Z,ZBdQnmrwB-Q,233785,3648,1751.0
Fox News,This case against Trump is collapsing on its own: Turley,2024-04-26T15:30:14Z,YIn43_qOYYM,421851,9691,2282.0
Fox News,Prosecutors in NY v. Trump still haven&#39;t identified a crime,2024-04-26T14:45:02Z,TesxaeuWIOY,181060,3603,1979.0
Fox News,Americans are going to get &#39;crushed&#39; after Trump&#39;s tax cuts expire,2024-04-26T14:00:03Z,5k2YvkgFInU,96900,2492,1124.0
Fox News,This is what the Trump team should be &#39;very concerned about&#39; at NY trial,2024-04-26T13:15:03Z,cBYU_3nT1NQ,103170,2034,1000.0
Fox News,Students hold pro-Israel march in New York City,2024-04-26T12:30:31Z,Xl01CXuUSBM,82139,3111,1587.0
Fox News,"This could further delay Trump&#39;s Jan. 6 trial, criminal defense attorney warns",2024-04-26T11:45:05Z,x1O_KjZbZEg,79000,1175,775.0
Fox News,Gutfeld: Anti-Trump legal pundits are meeting weekly on Zoom,2024-04-26T11:00:37Z,bF6A4pgltCE,177030,6769,605.0
Fox News,Secretary Blinken holds press conference after meeting with Chinese officials,2024-04-26T10:46:57Z,zDMS2Gcx5o4,61942,943,845.0
Fox News,Mark Levin: We have Hitler Youth on our college campuses,2024-04-26T10:00:07Z,9imYtmP4HYM,46514,3303,820.0
Fox News,Vivek Ramaswamy: Biden&#39;s at risk of being the Jimmy Carter of our day,2024-04-26T09:00:08Z,C-zqhxugOPo,234413,5713,2065.0
Fox News,Laura Ingraham: This is insane,2024-04-26T08:30:10Z,XGiGIjSapqw,114666,3006,1559.0
Fox News,Steamfitters union apprentice reveals why he&#39;s leaning towards Trump in 2024,2024-04-26T08:00:01Z,2ry5Nmxg8m0,69449,4288,1003.0
Fox News,"What celebs are, or aren’t, supporting Biden this go-around",2024-04-26T07:00:04Z,CnldFm1n4cU,201433,3555,1154.0
Fox News,Jonathan Turley: This was the &#39;haymaker&#39; in SCOTUS arguments on Trump immunity case,2024-04-26T05:00:26Z,pLLi42Hpkio,865275,11612,2575.0
Fox News,Hannity: This could be a &#39;huge win&#39; for Trump,2024-04-26T03:45:01Z,MoigzhQhHa8,277808,6322,1520.0
Fox News,Gutfeld: Democrats have created a ‘horde of child monsters’,2024-04-26T03:00:07Z,FRaW6GLOgTc,373621,15619,1613.0
Fox News,Jesse Watters: All of this is going to blow the Trump case up,2024-04-26T01:45:00Z,918kryMKcRM,272789,12849,2154.0
Fox News,Ingraham: This is a nightmare scenario for Democrats,2024-04-26T01:00:15Z,h2BvLYpUseE,126473,6391,1340.0
Fox News,Jonathan Turley: NY v Trump case is &#39;collapsing&#39; under its own weight,2024-04-26T00:30:16Z,gUVRN6xgJwY,826899,15490,3740.0
CNN,Trump speaks to reporters after first full week of hush money trial wraps,2024-04-26T21:30:15Z,frIeyWNfW48,74115,1218,1393.0
CNN,Michael Cohen’s banker testifies in Trump hush money trial,2024-04-26T20:56:17Z,0jtkUYluzJw,575887,7801,1527.0
CNN,‘Bravado for his base’: John Dean on Trump saying he’ll testify,2024-04-26T19:45:00Z,6oy5XaKKqAI,224874,2971,667.0
CNN,Iranians warn CNN about possible confrontation with America,2024-04-26T19:11:03Z,FIw0vQUZ4J0,55670,932,344.0
CNN,Jameela Jamil: I don&#39;t practice body positivity,2024-04-26T18:52:49Z,G62HY2uXTSo,19304,537,146.0
CNN,Hear how Trump reacted to Biden saying he&#39;s &#39;happy&#39; to debate him,2024-04-26T18:41:08Z,mDLPansKeQU,418746,6015,4195.0
CNN,Analysis: Defense tries to poke holes in David Pecker&#39;s truthfulness,2024-04-26T17:01:58Z,z_tnKbSLsp0,265127,3633,982.0
CNN,Blinken asked if China is meddling in US elections. Hear his response,2024-04-26T16:23:55Z,t4NMtURYDi0,88350,921,870.0
CNN,Gaza children send message to US student protesters,2024-04-26T15:55:47Z,_PsaOJiX3f4,43942,2551,517.0
CNN,Roberts isn’t happy with previous ruling against Trump – what happens now?,2024-04-26T15:19:32Z,QBahHdi3xw4,645648,6654,5405.0
CNN,US Official: Ammunition headed for Ukraine at ‘very rapid rate’,2024-04-26T13:50:48Z,j7-s8bwkFPE,374039,6090,2087.0
CNN,Ronan Farrow: This is a parallel between Trump and Weinstein’s cases,2024-04-26T12:19:18Z,jTzYx80A2mA,327061,5017,1137.0
CNN,‘Visible difference’: Sketch artist details moment Trump’s behavior changed in court,2024-04-26T11:34:40Z,XyarmPlpMUQ,657766,8708,2055.0
CNN,Pulitzer-winning historian says delayed Trump immunity ruling would be &#39;disaster&#39;,2024-04-26T11:00:25Z,UtcmdQ21gqo,324766,4986,2023.0
CNN,Parents of hostage speak after release of Hamas video showing him alive,2024-04-26T10:00:30Z,JKFjcsKQsuI,25372,405,422.0
CNN,Kaitlan Collins pushes back on Trump attorney&#39;s &#39;brazen&#39; argument over presidential act,2024-04-26T03:11:05Z,U50Mbd4QBIg,217386,3083,2102.0
CNN,Ty Cobb calls possible SCOTUS delay on immunity ruling a win for Trump,2024-04-26T01:15:01Z,lNwq2sS4mPw,179293,1983,1157.0
CNN,George Conway thinks this is ‘worst case scenario’ if Jan 6 trial is delayed,2024-04-26T00:30:20Z,nm1mBPxWt1A,363542,4525,1429.0
NBC News,More than a dozen tornadoes reported in Nebraska and Texas,2024-04-26T23:45:00Z,IFZ3vLZkndw,55193,458,75.0
NBC News,Meet the Press NOW — April 26,2024-04-26T23:42:47Z,5T2jOkFkt5Q,196001,1045,275.0
NBC News,Two new witnesses testify in Trump hush money trial,2024-04-26T23:36:57Z,UwrW6vIxJQc,38668,509,173.0
NBC News,Bus driver attacked in Oklahoma City,2024-04-26T23:15:03Z,xg42ACXvUbo,91291,3568,339.0
NBC News,Video shows a man telling Ohio officers ‘I can’t breathe’ before his death,2024-04-26T22:15:04Z,tTE3M3v2v_g,3326,44,15.0
NBC News,Tennessee governor signs bill allowing teachers to carry guns,2024-04-26T22:00:32Z,hWzleo19CtE,4464,76,107.0
NBC News,Biden talks to Howard Stern as campaign looks to reach voters,2024-04-26T21:30:03Z,ecjrab8IUR8,26678,194,276.0
NBC News,Gaza’s miraculous C-section baby loses her fight to survive,2024-04-26T21:15:05Z,gmm2Tla3C6s,114595,1209,1266.0
NBC News,Former Trump lawyer: Trump &#39;can&#39;t take the stand&#39; in hush money case,2024-04-26T21:00:33Z,oSN-JR-zGOA,108676,1554,446.0
NBC News,Trump lawyers cross-examine David Pecker in hush money trial,2024-04-26T20:00:02Z,3HXu0Vt9zvQ,3713,52,12.0
NBC News,Buckingham Palace says King Charles returning to public duties &#39;shortly&#39;,2024-04-26T19:30:03Z,c-muET0YcfE,1967,29,16.0
NBC News,Campus protests threaten commencement ceremonies,2024-04-26T19:00:09Z,MIsOrZ-ZPA0,9217,75,89.0
NBC News,Fire heavily damages California&#39;s Oceanside Pier,2024-04-26T18:30:04Z,3BSmbczN_bA,65276,658,181.0
NBC News,Body of missing Iowa trucker found months after he disappeared,2024-04-26T18:03:15Z,IKRmRjIPBgA,9128,89,23.0
NBC News,Morning News NOW Full Broadcast - April 26,2024-04-26T15:15:13Z,JT872XmSjq8,345999,1720,484.0
NBC News,Xi Jinping welcomes Antony Blinken as the U.S. and China work to stabilize ties,2024-04-26T13:20:28Z,IMdADUbeSJQ,75860,287,464.0
NBC News,This Morning’s Top Headlines – April 26 | Morning News NOW,2024-04-26T13:11:01Z,EpOuVPACsFU,54408,538,133.0
NBC News,Stay Tuned NOW with Gadi Schwartz - April 25 | NBC News NOW,2024-04-26T10:00:16Z,KMpCcDBLQo4,28241,147,62.0
NBC News,New exhibit in New York re-creates Israeli music festival attacked on October 7,2024-04-26T04:00:33Z,fcZn3MPBv_c,3867,55,49.0
NBC News,Pro-Palestinian demonstrations grow at George Washington University,2024-04-26T03:45:00Z,EYRi5k8O1qw,35105,236,714.0
NBC News,Maryland educator accused of using AI to frame the school&#39;s principal,2024-04-26T03:30:13Z,f7XKP6j44T4,32351,384,232.0
NBC News,Major cities in Mexico running out of water as extreme heat continues,2024-04-26T03:15:02Z,zx9oYkCwfrg,198108,2010,858.0
NBC News,Pro-Israel counter-protesters march near Columbia University,2024-04-26T03:00:11Z,L_tVBquonko,30074,487,525.0
NBC News,Tennessee governor to sign bill allowing teachers to carry guns in school,2024-04-26T02:45:00Z,ALKzjP682Pg,1224,26,51.0
NBC News,Increased threat of Colorado wildfires sparks demand for new tech solutions,2024-04-26T02:30:17Z,kpxUTz8bPEY,2474,27,9.0
NBC News,Israel-Hamas war protests on college campuses,2024-04-26T02:15:00Z,grMeauRMUq8,13169,334,142.0
NBC News,Nightly News Full Broadcast - April 25,2024-04-26T02:00:06Z,Icejjoq-egU,723612,6305,1387.0
NBC News,Top Story with Tom Llamas - April 25 | NBC News NOW,2024-04-26T01:34:55Z,ucsgJT8lbag,137921,453,77.0
NBC News,Ohio police release video of suspect saying &#39;I can&#39;t breathe&#39; before dying,2024-04-26T01:30:09Z,Q8TnQ_nRcdY,12832,159,202.0
NBC News,Hallie Jackson NOW - April 25 | NBC News NOW,2024-04-26T01:15:22Z,vX-tNjAr_2c,285793,1257,246.0
NBC News,Family of American hostage reacts to seeing son in Hamas video,2024-04-26T01:00:00Z,0jENkItQftQ,46807,289,286.0
NBC News,"&#39;I never once cheated,&#39; Reggie Bush says after getting Heisman Trophy back",2024-04-26T00:45:00Z,A5MIkEuWHDg,3777,38,10.0
NBC News,School athletic director arrested for allegedly using A.I. to impersonate voice of principal,2024-04-26T00:30:32Z,wa4f7G4r74Y,10478,102,71.0
NBC News,Pace of economic growth slows as inflation remains stubborn,2024-04-26T00:15:03Z,zcDUojHFafU,1524,15,19.0
NBC News,New York appeals court overturns Weinstein rape conviction,2024-04-26T00:00:15Z,mygGLNflElY,3547,28,13.0
BBC News,Baby saved from dead mother&#39;s womb in Gaza dies | BBC News,2024-04-26T21:45:01Z,1YageCpNr2U,34617,602,419.0
BBC News,Blinken says China helping fuel Russian threat to Ukraine | BBC News,2024-04-26T21:15:01Z,ZgEn28ITJpQ,284439,3992,4139.0
BBC News,King Charles to resume some public engagements as cancer treatment continues | BBC News,2024-04-26T21:13:32Z,dWxCiW9if6o,27571,421,159.0
BBC News,Emma Stone wants you to use her real name. #Shorts #EmmaStone #BBCNews,2024-04-26T19:00:07Z,BNgVS1OiuWs,38537,750,71.0
BBC News,How some AI developers are combatting malicious bots | BBC News,2024-04-26T18:00:21Z,VQ1jXrvJazY,15999,395,66.0
BBC News,King Charles to resume some public duties after cancer treatment. #Shorts #KingCharles #BBCNews,2024-04-26T17:14:34Z,vJisbkhmIsY,23426,702,66.0
BBC News,Dove released in European Parliament chamber by Slovakia member as &quot;symbol of peace&quot;. #BBCNews,2024-04-26T16:30:04Z,JxCaT3J76-4,16729,551,68.0
BBC News,US Supreme Court hears President Trump immunity case | BBC News,2024-04-26T15:00:32Z,Tn6tua-94Es,64337,728,510.0
BBC News,US says China needs to address issue of its support for Russia. #Shorts #US #China,2024-04-26T13:30:02Z,4MhGO0D4l_A,27316,846,303.0
BBC News,"Police arrest Gaza protesters at Emory University, US. #Atlanta #Shorts #BBCNews",2024-04-26T12:30:36Z,tjgIwdiPk38,33781,1062,505.0
BBC News,First ‘personalised’ melanoma skin cancer vaccine trial under way in UK | BBC News,2024-04-26T11:30:04Z,8MDYSq_vIqE,40272,827,340.0
BBC News,Baby saved from dead mother&#39;s womb in Gaza dies. #Shorts #BBCNews,2024-04-26T11:15:01Z,X07Pr8HHjL4,18802,573,81.0
BBC News,Floods cause devastation in Kenya after days of heavy rain. #Nairobi #Shorts #BBCNews,2024-04-26T10:31:39Z,fvaj8y5E0Dg,45210,772,43.0
BBC News,China’s Xi Jinping meets US Secretary of State Antony Blinken | BBC News,2024-04-26T09:45:02Z,t6LFyF5-Mqo,171276,1373,1010.0
BBC News,"Laurence Fox told to pay £180,000 in libel damages | BBC News",2024-04-26T08:02:17Z,kDuZiT75FaU,33484,727,728.0
Al Jazeera English,"With eyes on US college campuses, students stress: ‘Gaza is why we’re here’",2024-04-26T21:23:49Z,TiIxr6DiRHY,132509,3288,833.0
Al Jazeera English,Baby girl rescued from mother’s womb dies | #AJshorts,2024-04-26T20:23:41Z,yYAIr_rWAsQ,131497,9459,357.0
Al Jazeera English,Campus protests are and have always been to &quot;Challenge the status quo&quot; | Quotable,2024-04-26T19:42:04Z,iJWkGsXkX5Y,21317,1831,180.0
Al Jazeera English,Brazil land reform protests: Activists occupy &#39;unproductive&#39; land,2024-04-26T19:39:14Z,dERHIVqgMjI,2682,79,9.0
Al Jazeera English,South Africa Freedom Day: 30 years anniversary of first democratic vote,2024-04-26T19:37:47Z,u7LY2ekM5pM,2639,76,20.0
Al Jazeera English,Australian students join protests for Palestine | Al Jazeera Newsfeed,2024-04-26T18:24:11Z,_Jeo_VyssvE,57166,3369,824.0
Al Jazeera English,Sanders tells Netanyahu it is &quot;Not anti-Semitic&quot; to critise Israel | Quotable,2024-04-26T17:44:39Z,tGXxrdYdfPI,448171,48948,2952.0
Al Jazeera English,Arming genocide? New report documents use of US arms in Israeli war crimes | UpFront,2024-04-26T17:43:05Z,uKPW0xtcTtY,119807,3453,958.0
Al Jazeera English,Trump v. United States | The Take,2024-04-26T17:09:15Z,ESG_qQK7czk,7526,166,59.0
Al Jazeera English,Universities once again become anti-war battle grounds | Al Jazeera Newsfeed,2024-04-26T15:41:06Z,GJcnOq8-jvk,8935,527,77.0
Al Jazeera English,Are colleges obstructing free speech for Pro-Palestinian student activists? | UpFront,2024-04-26T14:01:57Z,f-tJ0_RFNvc,38842,1753,710.0
Al Jazeera English,Student protest in Paris: Dozens are rallying in support for Palestine,2024-04-26T13:11:16Z,C7D6mddbfjM,13500,727,187.0
